"Season","Sector","Category","Crop","QueryType","QueryText","KCCAns","StateName","DistrictName","BlockName","CreatedOn"
"RABI","HORTICULTURE","Vegetables","Tomato","Nutrient Management","Calcium Deficiency in tomato","Recommended for spray Calcium chloride 5gm / lit","TAMILNADU","SALEM","SALEM                                             ","2014-11-10 09:33:22.110"
"RABI","AGRICULTURE","Cereals","Paddy (Dhan)","Market Information","paddy IR 20 seed rate and seed price (agri offi)","Recommended for paddy IR 20 seed rate : 1kg and seed price (agri offi) : 24 Rs.","TAMILNADU","SALEM","OMALUR                                            ","2014-11-10 11:38:30.913"
"KHARIF","AGRICULTURE","Others","Others","Weather","weather forecast","recommended for today is not a rainy day","TAMILNADU","SALEM","MECHERI                                           ","2014-11-10 12:17:46.997"
"KHARIF","AGRICULTURE","Millets","Maize (Makka)","Market Information","maize market information","Recommended for maize market rate: Rs.1200 - 1230/Quintal","TAMILNADU","SALEM","ATTUR                                             ","2014-11-10 13:26:42.610"
"KHARIF","AGRICULTURE","Others","Others","Weather","weather report","recommended for today is not a rainy day","TAMILNADU","SALEM","ATTUR                                             ","2014-11-10 13:33:10.163"
"KHARIF","AGRICULTURE","Millets","Maize (Makka)","Market Information","Maize market rate","Recommended for maize market rate: Rs.1200 - 1230/Quintal","TAMILNADU","SALEM","SALEM                                             ","2014-11-10 13:38:45.143"
"RABI","HORTICULTURE","Condiments and Spices","Turmeric","	Plant Protection	","Leaf blotch in turmeric","Recommended for spray Carbendazim 2gm / lit","TAMILNADU","SALEM","ATTUR                                             ","2014-11-10 13:43:42.930"
"KHARIF","HORTICULTURE","Vegetables","Brinjal","	Plant Protection	","Fruit borer in brinjal","recommended for spray quinalphos 2ml+neem oil 3ml+teepol 1ml/lit of water","TAMILNADU","SALEM","OMALUR                                            ","2014-11-10 14:20:42.663"
"RABI","AGRICULTURE","Pulses","Black Gram (urd bean)","Fertilizer Use and Availability","blackgram fertilizer management","Recommended for spray pulses wonder 2kg / ac 200 litter of water","TAMILNADU","SALEM","KONGANAPURAM                                      ","2014-11-10 14:40:28.553"
"RABI","HORTICULTURE","Plantation Crops","Coconut","Fertilizer Use and Availability","Button shedding in coconut","Recommended for Button shedding in coconut Root feeding with TNAU coconut tonic 200 ml / tree","TAMILNADU","SALEM","ATTUR                                             ","2014-11-10 14:48:14.190"
"KHARIF","AGRICULTURE","Others","Others","Weather","weather report","Recommended for weather report today have rain","TAMILNADU","SALEM","VALAPADY                                          ","2014-11-10 15:09:14.330"
"KHARIF","AGRICULTURE","Fiber Crops","Cotton (Kapas)","Fertilizer Use and Availability","Cotton flower dropping","recommended for Spray cotton plus 2.5kg/ac 
recommended for Spray planofix 5ml/10 liter of water","TAMILNADU","SALEM","TALAVASAL                                         ","2014-11-10 15:22:03.790"
"RABI","AGRICULTURE","Fiber Crops","Cotton (Kapas)","Nutrient Management","cotton flower dropping","Recommended for cotton flower dropping spray cotton plus 2.5kg/ac mix apsha 80 100ml/ac","TAMILNADU","SALEM","TALAVASAL                                         ","2014-11-10 16:31:56.423"
"RABI","AGRICULTURE","Others","Others","Weather","Weather report for salem district","recommended for today is a  rainy day","TAMILNADU","SALEM","KONGANAPURAM                                      ","2014-11-10 16:58:41.043"
"KHARIF","AGRICULTURE","Fiber Crops","Cotton (Kapas)","	Plant Protection	","whitefly in cotton","recommended for spray imidachloprid 1 ml/ lit.","TAMILNADU","SALEM","KOLATHUR                                          ","2014-11-10 18:13:50.790"
"RABI","HORTICULTURE","Vegetables","Brinjal","	Plant Protection	","Ash weevil in brinjal","Recommended for spray chlorpyriphos 2 ml / lt","TAMILNADU","SALEM","PEDDANAICKENPALAYAM                               ","2014-11-10 20:29:06.540"
"KHARIF","AGRICULTURE","Pulses","Mochai (lab-lab)","Nutrient Management","whitefly in mochchai","recommended for spray dimethoate 2 ml/ lit.","TAMILNADU","SALEM","MECHERI                                           ","2014-11-10 20:29:30.553"
"KHARIF","HORTICULTURE","Flowers","Jasmine","	Plant Protection	","leaf spot in jasmine","recommended for spray Mancozeb 2g/lit of water","TAMILNADU","SALEM","VALAPADY                                          ","2014-11-11 07:01:45.930"
"KHARIF","AGRICULTURE","Cereals","Paddy (Dhan)","Nutrient Management","paddy top dressing fertilizer management","Recommended for apply urea 25 kg + potash 15 kg + neem cake 5 kg/ac","TAMILNADU","SALEM","SANKARI                                           ","2014-11-11 07:47:29.437"
"KHARIF","HORTICULTURE","Vegetables","Brinjal","	Plant Protection	","brinjal shoot borer","recommended for spray chloriphyriphos 2 ml / 1 litre of water","TAMILNADU","SALEM","TALAVASAL                                         ","2014-11-11 07:47:35.777"
"KHARIF","HORTICULTURE","Vegetables","Bitter Gourd","Market Information","market rate for bitter gourd","recommended rate for Bittergourd Thalaivasal Market Amman-36.00/Kg","TAMILNADU","SALEM","OMALUR                                            ","2014-11-11 08:00:00.120"
"KHARIF","HORTICULTURE","Flowers","Jasmine","	Plant Protection	","bud worm control in jasmine","recommended for spray Thiochloprid 2 ml/lit of water","TAMILNADU","SALEM","VALAPADY                                          ","2014-11-11 08:34:43.590"
"RABI","AGRICULTURE","Fiber Crops","Cotton (Kapas)","Nutrient Management","flower shed in cotton","Recommended for spray planofix 5 ml/10lit of water","TAMILNADU","SALEM","ATTUR                                             ","2014-11-11 09:13:43.223"
"KHARIF","AGRICULTURE","Oilseeds","Castor (Rehri, Rendi, Arandi) ","Fertilizer Use and Availability","top dressing fertilizer for castor","recommended for apply urea 21 kg,potash 20 kg/ac","TAMILNADU","SALEM","TALAVASAL                                         ","2014-11-11 12:25:36.320"
"RABI","HORTICULTURE","Vegetables","Chillies","	Plant Protection	","Chilli mosaic virus","Recommended for spray Imidacloprid 2ml / lit","TAMILNADU","SALEM","ATTUR                                             ","2014-11-11 12:25:50.177"
"RABI","HORTICULTURE","Vegetables","Chillies","	Plant Protection	","Chilli mosaic virus","Recommended for spray Imidacloprid 2ml / lit","TAMILNADU","SALEM","ATTUR                                             ","2014-11-11 12:25:50.657"
"KHARIF","AGRICULTURE","Sugar and Starch Crops","Tapioca (Cassava)","	Plant Protection	","whitefly in tapioca","recomended for spray imidachloprid 1 ml/ lit.","TAMILNADU","SALEM","ATTUR                                             ","2014-11-11 14:07:01.397"
"KHARIF","AGRICULTURE","Sugar and Starch Crops","Tapioca (Cassava)","	Plant Protection	","tapioca leaf curl virus","recommended for spray spiromesifen 1 ml + neem oil 3 ml + teepol 1 ml / 1 litre of water","TAMILNADU","SALEM","KADAIYAMPATTY                                     ","2014-11-11 14:11:22.593"
"KHARIF","AGRICULTURE","Cereals","Paddy (Dhan)","Weed Management","Pre emergence Weed control in paddy","Recommended for apply Pendimethalin 500 ml + 20 kg/ac","TAMILNADU","SALEM","VALAPADY                                          ","2014-11-11 14:44:28.547"
"RABI","AGRICULTURE","Fiber Crops","Cotton (Kapas)","Nutrient Management","cotton flower dropping","Recommended for cotton flower dropping Spray cotton plus 2.5kg/ac mix apsha 80 100ml/ac","TAMILNADU","SALEM","VEERAPANDI                                        ","2014-11-11 14:52:23.750"
"KHARIF","AGRICULTURE","Others","Others","Weather","salem Weather report","Recommended for today is a rainy day","TAMILNADU","SALEM","SANKARI                                           ","2014-11-11 14:58:15.257"
"RABI","AGRICULTURE","Cereals","Paddy (Dhan)","	Plant Protection	","Leaf Blight in paddy","Recommended for Leaf Blight in paddy spray carbendazim 2gm/litter water","TAMILNADU","SALEM","TALAVASAL                                         ","2014-11-11 14:58:59.320"
"KHARIF","AGRICULTURE","Cereals","Paddy (Dhan)","Nutrient Management","paddy top dressing","recommended for apply urea 25 kg + potash 15 kg/ acre.","TAMILNADU","SALEM","TALAVASAL                                         ","2014-11-11 14:59:03.290"
"RABI","HORTICULTURE","Fruits","Guava","	Plant Protection	","Whitefly in guava","Recommended for spray triazophos 40EC 1ml/liter of water","TAMILNADU","SALEM","KADAIYAMPATTY                                     ","2014-11-11 15:37:21.707"
"KHARIF","AGRICULTURE","Others","Others","Cultural Practices","horticulture collegeg periyakulam contact no.","recommended 04546-231726,04546-233225 number.","TAMILNADU","SALEM","GANGAVALLI                                        ","2014-11-11 15:58:11.607"
"KHARIF","AGRICULTURE","Oilseeds","Groundnut (pea nut/mung phalli)","Fertilizer Use and Availability","Basal fertilizer management for groundnut","recommended for  apply DAP 5Okg + gypsum 75 kg /ac","TAMILNADU","SALEM","KOLATHUR                                          ","2014-11-11 16:03:04.543"
"KHARIF","HORTICULTURE","Condiments and Spices","Turmeric","Market Information","turmeric market rate","recommended as bulb: 4480-6310 Rs/quintal, finger: 4560-6680 s/quintal.","TAMILNADU","SALEM","GANGAVALLI                                        ","2014-11-11 16:11:01.743"
"RABI","AGRICULTURE","Millets","Maize (Makka)","	Plant Protection	","Web worm in maize","Recommended for Spray monocrotophos 2ml/liter of water","TAMILNADU","SALEM","GANGAVALLI                                        ","2014-11-11 16:33:20.937"
"RABI","AGRICULTURE","Cereals","Paddy (Dhan)","	Plant Protection	","thrips in paddy","Recommended for spray Imidacloprid 2ml / lit","TAMILNADU","SALEM","VALAPADY                                          ","2014-11-11 16:34:33.157"
"KHARIF","AGRICULTURE","Millets","Maize (Makka)","Market Information","Maize market rate","Recommended for maize market rate: Rs.1200 - 1230/Quintal","TAMILNADU","SALEM","PEDDANAICKENPALAYAM                               ","2014-11-11 17:14:53.740"
"RABI","HORTICULTURE","Condiments and Spices","Coriander","Fertilizer Use and Availability","nutrient management for coriander","recommended for Spray All 19- 50 Gram/Tank","TAMILNADU","SALEM","NANGAVALLI                                        ","2014-11-11 17:23:39.840"
"KHARIF","HORTICULTURE","Condiments and Spices","Turmeric","Nutrient Management","turmeric top dressing","recommended for apply urea 25 kg + potash 70 kg/ acre.","TAMILNADU","SALEM","PEDDANAICKENPALAYAM                               ","2014-11-11 17:25:38.100"
"KHARIF","AGRICULTURE","Others","Others","Weather","salem Weather report","Recommended for today is a rainy day","TAMILNADU","SALEM","ATTUR                                             ","2014-11-11 17:58:03.973"
"RABI","AGRICULTURE","Cereals","Paddy (Dhan)","Varieties","season for paddy","recommended for paddy season november-december","TAMILNADU","SALEM","ATTUR                                             ","2014-11-11 18:24:25.970"
"RABI","AGRICULTURE","Others","Others","Weather","asking about weather details","Recommended for Rain fall 5 mm","TAMILNADU","SALEM","ATTUR                                             ","2014-11-11 18:40:45.747"
"KHARIF","AGRICULTURE","Millets","Maize (Makka)","Market Information","maize market nilavara","recommended as 1080-1320/ quintal.","TAMILNADU","SALEM","ATTUR                                             ","2014-11-11 19:33:36.417"
"RABI","AGRICULTURE","Cereals","Paddy (Dhan)","Fertilizer Use and Availability","Top dressing fertilizer management for paddy","Recommended for Top dressing fertilizer management for paddy Apply urea 25 kg + potash 15 kg + neem cake 5 kg + Microfood 10 kg/ ac","TAMILNADU","SALEM","TALAVASAL                                         ","2014-11-11 20:29:33.960"
"RABI","HORTICULTURE","Vegetables","Bottle Gourd ","Seeds and Planting Material","season for bottle gourd","recommended for bottle gourd season: July and January","TAMILNADU","SALEM","ATTUR                                             ","2014-11-11 20:54:03.603"
"RABI","HORTICULTURE","Vegetables","Brinjal","Market Information","Brinjal markwet rate","Recommended for Brinjal markwet rate: Rs.25/kg","TAMILNADU","SALEM","ATTUR                                             ","2014-11-12 09:49:57.533"
"KHARIF","AGRICULTURE","Cereals","Paddy (Dhan)","Nutrient Management","top dressing for paddy","recommended for apply urea 25kg+ potash 15kg /ac","TAMILNADU","SALEM","SANKARI                                           ","2014-11-12 10:18:47.143"
"KHARIF","AGRICULTURE","Cereals","Paddy (Dhan)","Nutrient Management","top dressing for paddy","recommended for apply urea 25kg+ potash 15kg /ac","TAMILNADU","SALEM","SANKARI                                           ","2014-11-12 10:27:22.790"
"RABI","AGRICULTURE","Millets","Maize (Makka)","Cultural Practices","maize sowing season","Recommended for maize sowing season : January - February","TAMILNADU","SALEM","SANKARI                                           ","2014-11-12 11:31:10.970"
"KHARIF","AGRICULTURE","Others","Others","Credit","Message need my mobile","recommended for as your request we are activated","TAMILNADU","SALEM","PEDDANAICKENPALAYAM                               ","2014-11-12 11:32:17.047"
"KHARIF","HORTICULTURE","Vegetables","Tomato","Nutrient Management","flower shed in tomato","Recommended for spray planofix 5 ml/10lit of water","TAMILNADU","SALEM","TALAVASAL                                         ","2014-11-12 11:49:18.407"
"RABI","AGRICULTURE","Others","Others","Weather","asking about weather details","Recommended for Rain fall 7mm","TAMILNADU","SALEM","MECHERI                                           ","2014-11-12 12:06:23.710"
"KHARIF","HORTICULTURE","Fruits","Banana","Fertilizer Use and Availability","banana fertilizer management","Recommended for apply 150 gm urea + 200 gm super phosphate + 200 gm potash /plant","TAMILNADU","SALEM","SANKARI                                           ","2014-11-12 12:11:18.033"
"RABI","HORTICULTURE","Vegetables","Ridge Gourd","Market Information","Ridge gourd market rate","Recommended for Ridge gourd market rate : 27 - 40 Rs./Kg","TAMILNADU","SALEM","OMALUR                                            ","2014-11-12 12:58:32.233"
"KHARIF","HORTICULTURE","Vegetables","Chillies","	Plant Protection	","leaf curl in chilli","Recommended for spray methyldemeton 2ml / lit","TAMILNADU","SALEM","ATTUR                                             ","2014-11-12 13:32:17.800"
"KHARIF","AGRICULTURE","Cereals","Paddy (Dhan)","Fertilizer Use and Availability","paddy top dressing fertilizer management","Recommended for apply urea 25 kg + potash 15 kg + neem cake 5 kg/ac","TAMILNADU","SALEM","VEERAPANDI                                        ","2014-11-12 13:44:35.510"
"KHARIF","AGRICULTURE","Sugar and Starch Crops","Sugarcane (Noble Cane)","Bio-Pesticides and Bio-Fertilizers","bio fertilizer application for tapioca","recommended for apply azospirillum 1 lit /ac in drip fertigation","TAMILNADU","SALEM","VALAPADY                                          ","2014-11-12 13:48:13.867"
"KHARIF","HORTICULTURE","Condiments and Spices","Turmeric","	Plant Protection	","sucking pest in turmeric","recommended for imida clobride 2ml+neem oil 2ml+ teepol 1ml/lit of water","TAMILNADU","SALEM","GANGAVALLI                                        ","2014-11-12 14:37:38.333"
"RABI","HORTICULTURE","Plantation Crops","Coconut","Fertilizer Use and Availability","Coconut rhinocerous beetle","Recommended for apply monocrotophos 10ml + water 10ml/ tree for root feeding.","TAMILNADU","SALEM","VALAPADY                                          ","2014-11-12 14:38:36.980"
"RABI","AGRICULTURE","Millets","Maize (Makka)","Seeds","seed for sweet corn","recommended to contact Maize Research Station,04545-292900","TAMILNADU","SALEM","IDAPPADI                                          ","2014-11-12 14:47:35.857"
"RABI","HORTICULTURE","Condiments and Spices","Turmeric","	Plant Protection	","Turmeric leaf spot","Recommended for spray carbandazim 2 gm /liter of water","TAMILNADU","SALEM","VALAPADY                                          ","2014-11-12 16:59:43.590"
"KHARIF","HORTICULTURE","Fruits","Papaya","	Plant Protection	","Leaf curl in papaya","recommended for spray Recommended for spray methyldemeton 2ml / lit","TAMILNADU","SALEM","SALEM                                             ","2014-11-12 17:51:36.500"
"RABI","HORTICULTURE","Condiments and Spices","Turmeric","Market Information","turmeric market rate","Recommended for turmeric market rate : Bulb : 5369 - 6899 Rs./Quintal, Finger : 6609 - 8529 Rs./Quintal","TAMILNADU","SALEM","GANGAVALLI                                        ","2014-11-12 18:15:16.020"
"RABI","HORTICULTURE","Condiments and Spices","Turmeric","Market Information","turmeric market rate","Recommended for turmeric market rate : Bulb : 5369 - 6899 Rs./Quintal, Finger : 6609 - 8529 Rs./Quintal","TAMILNADU","SALEM","GANGAVALLI                                        ","2014-11-12 18:15:16.707"
"KHARIF","HORTICULTURE","Plantation Crops","Coconut","Cultural Practices","spacing for coconut","recommended for the spacing 7.5 x 7.5m","TAMILNADU","SALEM","OMALUR                                            ","2014-11-12 18:15:28.273"
"RABI","AGRICULTURE","Others","Others","Government Schemes","Tractor subsidy details & contact","Recommended for Explain the details and contact to agriculture engineering office no.0427 24 15 266","TAMILNADU","SALEM","KONGANAPURAM                                      ","2014-11-12 19:18:57.160"
"KHARIF","AGRICULTURE","Millets","Barnyard Millet (Kundiraivlli/Sawan","Cultural Practices","kudiraivaali season","recommnended for February-March","TAMILNADU","SALEM","IDAPPADI                                          ","2014-11-13 06:22:36.097"
"KHARIF","AGRICULTURE","Others","Others","Soil Testing","about soil testing lab address","Soil Testing Laboratory ,ADA office , seelanaikenpatty , salem ,","TAMILNADU","SALEM","MECHERI                                           ","2014-11-13 06:42:49.307"
"KHARIF","HORTICULTURE","Condiments and Spices","Turmeric","	Plant Protection	","turmeric leaf blotch","recommended for spray coc 2.5 g/ lit.","TAMILNADU","SALEM","VALAPADY                                          ","2014-11-13 06:46:15.757"
"RABI","AGRICULTURE","Sugar and Starch Crops","Tapioca (Cassava)","	Plant Protection	","Cassava mosaic virus","Recommended for Cassava mosaic virus spray dimethoate 2ml+neem oil 3ml+teepol 1ml/lit of water","TAMILNADU","SALEM","ATTUR                                             ","2014-11-13 06:59:21.910"
"KHARIF","AGRICULTURE","Cereals","Paddy (Dhan)","Fertilizer Use and Availability","Top dressing fertilizer management for paddy","Recommended for apply urea 25 kg + potash 15 kg + neem cake 5 kg + Microfood 5 kg/ ac","TAMILNADU","SALEM","SANKARI                                           ","2014-11-13 06:59:49.633"
"RABI","HORTICULTURE","Vegetables","Bhindi(Okra/Ladysfinger)","	Plant Protection	","fruit borer in bhendi","Recommended for spray quinalphos 2ml+neem oil 3ml+teepol 1ml/lit of water","TAMILNADU","SALEM","SANKARI                                           ","2014-11-13 07:11:27.180"
"RABI","HORTICULTURE","Vegetables","Chillies","	Plant Protection	","leaf curl in chilli","Recommended for spray methyldemeton 2ml / lit.","TAMILNADU","SALEM","GANGAVALLI                                        ","2014-11-13 07:22:10.000"
"RABI","AGRICULTURE","Fiber Crops","Cotton (Kapas)","	Plant Protection	","thrips in cotton","Recommended for spray imidacloprid 2ml+neem oil 3ml+teepol 1ml/lit of water","TAMILNADU","SALEM","SALEM                                             ","2014-11-13 08:20:50.907"
"RABI","AGRICULTURE","Fiber Crops","Cotton (Kapas)","Fertilizer Use and Availability","cotton top dressing fertilizer management","recommended for apply urea 33kg / ac","TAMILNADU","SALEM","NANGAVALLI                                        ","2014-11-13 08:36:35.620"
"KHARIF","HORTICULTURE","Vegetables","Brinjal","Nutrient Management","Flower drop in brinjal","recommended for  Spray Planofix - 5 ml / 10 lit of water","TAMILNADU","SALEM","TALAVASAL                                         ","2014-11-13 08:41:47.920"
"RABI","HORTICULTURE","Fruits","Mango","Fertilizer Use and Availability","mango fertilizer management","Recommended for apply urea 200gm + potash 300gm + super phosphate 200gm / tree","TAMILNADU","SALEM","NANGAVALLI                                        ","2014-11-13 09:31:19.733"
"KHARIF","HORTICULTURE","Condiments and Spices","Turmeric","	Plant Protection	","turmeric Leaf blotch","recommended for Leaf spot controlled by spraying Carbendazim 200 gm/ acre + Mancozeb 200gm /ha","TAMILNADU","SALEM","TALAVASAL                                         ","2014-11-13 09:58:21.127"
"KHARIF","AGRICULTURE","Others","Others","Credit","kisan credit card","recommended to contact bank manager.","TAMILNADU","SALEM","SANKARI                                           ","2014-11-13 10:33:32.173"
"RABI","AGRICULTURE","Millets","Maize (Makka)","Cultural Practices","duration for maize","Recommended for duration for maize 100-120 days","TAMILNADU","SALEM","NANGAVALLI                                        ","2014-11-13 10:45:22.323"
"RABI","AGRICULTURE","Others","Others","Weather","Weather report selam","Recommended for Weather report selam today have rain","TAMILNADU","SALEM","MECHERI                                           ","2014-11-13 10:53:40.917"
"RABI","AGRICULTURE","Cereals","Paddy (Dhan)","	Plant Protection	","stem borer in paddy","Recommended for spray chlorpyrifos 2ml+neem oil 3ml+teepol 1ml/lit of water","TAMILNADU","SALEM","IDAPPADI                                          ","2014-11-13 10:58:00.387"
"KHARIF","HORTICULTURE","Vegetables","Bhindi(Okra/Ladysfinger)","Soil Testing","season & variety for bhendi","recommended MDU 1, Arka Anamika, Arka Abhay and Parbhani Kranti done during June - August and February","TAMILNADU","SALEM","GANGAVALLI                                        ","2014-11-13 11:35:36.770"
"RABI","AGRICULTURE","Cereals","Paddy (Dhan)","Fertilizer Use and Availability","Paddy nursery fertilizer","Recommended for Paddy nursery fertilizer apply DAP 2kg/cent","TAMILNADU","SALEM","ATTUR                                             ","2014-11-13 11:43:15.967"
"KHARIF","AGRICULTURE","Others","Others","Soil Testing","soil test lab contact","recommended 9443095001 number.","TAMILNADU","SALEM","TALAVASAL                                         ","2014-11-13 12:14:15.423"
"RABI","AGRICULTURE","Cereals","Paddy (Dhan)","Fertilizer Use and Availability","Top dressing fertilizer management for paddy","Recommended for  Top dressing fertilizer management for paddy Apply urea 25 kg + potash 15 kg + neem cake 5 kg + Microfood 10 kg/ ac","TAMILNADU","SALEM","ATTUR                                             ","2014-11-13 12:21:12.240"
"KHARIF","AGRICULTURE","Others","Others","Cultural Practices","kvk contact no.","recommended 0427-2422550 number.","TAMILNADU","SALEM","MECHERI                                           ","2014-11-13 13:50:52.383"
"KHARIF","AGRICULTURE","Fiber Crops","Cotton (Kapas)","	Plant Protection	","cotton leaf hopper","recommended for spray spiromesifen 1 ml + neem oil 3 ml + teepol 1 ml / 1 litre of water","TAMILNADU","SALEM","VALAPADY                                          ","2014-11-13 13:59:11.320"
"RABI","HORTICULTURE","Vegetables","Tomato","	Plant Protection	","Serpentine leaf miner in tomato","recommended Spray neem seed kernel extract 3 %","TAMILNADU","SALEM","AYODHIYAPATTINAM                                  ","2014-11-13 14:14:30.130"
"KHARIF","HORTICULTURE","Vegetables","Brinjal","	Plant Protection	","shoot borerin brinjal","recommended for spray thiodicarb 2 g/ lit.","TAMILNADU","SALEM","VEERAPANDI                                        ","2014-11-13 14:17:25.540"
"RABI","AGRICULTURE","Others","Others","Weather","asking about weather details","Recommended for today rainy day","TAMILNADU","SALEM","ATTUR                                             ","2014-11-13 14:34:54.840"
"RABI","AGRICULTURE","Others","Others","Weather","Weather report selam","Recommended for Weather report selam today have  rain","TAMILNADU","SALEM","ATTUR                                             ","2014-11-13 14:40:59.310"
"RABI","AGRICULTURE","Cereals","Paddy (Dhan)","	Plant Protection	","Paddy blast","Recommended for Paddy blast  Spray edifenphos 2 gm /lit","TAMILNADU","SALEM","VEERAPANDI                                        ","2014-11-13 15:56:45.413"
"KHARIF","HORTICULTURE","Condiments and Spices","Turmeric","Nutrient Management","top dressing for turmeric","recommended for urea 15kg+potash 40kg/ac","TAMILNADU","SALEM","GANGAVALLI                                        ","2014-11-13 16:23:56.347"
"RABI","AGRICULTURE","Others","Others","Government Schemes","asking about kisan credit card details","Recommended contact to nationalized bank","TAMILNADU","SALEM","KADAIYAMPATTY                                     ","2014-11-13 16:49:09.477"
"KHARIF","HORTICULTURE","Fruits","Jack Fruit","Seeds and Planting Material","jack fruit varieties","recommended for Velipala, Singapore, Hybrid jack, Panruti selection, Thanjavur jack, Burliar 1, PLR 1, PLR (J) 2 and PPI 1 are the popular varieties in jack","TAMILNADU","SALEM","ATTUR                                             ","2014-11-13 17:52:02.323"
