"Season","Sector","Category","Crop","QueryType","QueryText","KCCAns","StateName","DistrictName","BlockName","CreatedOn"
"KHARIF","HORTICULTURE","Fruits","Banana","Field Preparation","Banana Selection and pre-treatment of suckers","select sword suckers of 1.5 to 2.0 kg weight which are free from diseases and nematodes. Trim the roots and decayed portion of the corm, cut the pseudostem leaving 20 cm from the corm and grade the suckers to size","TAMILNADU","SALEM","SANKARI                                           ","2014-11-13 19:22:29.103"
"RABI","AGRICULTURE","Fiber Crops","Cotton (Kapas)","Nutrient Management","flower shed in cotton","Recommended for spray planofix 5 ml/10lit of water","TAMILNADU","SALEM","ATTUR                                             ","2014-11-14 07:46:43.473"
"KHARIF","HORTICULTURE","Flowers","Tuberose","Nutrient Management","tuberose micro foliar spray","recommended for spray znso4 5 gram + feso4 3 gram + borax 2 gram / 1 litre of water","TAMILNADU","SALEM","OMALUR                                            ","2014-11-14 08:01:22.597"
"KHARIF","HORTICULTURE","Flowers","Tuberose","Nutrient Management","query : tuberose micro foliar spray","answer : recommended for spray znso4 5 gram + feso4 3 gram + borax 2 gram / 1 litre of water","TAMILNADU","SALEM","OMALUR                                            ","2014-11-14 08:05:16.560"
"RABI","HORTICULTURE","Vegetables","Bitter Gourd","Market Information","bitter gourd market rate","Recommended for bitter gourd market rate : 30 - 40 Rs./Kg","TAMILNADU","SALEM","OMALUR                                            ","2014-11-14 08:08:34.947"
"KHARIF","AGRICULTURE","Cereals","Paddy (Dhan)","Fertilizer Use and Availability","paddy top dressing fertilizer management","Recommended for apply urea 25 kg + potash 15 kg + neem cake 5 kg/ac","TAMILNADU","SALEM","GANGAVALLI                                        ","2014-11-14 08:16:49.880"
"KHARIF","AGRICULTURE","Others","Others","Weather","salem district rain details","having medium rain today","TAMILNADU","SALEM","KONGANAPURAM                                      ","2014-11-14 08:20:11.867"
"KHARIF","HORTICULTURE","Condiments and Spices","Turmeric","	Plant Protection	","query : turmeric leaf spot","answer : recommended for spray Copper oxychloride 2.5 gram / 1 litre of water","TAMILNADU","SALEM","GANGAVALLI                                        ","2014-11-14 08:40:03.763"
"KHARIF","HORTICULTURE","Vegetables","Brinjal","Market Information","market rate for brinjal","Brinjal Thalaivasal Market Vari 18.00-20.00/Kg","TAMILNADU","SALEM","MECHERI                                           ","2014-11-14 09:25:04.203"
"KHARIF","HORTICULTURE","Vegetables","Brinjal","Seeds and Planting Material","varieties of brinjal","recommended varieties of brinjal Co 1, Co 2, MDU 1, PKM 1, PLR 1,PLR (B) 2, KKM 1, PPI 1, Annamalai COBH 1 and COBH 2","TAMILNADU","SALEM","MECHERI                                           ","2014-11-14 10:01:26.307"
"KHARIF","HORTICULTURE","Vegetables","Bitter Gourd","Market Information","bitter gourd market rate","recommended for Rs 32-35/ kg.","TAMILNADU","SALEM","KONGANAPURAM                                      ","2014-11-14 10:19:40.963"
"KHARIF","AGRICULTURE","Oilseeds","Castor (Rehri, Rendi, Arandi) ","Cultural Practices","castor top dressing","recommended for apply urea 20 kg + potash 10 kg/ acre.","TAMILNADU","SALEM","SALEM                                             ","2014-11-14 12:11:13.173"
"KHARIF","ANIMAL HUSBANDRY","Animal","Bovine(Cow,Buffalo)","Animal Nutrition","veterinary department contact no","recommended 0427-2410408 number.","TAMILNADU","SALEM","OMALUR                                            ","2014-11-14 12:15:44.100"
"KHARIF","AGRICULTURE","Pulses","Mochai (lab-lab)","Nutrient Management","mochai foliar spray","recommended for spray dap 20 g/ lit.","TAMILNADU","SALEM","GANGAVALLI                                        ","2014-11-14 12:21:55.903"
"RABI","HORTICULTURE","Vegetables","Chillies","Market Information","chilli market rate","Recommended for chilli market rate : 26 - 30 Rs./kg","TAMILNADU","SALEM","KOLATHUR                                          ","2014-11-14 14:27:53.693"
"KHARIF","AGRICULTURE","Others","Others","Market Information","demic contact no.","recommended 0431-2422142.","TAMILNADU","SALEM","KOLATHUR                                          ","2014-11-14 15:07:35.480"
"KHARIF","HORTICULTURE","Fruits","Pomegranate","Cultural Practices","spacing for pomegranate","recommended for the spacing ; 2.5 to 3 m","TAMILNADU","SALEM","SANKARI                                           ","2014-11-14 15:15:36.957"
"RABI","HORTICULTURE","Fruits","Pomegranate","Nutrient Management","flower shed in pomegranate","Recommended for spray planofix 5 ml /10 lit of water","TAMILNADU","SALEM","TARAMANGALAM                                      ","2014-11-14 15:40:48.390"
"KHARIF","AGRICULTURE","Cereals","Paddy (Dhan)","Fertilizer Use and Availability","soil loose in paddy","recommended for apply gypsum 4 kg/cent","TAMILNADU","SALEM","GANGAVALLI                                        ","2014-11-14 16:02:22.080"
"RABI","AGRICULTURE","Oilseeds","Groundnut (pea nut/mung phalli)","Fertilizer Use and Availability","groundnut top dressing fertilizer management","Recommended for apply zypsum 75 kg / ac","TAMILNADU","SALEM","GANGAVALLI                                        ","2014-11-14 18:40:29.023"
"RABI","AGRICULTURE","Oilseeds","Sesame (Gingelly/Til)/Sesamum","Cultural Practices","sowing season for sesame","Recommended for sowing season for sesame Feb- March","TAMILNADU","SALEM","ATTUR                                             ","2014-11-14 19:25:54.813"
"RABI","AGRICULTURE","Pulses","Black Gram (urd bean)","	Plant Protection	","Tobacco caterpillar in blackgram","Recommended for spray quinalphos 2ml / lit.","TAMILNADU","SALEM","MECHERI                                           ","2014-11-14 20:04:47.547"
"KHARIF","AGRICULTURE","Cereals","Paddy (Dhan)","Fertilizer Use and Availability","soil loose in paddy field","recommended for apply gypsum 4 kg/cent","TAMILNADU","SALEM","GANGAVALLI                                        ","2014-11-14 21:09:49.360"
"KHARIF","HORTICULTURE","Vegetables","Brinjal","Market Information","market rate for brinjal","Brinjal Thalaivasal Market Vari 27.00-30.00/Kg","TAMILNADU","SALEM","PEDDANAICKENPALAYAM                               ","2014-11-15 06:47:54.780"
"KHARIF","AGRICULTURE","Oilseeds","Groundnut (pea nut/mung phalli)","Market Information","market rate for groundnut","market rate for groundnut rs:38-40/kg","TAMILNADU","SALEM","MACDONALDS CHOULTRY                               ","2014-11-15 09:27:30.683"
"KHARIF","AGRICULTURE","Cereals","Paddy (Dhan)","	Plant Protection	","paddy Gall midge:","recommended for spray chlorpyriphos 20% EC 2 ml / 1 litre of water","TAMILNADU","SALEM","SANKARI                                           ","2014-11-15 09:35:55.070"
"KHARIF","AGRICULTURE","Fiber Crops","Cotton (Kapas)","Nutrient Management","cotton foliar application details","recommended for spray TNAU cotton plus 2.5kg / 200 lit / ac","TAMILNADU","SALEM","ATTUR                                             ","2014-11-15 10:16:34.813"
"KHARIF","AGRICULTURE","Others","Others","Seeds","FOREST DEPARTMENT, SALEM  contact number","recommended to contact 0427-2412114","TAMILNADU","SALEM","SANKARI                                           ","2014-11-15 11:00:42.913"
"KHARIF","AGRICULTURE","Millets","Maize (Makka)","Market Information","market rate for maize","Gangavalli market  1280 - 1350 Rs/Quintal","TAMILNADU","SALEM","GANGAVALLI                                        ","2014-11-15 11:27:37.927"
"RABI","AGRICULTURE","Fiber Crops","Cotton (Kapas)","Nutrient Management","top dressing for cotton","recommended for urea 40kg+potash 15kg+MN mixture 5kg/ac","TAMILNADU","SALEM","TARAMANGALAM                                      ","2014-11-15 12:10:53.287"
"KHARIF","AGRICULTURE","Cereals","Paddy (Dhan)","Nutrient Management","paddy foliar spray","recommended for spray psudomonas 3 gram / 1 litre of water","TAMILNADU","SALEM","IDAPPADI                                          ","2014-11-15 12:34:05.767"
"KHARIF","HORTICULTURE","Vegetables","Bottle Gourd ","	Plant Protection	","beetles, fruit flies and caterpillars","Beetles, fruit flies and caterpillars can be controlled by spraying Dimethoate 30 EC 1 ml/lit. or Methyl demeton 25 EC 1 ml/lit.","TAMILNADU","SALEM","MECHERI                                           ","2014-11-15 13:19:33.863"
"KHARIF","HORTICULTURE","Vegetables","Bottle Gourd ","	Plant Protection	","query : bottlegourd beetles, fruit flies and caterpillars","answer : Beetles, fruit flies and caterpillars can be controlled by spraying Dimethoate 30 EC 1 ml/lit. or Methyl demeton 25 EC 1 ml/lit","TAMILNADU","SALEM","MECHERI                                           ","2014-11-15 13:31:18.977"
"RABI","HORTICULTURE","Flowers","Tuberose","Market Information","market rate for nerium","at Thalaivasal Market	Red	1	-	110.00/Kg
Thalaivasal Market	White	1	-	120.00/Kg
Tirunelveli Market	Red	1	-	90.00/Kg
Tirunelveli Market	White	1	-	100.00-120.00/kg","TAMILNADU","SALEM","PANAMARATHUPATTI                                  ","2014-11-15 13:39:08.683"
"KHARIF","AGRICULTURE","Millets","Maize (Makka)","Cultural Practices","maize season","recommended for the season  Purattasipattam (September - October)","TAMILNADU","SALEM","ATTUR                                             ","2014-11-15 14:13:21.573"
"RABI","AGRICULTURE","Others","Others","Government Schemes","contact to veterinary dept","Recommended for contact to veterinary dept number 0427-244040","TAMILNADU","SALEM","OMALUR                                            ","2014-11-15 14:30:53.677"
"RABI","HORTICULTURE","Condiments and Spices","Turmeric","Fertilizer Use and Availability","turmeric fertilizer management","Recommended for apply micro mixture 5kg / ac","TAMILNADU","SALEM","OMALUR                                            ","2014-11-15 14:52:46.603"
"KHARIF","AGRICULTURE","Others","Others","Weather","weather detail in salem","have no rain in salem","TAMILNADU","SALEM","SANKARI                                           ","2014-11-15 15:53:30.480"
"KHARIF","AGRICULTURE","Cereals","Paddy (Dhan)","	Plant Protection	","gall midge control for paddy","recommended for Spray Fipronil 2 ml/lit of water","TAMILNADU","SALEM","SANKARI                                           ","2014-11-15 16:06:29.987"
"KHARIF","AGRICULTURE","Others","Others","Bio-Pesticides and Bio-Fertilizers","foliar spray of panjakaviya","recommended for spray of panjakaviya 3 ml/lit of water","TAMILNADU","SALEM","SALEM                                             ","2014-11-15 16:52:32.780"
"RABI","AGRICULTURE","Others","Others","Weather","asking about weather details","Recommended for today rainy day","TAMILNADU","SALEM","VEERAPANDI                                        ","2014-11-15 17:53:28.773"
"KHARIF","HORTICULTURE","Vegetables","Brinjal","	Plant Protection	","Shoot borer in brinjal","recommended for Spray quinalphos 2 ml + neem oil 3 ml + wetting agent 1 ml / lit of water","TAMILNADU","SALEM","SANKARI                                           ","2014-11-15 19:02:40.797"
"KHARIF","AGRICULTURE","Cereals","Paddy (Dhan)","Cultural Practices","transplanting period of adt 45","recommended for transplanting period of adt 45 is 22-25 days","TAMILNADU","SALEM","GANGAVALLI                                        ","2014-11-15 19:17:46.980"
"KHARIF","HORTICULTURE","Plantation Crops","Arecanut","Fertilizer Use and Availability","arecanut fertilizer recommended","recommended for applay 100;40;150 kg of NPK /ACR","TAMILNADU","SALEM","ATTUR                                             ","2014-11-15 19:35:35.483"
"KHARIF","AGRICULTURE","Cereals","Paddy (Dhan)","Nutrient Management","query : paddy top fertilizer management","answer : recommended for apply urea 25 kilo + potash 15 kilo + neem cake 5 kilo / acre","TAMILNADU","SALEM","TALAVASAL                                         ","2014-11-15 20:37:22.220"
"KHARIF","HORTICULTURE","Condiments and Spices","Turmeric","Market Information","market rate for turmeric","Erode Bulb 5404 - 6199 Rs/Quintal and Finger 5594 - 6764 Rs/Quintal","TAMILNADU","SALEM","PEDDANAICKENPALAYAM                               ","2014-11-15 20:53:38.337"
"KHARIF","AGRICULTURE","Fiber Crops","Cotton (Kapas)","	Plant Protection	","Root Rot in cotton","Recommended for Spot drench Carbendazim 2.5 gm / lit","TAMILNADU","SALEM","TALAVASAL                                         ","2014-11-15 21:27:52.710"
"KHARIF","AGRICULTURE","Others","Others","Weather","weather detail in salem","have no rain in salem","TAMILNADU","SALEM","ATTUR                                             ","2014-11-16 08:56:16.607"
"KHARIF","HORTICULTURE","Fruits","Papaya","	Plant Protection	","Leaf curl control in papaya","Recommended for spray imidaclopride 2 ml/ liter of water","TAMILNADU","SALEM","SALEM                                             ","2014-11-16 09:17:39.810"
"RABI","HORTICULTURE","Fruits","Papaya","	Plant Protection	","Papaya ring spot virus","Recommended for 	spray methyldemeton 2ml / lit.","TAMILNADU","SALEM","SALEM                                             ","2014-11-16 10:19:56.633"
"KHARIF","AGRICULTURE","Sugar and Starch Crops","Tapioca (Cassava)","Nutrient Management","query : topioca top fertilizer management","answer : recommended for apply urea 39 kilo +  potash 80 kilo / acre","TAMILNADU","SALEM","PEDDANAICKENPALAYAM                               ","2014-11-16 10:55:13.123"
"KHARIF","AGRICULTURE","Millets","Maize (Makka)","	Plant Protection	","stem rot in maize","recommended for soil drench with carbendazim 2gm/liter water","TAMILNADU","SALEM","ATTUR                                             ","2014-11-16 11:02:42.573"
"KHARIF","AGRICULTURE","Cereals","Paddy (Dhan)","Nutrient Management","query : paddy top fertilizer management","ans : recommended for apply urea 25 kilo + potash 15 kilo + neem cake 5 kilo / acre","TAMILNADU","SALEM","VALAPADY                                          ","2014-11-16 11:22:02.667"
"KHARIF","AGRICULTURE","Fiber Crops","Cotton (Kapas)","	Plant Protection	","Red Spider mites control in cotton","recommended for Spray dicofol 2ml/lit","TAMILNADU","SALEM","TALAVASAL                                         ","2014-11-16 11:42:37.943"
"KHARIF","HORTICULTURE","Plantation Crops","Coconut","	Plant Protection	","coconut fertilizer management","Recommended for apply urea 1.300kg + super phosphate 2kg + pottash 2 kg + neem cake 5kg + farm yard manure 50kg + micro mixture 1kg /tree/year","TAMILNADU","SALEM","VALAPADY                                          ","2014-11-16 12:00:30.397"
"KHARIF","AGRICULTURE","Others","Others","Weather","weather report in selam","recommended have rain","TAMILNADU","SALEM","KONGANAPURAM                                      ","2014-11-16 12:13:56.660"
"KHARIF","HORTICULTURE","Plantation Crops","Coconut","Nutrient Management","coconut fertilizer management","recommended for apply urea 1.300kg + super phosphate 2kg + potash 2 kg + neem cake 5kg + farm yard manure 50kg + micro mixture 1kg /tree/year","TAMILNADU","SALEM","MECHERI                                           ","2014-11-16 13:07:47.800"
"KHARIF","AGRICULTURE","Oilseeds","Sesame (Gingelly/Til)/Sesamum","Varieties","sesame varieties","recommended for CO 1, TMV 3, TMV 5, TMV 7, SVPR 1, 
VRI(SV) 2.","TAMILNADU","SALEM","KOLATHUR                                          ","2014-11-16 14:09:32.060"
"KHARIF","ANIMAL HUSBANDRY","Animal","POULTRY  FARM ","Dairy Production","veterinary department contact number","recommended for the contact number; 0427 2440408","TAMILNADU","SALEM","OMALUR                                            ","2014-11-16 14:35:06.470"
"RABI","AGRICULTURE","Pulses","Rajma (french bean)","	Plant Protection	","Gram pod borer in cowpea","Recommended for Spray quinalphos 2 ml + neem oil 3 ml /liter of water","TAMILNADU","SALEM","MECHERI                                           ","2014-11-16 14:53:49.683"
"RABI","AGRICULTURE","Others","Others","Weather","asking about weather details","Recommended for Rain fall 3 mm","TAMILNADU","SALEM","TALAVASAL                                         ","2014-11-16 15:14:05.117"
"KHARIF","HORTICULTURE","Vegetables","Brinjal","	Plant Protection	","Flower drop in brinjal","recommended for spray planofix 5ml/10 lit of water","TAMILNADU","SALEM","ATTUR                                             ","2014-11-16 16:19:52.770"
"KHARIF","AGRICULTURE","Oilseeds","Castor (Rehri, Rendi, Arandi) ","Cultural Practices","castor season","recommended for november- december.","TAMILNADU","SALEM","TARAMANGALAM                                      ","2014-11-16 16:27:07.023"
"RABI","AGRICULTURE","Sugar and Starch Crops","Tapioca (Cassava)","Fertilizer Use and Availability","leaf hopper in cotton","recommended for spray imidacloprid 2 ml/lt","TAMILNADU","SALEM","KOLATHUR                                          ","2014-11-16 17:29:40.917"
"RABI","HORTICULTURE","Vegetables","Onion","	Plant Protection	","thrips in onion","recommended for spray Dimethoate 2 ml/lt","TAMILNADU","SALEM","TALAVASAL                                         ","2014-11-16 17:55:44.733"
"KHARIF","HORTICULTURE","Vegetables","Onion","Cultural Practices","bellary onion duration","recommended as 140-150 days.","TAMILNADU","SALEM","KADAIYAMPATTY                                     ","2014-11-16 18:16:10.900"
"RABI","ANIMAL HUSBANDRY","Animal","POULTRY  FARM ","Disease Management","Veterinary University Training and Research Centres","recommended for contact to this number: 0427-244040","TAMILNADU","SALEM","SANKARI                                           ","2014-11-16 18:56:56.260"
"KHARIF","AGRICULTURE","Cereals","Paddy (Dhan)","Varieties","paddy navarai9 varietries.","recommended for ADT 36, ASD 18, ASD 19, ADT 42, MDU 5, ASD 20,CORH 3, ADT 43, ADT 45","TAMILNADU","SALEM","KOLATHUR                                          ","2014-11-16 19:35:50.377"
"KHARIF","AGRICULTURE","Millets","Maize (Makka)","Market Information","maize market rate","recommended as Rs 1080-1330/quintal.","TAMILNADU","SALEM","ATTUR                                             ","2014-11-16 19:47:48.227"
"KHARIF","AGRICULTURE","Cereals","Paddy (Dhan)","Cultural Practices","paddy sri spacing","recommended for 25 * 25 cm.","TAMILNADU","SALEM","ATTUR                                             ","2014-11-16 19:51:14.237"
"RABI","HORTICULTURE","Condiments and Spices","Turmeric","	Plant Protection	","leaf blotch in turmeric","recommended for spray Copper oxy chloride 2 g/lt","TAMILNADU","SALEM","VALAPADY                                          ","2014-11-16 20:13:05.043"
"KHARIF","AGRICULTURE","Others","Others","Training and Exposure Visits","valarum velaanmai contyact","recommended 0422-6611538.","TAMILNADU","SALEM","ATTUR                                             ","2014-11-16 21:44:34.470"
"KHARIF","HORTICULTURE","Vegetables","Tomato","	Plant Protection	","Leaf blight in tomato","recommended for Spray carbendazim 2.5 gm /lit of water","TAMILNADU","SALEM","ATTUR                                             ","2014-11-17 06:47:42.637"
"KHARIF","HORTICULTURE","Flowers","Jasmine","Nutrient Management","jasmine foliar application details","Recommended for spray 19:19:19 50 gm / tank","TAMILNADU","SALEM","ATTUR                                             ","2014-11-17 06:48:10.633"
"RABI","HORTICULTURE","Vegetables","Bitter Gourd","	Plant Protection	","Leaf curl in Bitter gourd","Recommended for Spray methyldemeton 2 ml /lit of water","TAMILNADU","SALEM","ATTUR                                             ","2014-11-17 07:42:37.380"
"KHARIF","HORTICULTURE","Fruits","Pomegranate","	Plant Protection	","flower shed in pomegranate","spray planofix 5 ml /10 lit of water","TAMILNADU","SALEM","SANKARI                                           ","2014-11-17 08:23:17.700"
"RABI","HORTICULTURE","Vegetables","Tomato","	Plant Protection	","flower drops (fusarium) in tomato","Recommended for spray carbendazim 2gm / lit","TAMILNADU","SALEM","OMALUR                                            ","2014-11-17 08:24:47.170"
"KHARIF","AGRICULTURE","Cereals","Paddy (Dhan)","	Plant Protection	","bacterial leaf blight in paddy","Recommended for spray bacteromycin 18 g /ac","TAMILNADU","SALEM","OMALUR                                            ","2014-11-17 09:45:34.067"
"KHARIF","AGRICULTURE","Others","Others","Weather","salem Weather report","Recommended for today is a no rain","TAMILNADU","SALEM","MECHERI                                           ","2014-11-17 11:47:57.873"
"RABI","AGRICULTURE","Oilseeds","Sesame (Gingelly/Til)/Sesamum","Cultural Practices","sesame seed rate","Recommended for sesame seed rate 2 kg / ac","TAMILNADU","SALEM","KOLATHUR                                          ","2014-11-17 12:57:53.850"
"KHARIF","AGRICULTURE","Cereals","Paddy (Dhan)","	Plant Protection	","leaf folder in paddy","Recommended for spray chlorpyrifos 2ml / lit","TAMILNADU","SALEM","NANGAVALLI                                        ","2014-11-17 13:58:36.120"
"KHARIF","AGRICULTURE","Oilseeds","Groundnut (pea nut/mung phalli)","Organic Farming","bio fertilizer application in paddy","recommended for apply rhizobium 2 kg/ acre.","TAMILNADU","SALEM","TALAVASAL                                         ","2014-11-17 14:51:05.250"
"RABI","HORTICULTURE","Vegetables","Brinjal","Cultural Practices","brinjal basal fertilizer management","Recommended for Apply urea 42 kg + super phosphate 125kg + potash 20 kg / ac","TAMILNADU","SALEM","OMALUR                                            ","2014-11-17 15:09:22.380"
"KHARIF","HORTICULTURE","Vegetables","Bitter Gourd","Market Information","bitter gourd market rate","recommended as Rs 25-33/kg.","TAMILNADU","SALEM","OMALUR                                            ","2014-11-17 15:29:23.057"
"RABI","HORTICULTURE","Vegetables","Chillies","	Plant Protection	","Gram caterpillar in chilli","Recommended for spray Flubendiamide 6g/10 liter of water","TAMILNADU","SALEM","SALEM                                             ","2014-11-17 17:53:16.920"
"RABI","HORTICULTURE","Fruits","Banana","	Plant Protection	","Root rot in banana","Recommended for Root rot in banana Spray copper oxychloride 1gm/lit of water","TAMILNADU","SALEM","GANGAVALLI                                        ","2014-11-17 18:29:41.437"
"RABI","AGRICULTURE","Others","Others","Agriculture Mechanization","Agricultural Engineering Department details","Recommended  to conduct Agricultural Engineering Department 0427 24 15 266","TAMILNADU","SALEM","MECHERI                                           ","2014-11-17 20:22:39.087"
"KHARIF","AGRICULTURE","Sugar and Starch Crops","Tapioca (Cassava)","Market Information","tapioca market rate","recommended as Rs 1400-2200/ quintal.","TAMILNADU","SALEM","ATTUR                                             ","2014-11-17 20:24:11.140"
"RABI","HORTICULTURE","Fruits","Banana","	Plant Protection	","Sigatoka leaf spot in banana","Recommended for spray Carbendazim 2gm / lit","TAMILNADU","SALEM","NANGAVALLI                                        ","2014-11-18 06:48:29.357"
"RABI","HORTICULTURE","Vegetables","Lab Lab","	Plant Protection	","Sucking pests in lab lab","Recommended for spray Dimethoate 2 ml / lit.","TAMILNADU","SALEM","MECHERI                                           ","2014-11-18 06:59:33.087"
"RABI","AGRICULTURE","Fiber Crops","Cotton (Kapas)","	Plant Protection	","Anthracnose in cotton","Recommended for spray carbendazim 2gm / lit","TAMILNADU","SALEM","KOLATHUR                                          ","2014-11-18 07:38:24.477"
"RABI","HORTICULTURE","Vegetables","Onion","	Plant Protection	","Basal rot in onion","Recommended for soil application Trichoderma viride 1kg + FYM 20kg / ac","TAMILNADU","SALEM","NANGAVALLI                                        ","2014-11-18 09:12:13.190"
"RABI","HORTICULTURE","Fruits","Banana","Nutrient Management","banana fruit size increases","Recommended for spray potassium sulphate 10 - 15gm / lit","TAMILNADU","SALEM","SANKARI                                           ","2014-11-18 10:10:30.100"
"RABI","HORTICULTURE","Fruits","Banana","Nutrient Management","banana fruit size increases","Recommended for spray potassium sulphate 10 - 15gm / lit","TAMILNADU","SALEM","SANKARI                                           ","2014-11-18 10:10:30.473"
"RABI","HORTICULTURE","Fruits","Banana","Nutrient Management","banana fruit size increases","Recommended for spray potassium sulphate 10 - 15gm / lit","TAMILNADU","SALEM","SANKARI                                           ","2014-11-18 10:10:32.030"
"RABI","HORTICULTURE","Fruits","Banana","Nutrient Management","banana fruit size increases","Recommended for spray potassium sulphate 10 - 15gm / lit","TAMILNADU","SALEM","SANKARI                                           ","2014-11-18 10:11:03.010"
"KHARIF","AGRICULTURE","Cereals","Paddy (Dhan)","	Plant Protection	","thrips in paddy","recommended for spray chloripyyriphos 2ml/lit","TAMILNADU","SALEM","GANGAVALLI                                        ","2014-11-18 10:53:24.870"
"RABI","HORTICULTURE","Condiments and Spices","Turmeric","Fertilizer Use and Availability","turmeric top fertilizer management","Recommended for apply urea 10 kg  +  potash 30 kg  / ac","TAMILNADU","SALEM","VALAPADY                                          ","2014-11-18 12:19:57.920"
"KHARIF","AGRICULTURE","Sugar and Starch Crops","Tapioca (Cassava)","Nutrient Management","tapioca top dressing fertilizer management","Recommended for apply urea 40kg + potash 80kg / ac","TAMILNADU","SALEM","TALAVASAL                                         ","2014-11-18 12:55:32.697"
