"Season","Sector","Category","Crop","QueryType","QueryText","KCCAns","StateName","DistrictName","BlockName","CreatedOn"
"RABI","HORTICULTURE","Vegetables","Bhindi(Okra/Ladysfinger)","	Plant Protection	","aphids in bhendi","Recommended for aphids in bhendi  recommended for bhendi aphids imidachloprid 2 ml/liter of water","TAMILNADU","VELLORE","TIMIRI                                            ","2014-11-10 16:49:49.420"
"RABI","HORTICULTURE","Vegetables","Bitter Gourd","	Plant Protection	","Bitter gourd Boron Deficiency Symptoms","Recommended for Spray borax 5 gm/ litre of water","TAMILNADU","VELLORE","ARAKKONAM                                         ","2014-11-10 17:17:09.507"
"KHARIF","AGRICULTURE","Fiber Crops","Cotton (Kapas)","	Plant Protection	","american bollworm in cotton","recommended for spray thiodicarb 2 g/ lit.","TAMILNADU","VELLORE","TIRUPPATTUR                                       ","2014-11-10 17:33:12.430"
"RABI","AGRICULTURE","Fiber Crops","Cotton (Kapas)","	Plant Protection	","Cotton mosaic","Recommended for Cotton mosaic spray dimethoate 2ml+neem oil 3ml+teepol 1ml/lit of water","TAMILNADU","VELLORE","ARAKKONAM                                         ","2014-11-10 18:23:44.590"
"RABI","AGRICULTURE","Cereals","Paddy (Dhan)","	Plant Protection	","Grain discoluration in paddy","Recommended for Spray - Carbendazim 2g + Thiram 2g + Mancozeb 2g/liter of water","TAMILNADU","VELLORE","NEMILI                                            ","2014-11-10 19:19:08.547"
"RABI","HORTICULTURE","Fruits","Banana","	Plant Protection	","leaf spot in banana","Recommended for spray mancozeb 2 gm /lit of water","TAMILNADU","VELLORE","ALANGAYAN                                         ","2014-11-10 19:21:36.003"
"KHARIF","AGRICULTURE","Others","Others","Weather","vellore Weather report","recommended for today is a no rain day","TAMILNADU","VELLORE","KAVERIPAKKAM                                      ","2014-11-10 19:45:22.750"
"KHARIF","AGRICULTURE","Oilseeds","Sesame (Gingelly/Til)/Sesamum","Seeds","sesame seeds","recommended to contact oilseeds research station.","TAMILNADU","VELLORE","ARAKKONAM                                         ","2014-11-10 19:59:14.960"
"KHARIF","AGRICULTURE","Millets","Maize (Makka)","Cultural Practices","maize season","recommended for January - February.","TAMILNADU","VELLORE","ARAKKONAM                                         ","2014-11-10 20:39:39.090"
"RABI","AGRICULTURE","Oilseeds","Groundnut (pea nut/mung phalli)","Varieties","Vellore ground nut","Recommended for TMV 7, CO 3, COGn 4, VRI 2, VRI 3, ALR 3, VRIGn5, VRIGn 6, TMVGn 13","TAMILNADU","VELLORE","ARAKKONAM                                         ","2014-11-10 21:22:46.427"
"KHARIF","HORTICULTURE","Vegetables","Chillies","Nutrient Management","query : chillies basal fertilizer management","answer : recommended for apply urea 25 kilo + ssp 150 kilo + potash 20 kilo / acre","TAMILNADU","VELLORE","SHOLINGHUR                                        ","2014-11-11 07:09:08.987"
"RABI","HORTICULTURE","Vegetables","Brinjal","	Plant Protection	","Little Leaf of brinjal","Recommended for spray methyldemeton 2ml / lit","TAMILNADU","VELLORE","VELLORE                                           ","2014-11-11 07:20:47.627"
"RABI","HORTICULTURE","Fruits","Papaya","	Plant Protection	","Papaya ring spot virus","Recommended for spray methyldemeton 2ml / lit","TAMILNADU","VELLORE","GUDIYATTAM                                        ","2014-11-11 07:29:58.737"
"KHARIF","AGRICULTURE","Sugar and Starch Crops","Sugarcane (Noble Cane)","Nutrient Management","sugarcane micro nutrient deficiency","recommended for apply microfood 5 kilo / acre","TAMILNADU","VELLORE","MADHANUR                                          ","2014-11-11 10:37:05.483"
"KHARIF","AGRICULTURE","Others","Others","Weather","weather detail in vellore","have no rain in vellore","TAMILNADU","VELLORE","K.V.KUPPAM                                        ","2014-11-11 10:53:32.620"
"RABI","AGRICULTURE","Fiber Crops","Cotton (Kapas)","Market Information","cotton market rate","Recommended for cotton market rate  : 4000 - 4500 Rs./Quintal","TAMILNADU","VELLORE","SHOLINGHUR                                        ","2014-11-11 11:55:03.830"
"KHARIF","ANIMAL HUSBANDRY","Animal","Bovine(Cow,Buffalo)","Market Information","about rabbit availability","recommended for contact to district veterinary department 0416 - 2253022","TAMILNADU","VELLORE","ARAKKONAM                                         ","2014-11-11 13:09:53.140"
"RABI","AGRICULTURE","Sugar and Starch Crops","Sugarcane (Noble Cane)","Weed Management","Pre emergence Weed control in sugarcane","Pre emergence Weed control in sugarcane spray atrazin 800 gm /ac","TAMILNADU","VELLORE","ARAKKONAM                                         ","2014-11-11 14:41:06.193"
"RABI","AGRICULTURE","Oilseeds","Groundnut (pea nut/mung phalli)","Fertilizer Use and Availability","Groundnut basal fertilizer management","Recommended for apply Urea 14kg +Super Phosphate 85 kg + Potash 36 kg + Gypsum 75 kg/ac","TAMILNADU","VELLORE","NEMILI                                            ","2014-11-11 14:47:11.380"
"RABI","AGRICULTURE","Cereals","Paddy (Dhan)","Fertilizer Use and Availability","Paddy basal fertilizer","Recommended for apply DAP 50 kg + zinc sulphate 10 kg+ neem cake 10/ac","TAMILNADU","VELLORE","NEMILI                                            ","2014-11-11 15:26:14.993"
"KHARIF","HORTICULTURE","Fruits","Banana","	Plant Protection	","leaf spot control in banana","recommended for spray chlorothalanil 2ml/liter of water","TAMILNADU","VELLORE","KANIYAMBADI                                       ","2014-11-11 15:47:07.603"
"KHARIF","HORTICULTURE","Vegetables","Brinjal","	Plant Protection	","brinjal shoot borer","recommended for spray Trichlorofon 1.0 ml/lit.","TAMILNADU","VELLORE","VELLORE                                           ","2014-11-11 15:54:33.447"
"KHARIF","AGRICULTURE","Cereals","Paddy (Dhan)","	Plant Protection	","paddy stem borer","recommended for spray cartap haidrokuloride 2 g/ lit.","TAMILNADU","VELLORE","KATPADI                                           ","2014-11-11 16:17:16.753"
"KHARIF","AGRICULTURE","Others","Others","Training and Exposure Visits","hydrophonics method details","recommended number for future farms is 9884009110","TAMILNADU","VELLORE","KATPADI                                           ","2014-11-11 16:39:07.360"
"RABI","AGRICULTURE","Cereals","Paddy (Dhan)","Market Information","Super ponni market rate","Recommended for Super Ponni market rate: Rs.1398 - 1662/Quintal","TAMILNADU","VELLORE","ARAKKONAM                                         ","2014-11-11 16:49:29.180"
"RABI","HORTICULTURE","Vegetables","Brinjal","	Plant Protection	","Fruit borer in brinjal","Recommended for Fruit borer in brinjal Flubendiamide  spray 2ml+neem oil 3ml+teepol 1ml/lit of water","TAMILNADU","VELLORE","ALANGAYAN                                         ","2014-11-11 17:22:38.127"
"KHARIF","AGRICULTURE","Others","Others","Bio-Pesticides and Bio-Fertilizers","panjakaviyam preparation methods","recommended for mix cow dung-5 kg,urine-3 lit,milk-3 lit,tender coconut- 3 li,sugarcane molasses- 3 lit, banana poovan-12 nos,yeast -50 g","TAMILNADU","VELLORE","ANAICUT                                           ","2014-11-11 17:26:41.480"
"KHARIF","AGRICULTURE","Fiber Crops","Cotton (Kapas)","	Plant Protection	","red cotton bug in cotton","reommended for spray imidachloprid 1 ml/ lit.","TAMILNADU","VELLORE","K.V.KUPPAM                                        ","2014-11-11 17:54:36.080"
"RABI","HORTICULTURE","Condiments and Spices","Turmeric","Fertilizer Use and Availability","Turmeric top dressing fertilizer","Recommended for apply urea 20 kg + potash 70 kg + micro food 5 kg / ac","TAMILNADU","VELLORE","ARCOT                                             ","2014-11-11 20:11:25.270"
"RABI","HORTICULTURE","Flowers","Jasmine","Bio-Pesticides and Bio-Fertilizers","pruning season for jasmine","recommended for jasmine pruning season: november","TAMILNADU","VELLORE","TIRUPPATTUR                                       ","2014-11-11 21:34:04.597"
"RABI","HORTICULTURE","Vegetables","Tomato","Cultural Practices","tomato sowing season","Recommended for tomato sowing season : November - December","TAMILNADU","VELLORE","NEMILI                                            ","2014-11-12 06:42:01.510"
"KHARIF","HORTICULTURE","Flowers","Tuberose","Fertilizer Use and Availability","growth regulators for tuberose","recommended for spray GA3 1 ml /10 lit of water","TAMILNADU","VELLORE","NEMILI                                            ","2014-11-12 06:57:56.337"
"KHARIF","AGRICULTURE","Cereals","Paddy (Dhan)","Market Information","market price of paddy","recommended for market price of paddy is rs.1468-1569/quintol","TAMILNADU","VELLORE","NEMILI                                            ","2014-11-12 07:14:43.317"
"RABI","HORTICULTURE","Fruits","Banana","Cultural Practices","pre-treatment of suckers in banana","Recommended for Pralinage is done with 40 g of Carbofuran 3 G granules per sucker. (Dip the corm in slurry solution containing 4 parts clay plus 5 parts water and sprinkle Carbofuran to control nematodes).","TAMILNADU","VELLORE","KANIYAMBADI                                       ","2014-11-12 08:22:06.173"
"KHARIF","HORTICULTURE","Fruits","Banana","Fertilizer Use and Availability","banana fertilizer management","Recommended for apply 150 gm urea + 200 gm super phosphate + 200 gm potash /plant","TAMILNADU","VELLORE","VELLORE                                           ","2014-11-12 09:00:46.593"
"KHARIF","HORTICULTURE","Vegetables","Chillies","Fertilizer Use and Availability","Chilli top dressing fertilizer","recommended for Apply urea 25 kg + neem cake 5 kg + microfood 3kg / ac","TAMILNADU","VELLORE","WALAJAPET                                         ","2014-11-12 09:41:24.083"
"RABI","AGRICULTURE","Cereals","Paddy (Dhan)","Fertilizer Use and Availability","Paddy nursery fertilizer","Recommended for apply DAP 2kg/cent","TAMILNADU","VELLORE","KAVERIPAKKAM                                      ","2014-11-12 09:45:30.190"
"KHARIF","HORTICULTURE","Flowers","Marigold","Fertilizer Use and Availability","fertilizer recommended for marigold","recommended for the fertilizer urea 45 kg /hecter","TAMILNADU","VELLORE","K.V.KUPPAM                                        ","2014-11-12 10:22:37.567"
"RABI","HORTICULTURE","Vegetables","Chillies","	Plant Protection	","Anthracnose in chilli","Recommended for Spray Mancozeb 2 g/lit","TAMILNADU","VELLORE","ARAKKONAM                                         ","2014-11-12 10:44:35.723"
"KHARIF","ANIMAL HUSBANDRY","Animal","Bovine(Cow,Buffalo)","Animal Production (Piggery, Goatery, Sheep Farming etc.)","veterinary department contact number","recommended for the contact number; 0416 2253022","TAMILNADU","VELLORE","KATPADI                                           ","2014-11-12 10:50:40.330"
"RABI","AGRICULTURE","Others","Others","Government Schemes","poultry farming details","recommended to conduct Veterinary 0416 – 2253022","TAMILNADU","VELLORE","KATPADI                                           ","2014-11-12 10:56:21.210"
"KHARIF","HORTICULTURE","Fruits","Papaya","	Plant Protection	","Papaya ring spot virus","Recommended for spray methyldemeton 2ml / lit","TAMILNADU","VELLORE","MADHANUR                                          ","2014-11-12 12:15:08.093"
"KHARIF","AGRICULTURE","Others","Others","Weather","weather detail in vellore","have no rain in vellore","TAMILNADU","VELLORE","TIMIRI                                            ","2014-11-12 12:18:20.090"
"RABI","HORTICULTURE","Vegetables","Beans ","	Plant Protection	","Pod borer in beans","Recommended for Spray quinalphos 2 ml + neem oil 3 ml + teepol 1ml /liter of water","TAMILNADU","VELLORE","JOLARPET                                          ","2014-11-12 12:20:28.320"
"KHARIF","HORTICULTURE","Vegetables","Bhindi(Okra/Ladysfinger)","Cultural Practices","vellore soil testing lab contact number","recommneded for the contact number l Thiru H.S. Siddhagangaiah, Assistant Director of Agriculture, Gudiyatham, Cell No. 9443800953","TAMILNADU","VELLORE","KAVERIPAKKAM                                      ","2014-11-12 12:40:28.000"
"KHARIF","AGRICULTURE","Pulses","Black Gram (urd bean)","Seeds","season varieties for black gram","recommended for the black gram varieties;VBN 3,4,5,6,7","TAMILNADU","VELLORE","ARAKKONAM                                         ","2014-11-12 13:09:16.213"
"RABI","HORTICULTURE","Vegetables","Brinjal","Cultural Practices","Sowing season of brinjal","Recommended for December – January and May – June","TAMILNADU","VELLORE","KAVERIPAKKAM                                      ","2014-11-12 13:34:05.997"
"KHARIF","HORTICULTURE","Vegetables","Brinjal","	Plant Protection	","Little Leaf of brinjal","Recommended for spray methyldemeton 2ml / lit","TAMILNADU","VELLORE","ARAKKONAM                                         ","2014-11-12 14:08:18.240"
"RABI","HORTICULTURE","Vegetables","Watermelon","Cultural Practices","Watermelon sowing season","Recommended for Watermelon sowing season  November – December","TAMILNADU","VELLORE","KANDILI                                           ","2014-11-12 14:56:23.037"
"KHARIF","HORTICULTURE","Vegetables","Brinjal","Nutrient Management","foliar spray in brinjal","recommended for spray 19:19:19 5g/lit of water","TAMILNADU","VELLORE","VELLORE                                           ","2014-11-12 15:11:55.753"
"KHARIF","HORTICULTURE","Fruits","Banana","Seeds and Planting Material","horticulture department no of vellore","recommended number for horticulture department 0416-2243530","TAMILNADU","VELLORE","KATPADI                                           ","2014-11-12 15:37:49.633"
"KHARIF","HORTICULTURE","Condiments and Spices","Coriander","Cultural Practices","sowing season for coriander","recommended for the season; October - November","TAMILNADU","VELLORE","WALAJAPET                                         ","2014-11-12 17:10:38.940"
"RABI","AGRICULTURE","Fiber Crops","Cotton (Kapas)","Market Information","Cotton market rate","Recommended for cotton market rate: Rs.2519 - 3329/Quintal","TAMILNADU","VELLORE","SHOLINGHUR                                        ","2014-11-12 18:56:35.570"
"RABI","AGRICULTURE","Cereals","Paddy (Dhan)","	Plant Protection	","stem borer in paddy","Recommended for spray chlorpyrifos 2ml+neem oil +teepol 1ml/lit of water","TAMILNADU","VELLORE","ARCOT                                             ","2014-11-12 19:06:20.627"
"RABI","AGRICULTURE","Cereals","Paddy (Dhan)","Fertilizer Use and Availability","Leaf folder in paddy","Recommended for Spray chlorpyriphos 2 ml /litre of water","TAMILNADU","VELLORE","VELLORE                                           ","2014-11-12 19:34:29.623"
"KHARIF","AGRICULTURE","Cereals","Paddy (Dhan)","	Plant Protection	","Seed treatment for paddy","recommended for Treat the seeds with Pseudomonas fluorescens 10g/kg of seed","TAMILNADU","VELLORE","TIMIRI                                            ","2014-11-12 19:36:38.397"
"KHARIF","AGRICULTURE","Others","Others","Weather","vellore  weather report","recommended for today is  a rainy day","TAMILNADU","VELLORE","KAVERIPAKKAM                                      ","2014-11-12 21:58:07.747"
"KHARIF","HORTICULTURE","Fruits","Banana","Nutrient Management","banana bunch development","recommended for 19:19:19 WSF 7.5gm+SOP 7.5gm/lit of water","TAMILNADU","VELLORE","TIRUPPATTUR                                       ","2014-11-13 06:30:41.520"
"KHARIF","HORTICULTURE","Flowers","Rose","	Plant Protection	","rose root rot","recommended for soil drenching with coppar oxy chloride 2.5 gram / 1 litre of water","TAMILNADU","VELLORE","SHOLINGHUR                                        ","2014-11-13 06:57:53.133"
"KHARIF","AGRICULTURE","Fiber Crops","Cotton (Kapas)","	Plant Protection	","cotton white fly","recommended for spray spiromesifen 1 ml + neem oil 3 ml + teepol 1 ml / 1 litre of water","TAMILNADU","VELLORE","NATRAMPALLI                                       ","2014-11-13 07:07:34.133"
"KHARIF","AGRICULTURE","Fiber Crops","Cotton (Kapas)","Cultural Practices","buds drop in cotton","recommended for spray planofix 5 ml/ 10 lit.","TAMILNADU","VELLORE","GUDIYATTAM                                        ","2014-11-13 08:08:59.270"
"KHARIF","AGRICULTURE","Fiber Crops","Cotton (Kapas)","	Plant Protection	","cotton foliar spray","recommended for spray cotton plus 2 kilo / 200 litre of water / acre","TAMILNADU","VELLORE","GUDIYATTAM                                        ","2014-11-13 08:11:44.400"
"KHARIF","AGRICULTURE","Cereals","Paddy (Dhan)","Varieties","paddy navarai verieties","recommended for ADT 36, IR 20, ADT 39, CO 43, IR 64, ASD 16, ASD 18, ADT 42, MDU 5, CO 47, ASD 20, TRY (R)2*","TAMILNADU","VELLORE","NEMILI                                            ","2014-11-13 08:44:11.603"
"KHARIF","AGRICULTURE","Cereals","Paddy (Dhan)","Nutrient Management","Top dressing fertilizer management for paddy","Recommended for apply urea 25 kg + potash 15 kg + neem cake 5 kg + Microfood 5 kg/ ac","TAMILNADU","VELLORE","WALAJAPET                                         ","2014-11-13 10:08:47.250"
"RABI","HORTICULTURE","Flowers","Jasmine","Fertilizer Use and Availability","jasmine fertilizer management","Recommended for apply urea 30gm + super phosphate 60gm + potash 60gm / plant","TAMILNADU","VELLORE","KATPADI                                           ","2014-11-13 11:21:23.373"
"RABI","HORTICULTURE","Fruits","Banana","Fertilizer Use and Availability","Foliar nutrition in banana","recommended for spray potassium sulphate 10-15 gm /lit of water","TAMILNADU","VELLORE","TIRUPPATTUR                                       ","2014-11-13 11:21:47.430"
"RABI","AGRICULTURE","Oilseeds","Groundnut (pea nut/mung phalli)","Fertilizer Use and Availability","Groundnut top dressing fertilizer management","Recommended for Groundnut top dressing fertilizer management Apply gypsum 80 kg / ac","TAMILNADU","VELLORE","K.V.KUPPAM                                        ","2014-11-13 11:38:07.443"
"KHARIF","AGRICULTURE","Cereals","Paddy (Dhan)","Varieties","paddy navarai varities.","recommended for ADT 36, ADT 39, ASD 16, ASD 18, MDU 5, CO 47,CORH 3, ADT 43, ADT (R) 45","TAMILNADU","VELLORE","KATPADI                                           ","2014-11-13 12:33:56.673"
"KHARIF","AGRICULTURE","Cereals","Paddy (Dhan)","Fertilizer Use and Availability","Foliar nutrition for paddy","recommended for spray urea 10gm +DAP 20gm + potassium chloride 10 gm /lit of water","TAMILNADU","VELLORE","SHOLINGHUR                                        ","2014-11-13 13:16:45.763"
"KHARIF","HORTICULTURE","Vegetables","Chillies","	Plant Protection	","chilli damping off","recommended for drench with coc 2.5 g/ lit.","TAMILNADU","VELLORE","KAVERIPAKKAM                                      ","2014-11-13 13:54:28.463"
"RABI","AGRICULTURE","Fiber Crops","Cotton (Kapas)","Nutrient Management","cotton flower dropping","cotton flower dropping Spray cotton plus 2.5kg/ac mix apsha 80 100ml/ac","TAMILNADU","VELLORE","TIRUPPATTUR                                       ","2014-11-13 16:06:40.870"
"KHARIF","HORTICULTURE","Fruits","Acid Lime","Nutrient Management","acid lime fertilizer management","recommended for apply 30 kilo fym + 500 gram urea + 200 gram ssp + 500 gram pottash / tree","TAMILNADU","VELLORE","ARAKKONAM                                         ","2014-11-13 16:17:11.750"
"KHARIF","AGRICULTURE","Oilseeds","Groundnut (pea nut/mung phalli)","	Plant Protection	","groundnut weed management","answer : EPOE application of quizalofop ethyl @ 20 g ai/acre and imazethapyr @ 20 g /acre on 15 – 20 DAS.","TAMILNADU","VELLORE","VELLORE                                           ","2014-11-13 17:39:17.590"
"RABI","HORTICULTURE","Flowers","Jasmine","Cultural Practices","spacing for jasmine","Recommended for spacing for jasmine 1.25 *1.25 m","TAMILNADU","VELLORE","NEMILI                                            ","2014-11-13 17:41:25.323"
"RABI","HORTICULTURE","Vegetables","Bhindi(Okra/Ladysfinger)","	Plant Protection	","White fly in bhendi","Recommended for White fly in bhendi  spray dimethoate 2ml+neem oil 3ml+teepol 1ml/lit of water","TAMILNADU","VELLORE","NEMILI                                            ","2014-11-13 17:56:02.617"
"KHARIF","AGRICULTURE","Others","Others","Varieties","basal application for mulbery","recommended for urea 52kg+SSP 150kg+potash 40kg/ac","TAMILNADU","VELLORE","ALANGAYAN                                         ","2014-11-13 19:08:03.920"
"KHARIF","AGRICULTURE","Cereals","Paddy (Dhan)","Nutrient Management","query : paddy top fertilizer management","answer : recommended for apply urea 25 kilo + potash 15 kilo + neem cake 5 kilo / acre","TAMILNADU","VELLORE","WALAJAPET                                         ","2014-11-13 20:05:22.953"
"KHARIF","AGRICULTURE","Millets","FingerMillet  (Ragi/Mandika)","Seeds","finger millet seedrate","recommended for 5 kg/ acre","TAMILNADU","VELLORE","NATRAMPALLI                                       ","2014-11-13 20:07:04.323"
"KHARIF","AGRICULTURE","Cereals","Paddy (Dhan)","Varieties","paddy navarai varieties","recommended for ADT 36, ADT 39, ASD 16, ASD 18, MDU 5, CO 47,CORH 3, ADT 43, ADT (R) 45","TAMILNADU","VELLORE","KATPADI                                           ","2014-11-13 20:59:28.523"
"RABI","AGRICULTURE","Others","Others","Government Schemes","asking about drip subside details","Recommended contact to agriculture office","TAMILNADU","VELLORE","KATPADI                                           ","2014-11-13 21:06:06.380"
"KHARIF","AGRICULTURE","Pulses","Pigeon pea (red gram/arhar/tur)","Cultural Practices","flower drop in red gram.","recommended for spray planofix 5 ml/ 10 lit.","TAMILNADU","VELLORE","VELLORE                                           ","2014-11-13 21:25:33.107"
"KHARIF","HORTICULTURE","Vegetables","Tomato","	Plant Protection	","spotted wilt in Tomato","Recommended for spray phosalone 2ml / lit","TAMILNADU","VELLORE","K.V.KUPPAM                                        ","2014-11-14 08:39:49.083"
"KHARIF","AGRICULTURE","Fiber Crops","Cotton (Kapas)","	Plant Protection	","pink boll worm in cotton","recommended for spray Triazophos 2ml / lit","TAMILNADU","VELLORE","WALAJAPET                                         ","2014-11-14 08:44:19.310"
"RABI","AGRICULTURE","Cereals","Paddy (Dhan)","Cultural Practices","paddy sowing season and variety","Recommended for paddy sowing season : December - January and variety : ADT 36, ADT 39, ASD 16, ASD 18, MDU 5, CO 47,CORH 3, ADT 43, ADT (R) 45","TAMILNADU","VELLORE","KAVERIPAKKAM                                      ","2014-11-14 10:08:30.457"
"KHARIF","HORTICULTURE","Vegetables","Lab Lab","Field Preparation","Lab lab Bush type Varieties","Co 6, Co 7, Co 8, Co 9, Co 10, Co 11, Co 12, Co 13, Co (Gb) 14, Arka Jay and Arka Vijay are cultivated.","TAMILNADU","VELLORE","NEMILI                                            ","2014-11-14 11:01:33.427"
"KHARIF","HORTICULTURE","Fruits","Banana","	Plant Protection	","banana corm weevil","recommended for apply carbofuran 20g / tree.","TAMILNADU","VELLORE","TIRUPPATTUR                                       ","2014-11-14 13:29:18.430"
"RABI","AGRICULTURE","Fiber Crops","Cotton (Kapas)","	Plant Protection	","Cercospora leaf spot in cotton","Recommended for spray mancozeb 2gm / lit","TAMILNADU","VELLORE","NATRAMPALLI                                       ","2014-11-14 13:36:55.350"
"RABI","HORTICULTURE","Vegetables","Chillies","	Plant Protection	","root rot in chilli","Recommended for soil drench with copper oxychloride 2.5gm / lit","TAMILNADU","VELLORE","VELLORE                                           ","2014-11-14 13:46:29.930"
"RABI","AGRICULTURE","Cereals","Paddy (Dhan)","Fertilizer Use and Availability","paddy top dressing fertilizer management","Recommended for apply urea 25 kg + potash 15 kg + neem cake 5 kg/ac","TAMILNADU","VELLORE","WALAJAPET                                         ","2014-11-14 14:14:19.860"
"KHARIF","HORTICULTURE","Fruits","Mango","Training and Exposure Visits","horticulture department no of vellore","recommended number for horticulture department 0416-2243530","TAMILNADU","VELLORE","PERANAMBATTU                                      ","2014-11-14 14:37:52.190"
"KHARIF","AGRICULTURE","Others","Others","Fertilizer Use and Availability","top dressing fertilizer for mulberry","recommended for apply 50 kg urea,32 kg potash/ac","TAMILNADU","VELLORE","ARCOT                                             ","2014-11-14 15:16:18.753"
"RABI","AGRICULTURE","Others","Others","Government Schemes","asking about govt.schemes details","Recommended contact to block level agriculture office","TAMILNADU","VELLORE","KATPADI                                           ","2014-11-14 15:20:04.567"
"RABI","AGRICULTURE","Cereals","Paddy (Dhan)","Fertilizer Use and Availability","paddy top dressing fertilizer management","Recommended for apply urea 25 kg + potash 15 kg + neem cake 5 kg/ac","TAMILNADU","VELLORE","KAVERIPAKKAM                                      ","2014-11-14 15:24:58.690"
"KHARIF","ANIMAL HUSBANDRY","Animal","Bovine(Cow,Buffalo)","Animal Nutrition","veterinary research centre contact no.","recommended 0416 – 2253022 number.","TAMILNADU","VELLORE","TIMIRI                                            ","2014-11-14 15:28:11.520"
"KHARIF","AGRICULTURE","Cereals","Paddy (Dhan)","	Plant Protection	","Grain discoluration control for paddy","recommended for spray mancozeb 2 gm / lit of water","TAMILNADU","VELLORE","TIMIRI                                            ","2014-11-14 15:28:39.243"
