"Season","Sector","Category","Crop","QueryType","QueryText","KCCAns","StateName","DistrictName","BlockName","CreatedOn"
"RABI","ANIMAL HUSBANDRY","Animal","Bovine(Cow,Buffalo)","Animal Nutrition","how much  Fertilizer dose of apple plants ?","Fertilizer dose of apple plants are 100kg FYM + 2800gm CAN (January march month)+ 2200gm SP + 1200gm MOP (December month)/plant.","HIMACHAL PRADESH","KULLU","ANNI","2014-12-16 18:54:23.930"
"RABI","AGRICULTURE","Others","Others","Weather","Weather today of Kullu ?","Weather today of Kullu is cloudy and chance of rainfall.","HIMACHAL PRADESH","KULLU","KULLU                                             ","2014-12-16 19:59:44.847"
"RABI","HORTICULTURE","Fruits","Apple","Fertilizer Use and Availability","How much Fertilizer dose of apple plants ?","Fertilizer dose of apple plants are 100kg FYM + 2800gm CAN (February- march month)+ 2200gm SP + 1200gm MOP (December month)/plant.","HIMACHAL PRADESH","KULLU","NIRMAND","2014-12-16 20:27:32.607"
"RABI","HORTICULTURE","Fruits","Apple","	Plant Protection	","information regarding Lichen in apple plants ?","Lichen in apple plants are spray caustic soda @ 2kg/200litre of water.","HIMACHAL PRADESH","KULLU","NIRMAND","2014-12-17 10:56:27.483"
"RABI","HORTICULTURE","Vegetables","Potato","Fertilizer Use and Availability","Sowing time fertilizer dose of potato ?","Sowing time fertilizer dose of potato are UREA 21kg + 40 SSP + MOP 8kg/bigha.","HIMACHAL PRADESH","KULLU","ANNI","2014-12-17 18:44:39.590"
"RABI","AGRICULTURE","Others","Others","Weather","Weather today of Kullu ?","Weather today of Kullu is cloudy and no chance of rainfall.","HIMACHAL PRADESH","KULLU","NAGGAR","2014-12-18 08:35:57.040"
"RABI","AGRICULTURE","Others","Others","Weather","Weather today of kullu ?","Weather today of kullu is cloudy and no chance of rainfall.","HIMACHAL PRADESH","KULLU","ANNI","2014-12-18 08:48:13.490"
"RABI","HORTICULTURE","Fruits","Apple","Fertilizer Use and Availability","Fertilizer dose of apple plants ?","Fertilizer dose of apple plants are 100kg FYM + 2800gm CAN (February- march month)+ 2200gm SP + 1200gm MOP (December month)/plant.","HIMACHAL PRADESH","KULLU","ANNI","2014-12-19 09:35:37.923"
"RABI","AGRICULTURE","Others","Others","Weather","Information reagrding Weather Today in Banjar Tehsil ?","Weather Today in Banjar Tehsil are : Mostaly Cloudy 5-10 % Chance of Rain.","HIMACHAL PRADESH","KULLU","BANJAR                                            ","2014-12-19 10:50:28.607"
"RABI","AGRICULTURE","Others","Others","Weather","Weather today of Kullu ?","Weather today of Kullu is cloudy and no chance of rainfall.","HIMACHAL PRADESH","KULLU","NIRMAND","2014-12-19 10:50:31.757"
"KHARIF","AGRICULTURE","Others","Others","Weather","Weather reports of kullu ?","Weather reports of kullu are tomorrow clear and chance of rainfall","HIMACHAL PRADESH","KULLU","ANNI","2014-12-19 14:22:51.990"
"RABI","HORTICULTURE","Fruits","Apple","	Plant Protection	","information regarding Bordeaux mixture ratios in apple plants ?","Bordeaux mixture ratios in apple plants are spray Copper Sulphate @ 1 Kg + Quick Lime @ 1 Kg/100 Liters of water.","HIMACHAL PRADESH","KULLU","ANNI","2014-12-19 15:29:19.490"
"RABI","AGRICULTURE","Others","Others","Weather","Weather reports of kullu are tomorrow ?","Weather reports of kullu are tomorrow no clear and chance of rainfall .","HIMACHAL PRADESH","KULLU","NIRMAND","2014-12-19 17:45:18.640"
"RABI","HORTICULTURE","Fruits","Apple","Field Preparation","Plantation time of apple ?","Plantation time of apple are end December to march month.","HIMACHAL PRADESH","KULLU","NIRMAND","2014-12-20 07:35:29.250"
"RABI","HORTICULTURE","Fruits","Apple","Fertilizer Use and Availability","Fertilizer dose of apple plants ?","Fertilizer dose of apple plants are 100kg FYM + 2800gm CAN (February- march month)+ 2200gm SP + 1200gm MOP (December month)/plant.","HIMACHAL PRADESH","KULLU","NIRMAND","2014-12-20 09:03:24.850"
"RABI","HORTICULTURE","Fruits","Apple","	Plant Protection	","information regarding Plantation time of apple ?","Plantation time of apple are end December to march month.","HIMACHAL PRADESH","KULLU","NIRMAND","2014-12-20 14:52:07.590"
"RABI","AGRICULTURE","Others","Others","Weather","Information regarding Weather Today in Nirmand Tehsil ?","Weather Today in Nirmand Tehsil are : Mostaly Cloudy No Chance of Rain.","HIMACHAL PRADESH","KULLU","NIRMAND","2014-12-20 15:18:30.317"
"RABI","AGRICULTURE","Others","Others","Weather","Information reagrding Weather Today in Kullu Distt ?","Weather Today in Kullu Distt . Mostaly Cloudy 5-10 % Chance of Rain.","HIMACHAL PRADESH","KULLU","KULLU                                             ","2014-12-20 16:50:42.590"
"RABI","AGRICULTURE","Others","Others","Weather","weather of kullu ?","tonight chance fo rain .","HIMACHAL PRADESH","KULLU","ANNI","2014-12-20 17:16:44.190"
"RABI","AGRICULTURE","Others","Others","Varieties","information regarding horticulture university nauni.solan) contact number ?","horticulture university nauni(solan) contact number-01792 252326","HIMACHAL PRADESH","KULLU","NIRMAND","2014-12-20 18:32:54.940"
"RABI","HORTICULTURE","Fruits","Apple","	Plant Protection	","how to Control root borer in apple plants ?","Control root borer in apple plants are drenching chlorpariphos @ 3ml/litre of water.","HIMACHAL PRADESH","KULLU","ANNI","2014-12-20 18:48:51.893"
"RABI","HORTICULTURE","Fruits","Apple","	Plant Protection	","What Spray I Use After Pruning and Cutting ?","Spray Bordo Mixture After Cutting.","HIMACHAL PRADESH","KULLU","NIRMAND","2014-12-20 19:48:31.230"
"RABI","AGRICULTURE","Others","Others","Weather","Weather today of Kullu ?","Weather today of Kullu is cloudy and no chance of rainfall.","HIMACHAL PRADESH","KULLU","NIRMAND","2014-12-21 07:49:30.403"
"RABI","HORTICULTURE","Fruits","Apple","Fertilizer Use and Availability","Fertilizer dose of apple plants ?","Fertilizer dose of apple plants are 100kg FYM + 2800gm CAN (February- march month)+ 2200gm SP + 1200gm MOP (December month)/plant.","HIMACHAL PRADESH","KULLU","NIRMAND","2014-12-21 07:53:06.800"
"RABI","HORTICULTURE","Fruits","Apple","	Plant Protection	","Bordeaux mixture ratios in apple plants ?","Bordeaux mixture ratios in apple plants are spray Copper Sulphate @ 1 Kg + Quick Lime @ 1 Kg/100 Liters of water.","HIMACHAL PRADESH","KULLU","NIRMAND","2014-12-21 08:04:41.973"
"RABI","AGRICULTURE","Others","Others","Weather","Weather today of Kullu ?","Weather today of Kullu is cloudy and no chance of rainfall.","HIMACHAL PRADESH","KULLU","NIRMAND","2014-12-21 08:35:20.760"
"RABI","HORTICULTURE","Fruits","Apple","	Plant Protection	","How to Control root borer in apple plants ?","Control root borer in apple plants are drenching chlorpyriphos @ 3ml/litre of water.","HIMACHAL PRADESH","KULLU","NIRMAND","2014-12-21 08:37:29.360"
"RABI","HORTICULTURE","Fruits","Apple","	Plant Protection	","How to Control root borer in apple plants ?","Control root borer in apple plants are drenching chlorpyriphos @ 3ml/litre of water.","HIMACHAL PRADESH","KULLU","NIRMAND","2014-12-21 10:28:33.213"
"RABI","HORTICULTURE","Fruits","Apple","	Plant Protection	","Bordeaux mixture ratios in apple plants ?","Bordeaux mixture ratios in apple plants are spray Copper Sulphate @ 1 Kg + Quick Lime @ 1 Kg/100 Liters of water.","HIMACHAL PRADESH","KULLU","NIRMAND","2014-12-21 10:29:37.570"
"RABI","HORTICULTURE","Fruits","Apple","	Plant Protection	","how much Fertilizer dose of apple plants ?","Fertilizer dose of apple plants are 100kg FYM + 2800gm CAN (January march month)+ 2200gm SP + 1200gm MOP (December month)/plant.","HIMACHAL PRADESH","KULLU","ANNI","2014-12-21 11:43:30.453"
"RABI","HORTICULTURE","Fruits","Apple","	Plant Protection	","information regarding Bordeaux mixture ratios in apple plants ?","Bordeaux mixture ratios in apple plants are spray Copper Sulphate @ 1 Kg + Quick Lime @ 1 Kg/100 Liters of water.","HIMACHAL PRADESH","KULLU","NIRMAND","2014-12-21 11:49:53.683"
"RABI","HORTICULTURE","Fruits","Apple","	Plant Protection	","information regarding Bordeaux mixture ratios in apple plants ?","Bordeaux mixture ratios in apple plants are spray Copper Sulphate @ 1 Kg + Quick Lime @ 1 Kg/100 Liters of water.","HIMACHAL PRADESH","KULLU","ANNI","2014-12-21 11:51:42.730"
"RABI","HORTICULTURE","Fruits","Apple","Fertilizer Use and Availability","Fertilizer dose of apple plants ?","Fertilizer dose of apple plants are 100kg FYM + 2800gm CAN (February- march month)+ 2200gm SP + 1200gm MOP (December month)/plant.","HIMACHAL PRADESH","KULLU","ANNI","2014-12-21 13:20:22.240"
"RABI","HORTICULTURE","Fruits","Apple","Bio-Pesticides and Bio-Fertilizers","Plantation time of apple ?","Plantation time of apple are end December to march month.","HIMACHAL PRADESH","KULLU","ANNI","2014-12-21 19:44:21.263"
"RABI","HORTICULTURE","Fruits","Apple","Fertilizer Use and Availability","How much fertilizer dose in in apple plant ?","fertilizer dose in in apple plant are : superposphate -2.200 gm ,F.Y.M-100 kg ,Potash-1kg ,and CAN-1.400 gm Before flowering 15-20 day and 1.400 gm may -june .in 10 year above all plant .","HIMACHAL PRADESH","KULLU","ANNI","2014-12-22 09:04:12.567"
"RABI","HORTICULTURE","Fruits","Apple","	Plant Protection	","Bordeaux mixture ratios in apple plants ?","Bordeaux mixture ratios in apple plants are spray Copper Sulphate @ 1 Kg + Quick Lime @ 1 Kg/100 Liters of water.","HIMACHAL PRADESH","KULLU","ANNI","2014-12-22 09:50:09.813"
"RABI","HORTICULTURE","Fruits","Apple","	Plant Protection	","How Much fertilizer dose in in apple plant ?","fertilizer dose in in apple plant are : superposphate -2.200 gm ,F.Y.M-100 kg ,Potash-1kg ,and CAN-1.400 gm Before flowering 15-20 day and 1.400 gm may -june .in 10 year above all plant .","HIMACHAL PRADESH","KULLU","NIRMAND","2014-12-22 12:00:13.253"
"RABI","HORTICULTURE","Vegetables","Tomato","Agriculture Mechanization","Information reagrding Improved Var. of Tomato In Poly House ?","Improved Var. of Tomato In Poly House are : Avtar ,7711 , Naveen 2000 + ,Amrsha ,B.S.S-366 Etc.","HIMACHAL PRADESH","KULLU","NAGGAR","2014-12-22 14:34:29.770"
"RABI","AGRICULTURE","Others","Others","Weather","WEATHER OF KULLU ?","TONIGHT NO CHANCE OF RAIN .","HIMACHAL PRADESH","KULLU","KULLU                                             ","2014-12-22 14:39:31.103"
"RABI","AGRICULTURE","Others","Others","Weather","Information regarding Weather Today in Nirmand Tehsil ?","Weather Today in Nirmand Tehsil are : Mostaly Cloudy 5-10 % Chance of Rain.","HIMACHAL PRADESH","KULLU","NIRMAND","2014-12-22 14:49:12.810"
"RABI","HORTICULTURE","Fruits","Apple","Fertilizer Use and Availability","How much Dose of SSP ,MOP in 10 Year's And Above Apple Plants ?","Dose of SSP are : 2200 Gm ,MOP are :1200 Gm in 10 Year's And Above Apple Plants .","HIMACHAL PRADESH","KULLU","NIRMAND","2014-12-22 15:50:18.487"
"RABI","AGRICULTURE","Others","Others","Weather","Information reagrding Weather Today in Nirmand Tehsil ?","Weather Today in Nirmand Tehsil are : Mostaly Cloudy 5-10 % Chance of Rain.","HIMACHAL PRADESH","KULLU","NIRMAND","2014-12-22 20:07:12.377"
"RABI","AGRICULTURE","Others","Others","Agriculture Mechanization","Information regarding Give me Uni. Helpline Phone No ?","Uni. Helpline Phone No are : 01894-230395 .","HIMACHAL PRADESH","KULLU","KULLU                                             ","2014-12-22 21:50:30.857"
"RABI","HORTICULTURE","Vegetables","Capsicum","	Plant Protection	","How much Soil Treament Dose Formlinem ?","Soil Treament Dose Formlinem are : 1 liter /50 liter .","HIMACHAL PRADESH","KULLU","BANJAR                                            ","2014-12-23 09:30:16.480"
"RABI","AGRICULTURE","Others","Others","Crop Insurance","Information Regarding Crop Insurance Detals ?","Crop Insurance Detals are : Nearest Contect in A.D.O and H.D.O .","HIMACHAL PRADESH","KULLU","ANNI","2014-12-23 11:00:59.273"
"RABI","AGRICULTURE","Others","Others","	Plant Protection	","How to control Yellow Rust In Wheat Crop ?","control Yellow Rust In Wheat Crop are : Spray Tilt @ 1 ml /1 liter of water .","HIMACHAL PRADESH","KULLU","NIRMAND","2014-12-23 11:27:00.717"
"RABI","AGRICULTURE","Others","Others","Weather","Information regarding weather in kullu ?","weather in kullu are :Today no chance of rain .","HIMACHAL PRADESH","KULLU","ANNI","2014-12-23 12:06:59.017"
"RABI","HORTICULTURE","Fruits","Apple","	Plant Protection	","How to Control canker in apple plants ?","Control canker in apple plants are spray copper ox chloride @ 600gm/200litre of water.","HIMACHAL PRADESH","KULLU","ANNI","2014-12-23 12:23:18.287"
"RABI","HORTICULTURE","Fruits","Apple","Bio-Pesticides and Bio-Fertilizers","How much fertilizer dose in apple plant ?","How much fertilizer dose in apple plant ?
fertilizer dose in in apple plant are : superposphate -2.200 gm ,F.Y.M-100 kg ,Potash-1kg ,and CAN-1.400 gm Before flowering 15-20 day and 1.400 gm may -june .in 10 year above all plant .","HIMACHAL PRADESH","KULLU","ANNI","2014-12-23 15:55:48.020"
"RABI","HORTICULTURE","Fruits","Apple","	Plant Protection	","how much  Fertilizer dose of apple plants ?","Fertilizer dose of apple plants are 100kg FYM + 2800gm CAN (January - march month)+ 2200gm SP + 1200gm MOP (December month)/plant.","HIMACHAL PRADESH","KULLU","ANNI","2014-12-23 15:56:26.063"
"RABI","AGRICULTURE","Cereals","Wheat","	Plant Protection	","information regarding varieties of wheat ?","improve var. in wheat are : H.P.W-236,251,155,147 H.S-295,V.L-829,H.S-240.","HIMACHAL PRADESH","KULLU","KULLU                                             ","2014-12-23 16:17:31.527"
"RABI","HORTICULTURE","Vegetables","Cauliflower","	Plant Protection	","TELL ME ABOUT IMPROVED VARIETIES OF CAULIFLOWER?","IMPROVED VARIETIES OF CAULIFLOWER ARE :EARLY KUNWARI,PUSA DIPALI ,IMPROVED JAPANI,PUSA SNOWAL-1,PUSA SNOWAL K-1,PALAM UPHAR.","HIMACHAL PRADESH","KULLU","ANNI","2014-12-23 18:22:08.543"
"RABI","AGRICULTURE","Others","Others","Weather","CONTACT NUMBER OF NAUNI UNIVERSITY","CONTACT NUMBER OF NAUNI UNIVERSITY
PLEASE CONTACT 01792 252326","HIMACHAL PRADESH","KULLU","ANNI","2014-12-23 19:14:17.900"
"RABI","HORTICULTURE","Fruits","Apple","	Plant Protection	","how to Control root rot in apple ?","Control root rot in apple are drenching indofil m-45 @25gm + bavistin @ 10gm/10litre of water.","HIMACHAL PRADESH","KULLU","NIRMAND","2014-12-24 06:41:55.117"
"RABI","HORTICULTURE","Vegetables","Cauliflower","	Plant Protection	","How to Control leaf spot in cauliflower ?","Control leaf spot in cauliflower are spray indofil m-45 @ 25gm + bavistin @ 10gm/10 liter of water.","HIMACHAL PRADESH","KULLU","BANJAR                                            ","2014-12-24 08:28:45.513"
"RABI","HORTICULTURE","Fruits","Apple","	Plant Protection	","how much Fertilizer dose of apple plants ?","Fertilizer dose of apple plants are 100kg FYM + 2800gm CAN (January - march month)+ 2200gm SP + 1200gm MOP (December month)/plant.","HIMACHAL PRADESH","KULLU","ANNI","2014-12-24 08:54:10.700"
"RABI","HORTICULTURE","Fruits","Sapota","	Plant Protection	","Information regarding Give me Nauni Uni.Helpline Phone No ?","Nauni Uni.Helpline Phone No are :01792-252326","HIMACHAL PRADESH","KULLU","KULLU                                             ","2014-12-24 09:35:00.677"
"RABI","HORTICULTURE","Fruits","Apple","	Plant Protection	","Fertilizer dose of apple plants ?","Fertilizer dose of apple plants are 100kg FYM + 2800gm CAN (February- march month)+ 2200gm SP + 1200gm MOP (December month)/plant.","HIMACHAL PRADESH","KULLU","BANJAR                                            ","2014-12-24 09:45:28.667"
"RABI","AGRICULTURE","Others","Others","Weather","Weather report of kullu ?","Weather report of kullu  is today cloudy and no chance of rainfall.","HIMACHAL PRADESH","KULLU","NIRMAND","2014-12-24 10:07:07.457"
"KHARIF","AGRICULTURE","Others","Others","Weather","Information regarding weather in Kuliu ?","weather in Kuliu are : Today no chance of rain .","HIMACHAL PRADESH","KULLU","NIRMAND","2014-12-25 15:25:23.033"
"RABI","HORTICULTURE","Fruits","Apple","Cultural Practices","information regarding  Bordeaux mixture ratios in apple plants ?","Bordeaux mixture ratios in apple plants are spray Copper Sulphate @ 1 Kg + Quick Lime @ 1 Kg/100 Liters of water.","HIMACHAL PRADESH","KULLU","ANNI","2014-12-25 17:28:22.260"
"RABI","HORTICULTURE","Fruits","Passion Fruit","	Plant Protection	","Information regarding Give me Nauni Uni.Helpline Phone No ?","Nauni Uni.Helpline Phone No are :01792-252326","HIMACHAL PRADESH","KULLU","KULLU                                             ","2014-12-25 19:02:38.517"
"RABI","HORTICULTURE","Fruits","Apple","	Plant Protection	","how  much  Fertilizer dose of apple plants ?","Fertilizer dose of apple plants are 100kg FYM + 2800gm CAN (January - march month)+ 2200gm SP + 1200gm MOP (December month)/plant.","HIMACHAL PRADESH","KULLU","NIRMAND","2014-12-26 07:52:42.530"
"RABI","HORTICULTURE","Fruits","Apple","	Plant Protection	","How to Control canker in apple plants ?","Control canker in apple plants are spray copper ox chloride @ 600gm/200litre of water.","HIMACHAL PRADESH","KULLU","NIRMAND","2014-12-26 08:28:21.480"
"RABI","HORTICULTURE","Fruits","Apple","	Plant Protection	","Information regarding Give me Nauni Uni.Helpline Phone No ?","Nauni Uni.Helpline Phone No are :01792-252326","HIMACHAL PRADESH","KULLU","ANNI","2014-12-26 10:08:43.427"
"RABI","HORTICULTURE","Fruits","Apple","	Plant Protection	","How to Control canker in apple plants ?","Control canker in apple plants are spray copper ox chloride @ 600gm/200litre of water.","HIMACHAL PRADESH","KULLU","NIRMAND","2014-12-26 11:23:17.343"
"RABI","HORTICULTURE","Fruits","Almond","	Plant Protection	","How to Control gum in almond plants ?","Control gum in almond plants are borex @ 100gm/plants.","HIMACHAL PRADESH","KULLU","NAGGAR","2014-12-26 12:25:20.520"
"RABI","AGRICULTURE","Others","Others","Weather","Weather reports of kullu are tomorrow clear and no chance of rainfall","Weather reports of kullu are tomorrow clear and no chance of rainfall","HIMACHAL PRADESH","KULLU","NIRMAND","2014-12-26 12:51:08.093"
"RABI","HORTICULTURE","Vegetables","Potato","Fertilizer Use and Availability","Sowing time fertilizer dose of potato ?","Sowing time fertilizer dose of potato are UREA 21kg + 40 SSP + MOP 8kg/bigha.","HIMACHAL PRADESH","KULLU","NIRMAND","2014-12-26 13:56:20.427"
"RABI","HORTICULTURE","Fruits","Apple","Bio-Pesticides and Bio-Fertilizers","information regarding fertilizer does in apple ?","information regarding fertilizer does in apple ? 
 Fertilizer dose of apple plants are 100kg FYM + 2800gm CAN (January march month)+ 2200gm SP + 1200gm MOP (December month)/plant.","HIMACHAL PRADESH","KULLU","NIRMAND","2014-12-26 15:00:55.063"
"RABI","HORTICULTURE","Fruits","Apple","	Plant Protection	","How to control Cankar In Apple plant ?","control Cankar In Apple plant  are : Spray Blitox @ 600 gm /200 liter of water .","HIMACHAL PRADESH","KULLU","NAGGAR","2014-12-26 16:23:29.447"
"RABI","AGRICULTURE","Others","Others","Weather","weather of kangra ?","today  no chance of rain .","HIMACHAL PRADESH","KULLU","BANJAR                                            ","2014-12-26 16:59:55.323"
"RABI","AGRICULTURE","Others","Others","Weather","Information reagrding Weather Today in Nirmand Tehsil ?","Weather Today in Nirmand Tehsil are : Mostaly Cloudy 5 % Chance of Rain.","HIMACHAL PRADESH","KULLU","NIRMAND","2014-12-26 19:39:11.950"
"RABI","AGRICULTURE","Others","Others","Varieties","Information reagrding Weather Today In Ani Tehsil ?","Weather Today In Ani Tehsil are : Mostaly Cloudy No Chance of Rain.","HIMACHAL PRADESH","KULLU","ANNI","2014-12-26 20:28:52.717"
"RABI","AGRICULTURE","Cereals","Wheat","Power, Roads etc.","Subsidy of Power Tiller-?","Subsidy of Power Tiller-45,000 or 40% of the cost whichever is less for 8 BHP and above.25,000 or 40% of the cost whichever is less for less than 8 BHP.","HIMACHAL PRADESH","KULLU","KULLU                                             ","2014-12-27 09:15:02.777"
"RABI","HORTICULTURE","Fruits","Apple","	Plant Protection	","Information regarding Give me Nauni Uni.Helpline Phone No ?","Nauni Uni.Helpline Phone No are :01792-252326","HIMACHAL PRADESH","KULLU","ANNI","2014-12-27 09:40:33.853"
"RABI","AGRICULTURE","Others","Others","Weather","Weather today of Kullu ?","Weather today of Kullu is cloudy and no chance of rainfall.","HIMACHAL PRADESH","KULLU","NIRMAND","2014-12-27 10:26:21.083"
"RABI","HORTICULTURE","Fruits","Apple","	Plant Protection	","Bordeaux mixture ratios in apple plants ?","Bordeaux mixture ratios in apple plants are spray Copper Sulphate @ 1 Kg + Quick Lime @ 1 Kg/100 Liters of water.","HIMACHAL PRADESH","KULLU","ANNI","2014-12-27 12:18:59.693"
"RABI","HORTICULTURE","Fruits","Apple","Bio-Pesticides and Bio-Fertilizers","Fertilizer dose of apple ?","Fertilizer dose of apple plants are 100kg FYM + 2800gm CAN (January march month)+ 2200gm SP + 1200gm MOP (December month)/plant.","HIMACHAL PRADESH","KULLU","ANNI","2014-12-27 15:56:05.757"
"RABI","AGRICULTURE","Others","Others","Weather","weather of kullu ?","tonight no chance of rain .","HIMACHAL PRADESH","KULLU","NIRMAND","2014-12-27 16:52:14.170"
"RABI","AGRICULTURE","Others","Others","Weather","Information reagrding Weather Today In Kullu Distt. ?","Weather Today In Kullu Distt. are : Mostaly Cloudy No Chance of Rain.","HIMACHAL PRADESH","KULLU","KULLU                                             ","2014-12-27 19:34:10.140"
"RABI","HORTICULTURE","Fruits","Apple","Field Preparation","How much Dose of CAN , SSP and MOP in 10 Year's And Above Apple Plant ?","Dose of CAN are : 2800 Gm , SSP are : 2200 Gm  And MOP are : 1200 Gm in 10 Year's And Above Apple Plants . First Half Does of CAN are Apply Feb-Mach and Secound Are Apply After One Months Lettar ,SSP And Mop are Apply Dec.-Jan .","HIMACHAL PRADESH","KULLU","ANNI","2014-12-27 20:06:27.680"
"RABI","HORTICULTURE","Fruits","Apple","	Plant Protection	","How to Control root borer in apple plants ?","Control root borer in apple plants are drenching chlorpyriphos @ 3ml/litre of water.","HIMACHAL PRADESH","KULLU","NIRMAND","2014-12-28 09:35:23.827"
"RABI","HORTICULTURE","Fruits","Apple","	Plant Protection	","information regarding  Bordeaux mixture ratios in apple plants ?","Bordeaux mixture ratios in apple plants are spray Copper Sulphate @ 1 Kg + Quick Lime @ 1 Kg/100 Liters of water.","HIMACHAL PRADESH","KULLU","ANNI","2014-12-28 12:19:31.957"
"RABI","AGRICULTURE","Others","Others","Varieties","Information regarding weather in kullu ?","weather in kullu are : Today no chance of rain .","HIMACHAL PRADESH","KULLU","NIRMAND","2014-12-28 12:54:11.113"
"RABI","HORTICULTURE","Fruits","Apple","	Plant Protection	","How Much Pruning After time spray in Apple ?","Pruning After time spray in Apple are : Spray Copper Oxichlorid @ 600 gm /200 liter of Water .","HIMACHAL PRADESH","KULLU","NIRMAND","2014-12-28 13:11:00.033"
"RABI","AGRICULTURE","Others","Others","Weather","Weather report of kullu ?","Weather report of kullu is today cloudy and no chance of rainfall.","HIMACHAL PRADESH","KULLU","NIRMAND","2014-12-28 13:26:46.847"
"RABI","AGRICULTURE","Others","Others","Weather","Information Regarding Weather in Kullu ?","Weather in Kullu are : Today No chance of Rain .","HIMACHAL PRADESH","KULLU","ANNI","2014-12-28 13:38:59.220"
"RABI","HORTICULTURE","Fruits","Apple","Fertilizer Use and Availability","How much Dose of Potash Apply in 10 Year's And Above Apple Plant ?","Dose of Potash Apply in 10 Year's And Above Apple Plant are :1200 Gm / Plant.","HIMACHAL PRADESH","KULLU","ANNI","2014-12-28 14:16:17.827"
"RABI","HORTICULTURE","Fruits","Apple","Fertilizer Use and Availability","Fertilizer dose of apple plants ?","Fertilizer dose of apple plants are 100kg FYM + 2800gm CAN (January march month)+ 2200gm SP + 1200gm MOP (December month)/plant.","HIMACHAL PRADESH","KULLU","NIRMAND","2014-12-28 15:13:15.017"
"RABI","AGRICULTURE","Others","Others","Weather","How much Subsidies in poly house ?","Subsidies in poly house are : 85 % .","HIMACHAL PRADESH","KULLU","NIRMAND","2014-12-28 15:52:04.640"
"RABI","HORTICULTURE","Fruits","Apple","Bio-Pesticides and Bio-Fertilizers","Fertilizer dose of apple plants ?","Fertilizer dose of apple plants are 100kg FYM + 2800gm CAN (January march month)+ 2200gm SP + 1200gm MOP (December month)/plant.","HIMACHAL PRADESH","KULLU","ANNI","2014-12-28 16:41:10.810"
"RABI","HORTICULTURE","Fruits","Apple","Bio-Pesticides and Bio-Fertilizers","Control canker in apple plants ?","Control canker in apple plants are spray copper ox chloride @ 600gm/200litre of water.","HIMACHAL PRADESH","KULLU","ANNI","2014-12-28 18:21:56.470"
"RABI","AGRICULTURE","Others","Others","Weather","Information reagrding Weather Today in Kullu Distt. ?","Weather Today in Kullu Distt.are : Mostaly Cloudy No Chance of Rain","HIMACHAL PRADESH","KULLU","KULLU                                             ","2014-12-28 19:49:55.420"
"RABI","AGRICULTURE","Others","Others","Weather","Weather report of KULLU is today cloudy and no chance of rainfall.","Weather report of KULLU is today cloudy and no chance of rainfall.","HIMACHAL PRADESH","KULLU","NIRMAND","2014-12-29 07:21:02.687"
"RABI","HORTICULTURE","Fruits","Apple","	Plant Protection	","information regarding Bordeaux mixture ratios in apple plants ?","Bordeaux mixture ratios in apple plants are spray Copper Sulphate @ 1 Kg + Quick Lime @ 1 Kg/100 Liters of water.","HIMACHAL PRADESH","KULLU","ANNI","2014-12-29 08:58:44.177"
"RABI","AGRICULTURE","Others","Others","Weather","Weather report of kullu ?","Weather report of kullu is today cloudy and no chance of rainfall.","HIMACHAL PRADESH","KULLU","NAGGAR","2014-12-29 11:04:40.327"
