"Season","Sector","Category","Crop","QueryType","QueryText","KCCAns","StateName","DistrictName","BlockName","CreatedOn"
"RABI","HORTICULTURE","Fruits","Apple","	Plant Protection	","how much  Fertilizer dose of apple plants ?","Fertilizer dose of apple plants are 100kg FYM + 2800gm CAN (January - march month)+ 2200gm SP + 1200gm MOP (December month)/plant.","HIMACHAL PRADESH","KULLU","ANNI","2014-12-29 11:08:22.770"
"RABI","HORTICULTURE","Fruits","Apple","Fertilizer Use and Availability","Fertilizer dose of apple plants ?","Fertilizer dose of apple plants are 100kg FYM + 2800gm CAN (February- march month)+ 2200gm SP + 1200gm MOP (December month)/plant.","HIMACHAL PRADESH","KULLU","NIRMAND","2014-12-29 11:13:22.193"
"RABI","HORTICULTURE","Plantation Crops","Sagoan","	Plant Protection	","Information regarding Give me Nauni Uni.Helpline Phone No ?","Nauni Uni.Helpline Phone No are :01792-252326","HIMACHAL PRADESH","KULLU","KULLU                                             ","2014-12-29 11:23:50.517"
"RABI","HORTICULTURE","Fruits","Apple","	Plant Protection	","how to control Lichen in apple plants ?","Lichen in apple plants are spray caustic soda @ 2kg/200litre of water.","HIMACHAL PRADESH","KULLU","ANNI","2014-12-29 11:33:04.723"
"RABI","AGRICULTURE","Others","Others","Weather","Weather report of kullu ?","Weather report of kullu is today cloudy and no chance of rainfall.","HIMACHAL PRADESH","KULLU","NIRMAND","2014-12-29 12:18:14.357"
"RABI","HORTICULTURE","Fruits","Apple","	Plant Protection	","How to control Cankar In Apple plant ?","control Cankar In Apple plant  are : Spray Blitox @ 600 gm /200 liter of water .","HIMACHAL PRADESH","KULLU","NIRMAND","2014-12-29 14:31:32.970"
"RABI","HORTICULTURE","Fruits","Apple","	Plant Protection	","How to control Cankar In Apple plant ?","control Cankar In Apple plant  are : Spray Blitox @ 600 gm /200 liter of water .","HIMACHAL PRADESH","KULLU","KULLU                                             ","2014-12-29 18:11:51.157"
"RABI","HORTICULTURE","Fruits","Apple","Seeds and Planting Material","Tell Me About PLantation Time in Apple ?","PLantation Time in Apple are : December to March .","HIMACHAL PRADESH","KULLU","BANJAR                                            ","2014-12-29 19:29:41.930"
"RABI","HORTICULTURE","Fruits","Apple","	Plant Protection	","How to control Root Borer in apple plant?","control Root Borer in apple plant are : Drenching Chloropyrifos @ 500 ml /100 liter of water .","HIMACHAL PRADESH","KULLU","NIRMAND","2014-12-30 08:44:40.067"
"RABI","HORTICULTURE","Fruits","Apple","	Plant Protection	","How much ratio of Bordaux Mixture ?","Ratio of Bordaux Mixture are : 2 Kg Quick Lime +2 Kg Lime + 200 Liters of Water.","HIMACHAL PRADESH","KULLU","ANNI","2014-12-30 09:10:50.197"
"RABI","AGRICULTURE","Others","Others","Weather","Information regarding weather Today in Nirmand Tehsil ?","weather Today in Nirmand Tehsil are : Mostaly Cloudy No Chance of Rain.","HIMACHAL PRADESH","KULLU","NIRMAND","2014-12-30 10:09:06.090"
"RABI","HORTICULTURE","Fruits","Apple","	Plant Protection	","How to control Cankar In Apple plant ?","control Cankar In Apple plant  are : Spray Blitox @ 600 gm /200 liter of water .","HIMACHAL PRADESH","KULLU","NIRMAND","2014-12-30 10:29:20.150"
"RABI","HORTICULTURE","Fruits","Apple","	Plant Protection	","How to control Cankar In Apple plant ?","control Cankar In Apple plant  are : Spray Blitox @ 600 gm /200 liter of water .","HIMACHAL PRADESH","KULLU","ANNI","2014-12-30 11:29:52.847"
"RABI","HORTICULTURE","Fruits","Apple","	Plant Protection	","How to control Cankar In Apple plant ?","control Cankar In Apple plant  are : Spray Blitox @ 600 gm /200 liter of water .","HIMACHAL PRADESH","KULLU","ANNI","2014-12-30 11:55:14.660"
"RABI","HORTICULTURE","Fruits","Apple","	Plant Protection	","How to control root rot in Apple Plant  ?","control root rot in Apple Plant  are : Drenching Saaf @ 25 gm /10 liter of water .","HIMACHAL PRADESH","KULLU","ANNI","2014-12-30 13:33:23.650"
"RABI","HORTICULTURE","Fruits","Apple","Bio-Pesticides and Bio-Fertilizers","23.	Fertilizer dose of apple plants ?","23.	Fertilizer dose of apple plants are 100kg FYM + 2800gm CAN (January march month)+ 2200gm SP + 1200gm MOP (December month)/plant.","HIMACHAL PRADESH","KULLU","BANJAR                                            ","2014-12-30 14:17:59.997"
"RABI","HORTICULTURE","Vegetables","Pea (Vegetable)","Seeds and Planting Material","IMPROVED VARITIES IN PEA ?","ARKAL , PANJAB -89 , BONBILE , SOLAN NIROG .","HIMACHAL PRADESH","KULLU","ANNI","2014-12-30 14:57:47.787"
"RABI","AGRICULTURE","Others","Others","Weather","Information regarding Weather Today In Kangra Distt. ?","Weather Today In Kangra Distt.are : Mostaly Cloudy No Chance of Rain.","HIMACHAL PRADESH","KULLU","BANJAR                                            ","2014-12-31 08:52:39.517"
"RABI","HORTICULTURE","Fruits","Apple","	Plant Protection	","How much Dose of CAN , SSP and MOP in 10 Year's And Above Apple Plant ?","Dose of CAN are : 2800 Gm , SSP are : 2200 Gm  And MOP are : 1200 Gm in 10 Year's And Above Apple Plants . First Half Does of CAN are Apply Feb-Mach and Secound Are Apply After One Months Lettar ,SSP And Mop are Apply Dec.-Jan .","HIMACHAL PRADESH","KULLU","KULLU                                             ","2014-12-31 09:53:51.030"
"RABI","AGRICULTURE","Others","Others","Weather","Weather today of Kullu ?","Weather today of Kullu is cloudy and no chance of rainfall.","HIMACHAL PRADESH","KULLU","ANNI","2014-12-31 11:42:55.427"
"RABI","HORTICULTURE","Fruits","Apple","Fertilizer Use and Availability","Fertilizer dose of apple plants ?","Fertilizer dose of apple plants are 100kg FYM + 2800gm CAN (February- march month)+ 2200gm SP + 1200gm MOP (December month)/plant.","HIMACHAL PRADESH","KULLU","ANNI","2014-12-31 11:48:32.870"
"RABI","AGRICULTURE","Others","Others","Weather","Information regarding Weather Today Anni Tehsil ?","Weather Today Anni Tehsil are :Mostaly Cloudy No Chance of Rain.","HIMACHAL PRADESH","KULLU","ANNI","2014-12-31 11:58:04.753"
"RABI","HORTICULTURE","Fruits","Apple","	Plant Protection	","How to control Root Rot of Apple Plant ?","Drainching With INDOFIL M-45 @ 25 Gm + 10 Gm Babasation / 10 Liters of Water.","HIMACHAL PRADESH","KULLU","NIRMAND","2014-12-31 13:19:34.103"
"JAYAD","AGRICULTURE","Others","Others","	Plant Protection	","contact number of palampur university","please contact 01894 230395","HIMACHAL PRADESH","KULLU","NIRMAND","2014-12-31 14:30:51.540"
"RABI","AGRICULTURE","Others","Others","Weather","""Weather report of kullu is clear and no chance of rainfall.  
""","Weather report of kullu is clear and no chance of rainfall.","HIMACHAL PRADESH","KULLU","KULLU                                             ","2014-12-31 15:56:35.787"
"RABI","AGRICULTURE","Others","Others","Weather","WEATHER OF KULLU ?","TONIGHT NO CHANCE OF RAIN .","HIMACHAL PRADESH","KULLU","ANNI","2014-12-31 18:45:18.747"
"RABI","HORTICULTURE","Fruits","Apple","	Plant Protection	","information regarding Plantation time of apple are end December to march month.","Plantation time of apple are end December to march month.","HIMACHAL PRADESH","KULLU","NIRMAND","2014-12-31 19:50:55.273"
