"Season","Sector","Category","Crop","QueryType","QueryText","KCCAns","StateName","DistrictName","BlockName","CreatedOn"
"RABI","AGRICULTURE","Others","Others","Government Schemes","ASK FORGOVT. SCHEME INFORMATION","I SUGGESTED TO CONTACT DAO","GUJARAT","AMRELI","JAFRABAD                                          ","2014-12-27 10:35:35.217"
"KHARIF","HORTICULTURE","Condiments and Spices","Coriander","	Plant Protection	","ask about root wilt","suggetsed mencozeb 35 gm per pump","GUJARAT","AMRELI","JAFRABAD                                          ","2014-12-27 10:35:36.273"
"RABI","AGRICULTURE","Cereals","Wheat","Cultural Practices","ASK FOR WHEAT WEED CONTROL","I SUGGESTED TO GIVE 2 4 D 18 GM/PUMP AT 30-35 DAYS","GUJARAT","AMRELI","BABRA                                             ","2014-12-27 11:38:46.720"
"RABI","AGRICULTURE","Others","Others","Government Schemes","ask for govt sabsidi","contact jilla bagayat adhikari","GUJARAT","AMRELI","JAFRABAD                                          ","2014-12-27 12:20:47.277"
"RABI","AGRICULTURE","Oilseeds","Sesame (Gingelly/Til)/Sesamum","	Field Preparation	","ask abt var. of Sesamum?","suggest:purva-1 varity for half winter  Gujarat til 1, 2, 4 and 10","GUJARAT","AMRELI","LILIA                                             ","2014-12-27 19:51:04.147"
"RABI","HORTICULTURE","Vegetables","Onion","	Plant Protection	","ask about weed management in onion","I suggested apply pendimitheline before germination","GUJARAT","AMRELI","KUNKAVAV -VADIA                                   ","2014-12-28 10:50:04.857"
"RABI","AGRICULTURE","Cereals","Wheat","Agriculture Mechanization","ask for  weed control information","suggest:2-4-d 40ml/pump sprey","GUJARAT","AMRELI","SAVERKUNDLA                                       ","2014-12-28 12:52:40.947"
"RABI","AGRICULTURE","Oilseeds","Castor (Rehri, Rendi, Arandi) ","	Plant Protection	","ask about flowering for castor","i suggested to spray bum flower 30 ml/ pump for control flowering for castor","GUJARAT","AMRELI","DHARI                                             ","2014-12-28 15:33:05.153"
"JAYAD","AGRICULTURE","Oilseeds","Sesame (Gingelly/Til)/Sesamum","Sowing Time and Weather","ASK ABOUT SOWING TIME OF SESAME","I SUGEGSTED TO FEBRUARY TO MARCH SOWING TIME OF SESAME","GUJARAT","AMRELI","SAVERKUNDLA                                       ","2014-12-28 16:31:42.640"
"RABI","AGRICULTURE","Cereals","Wheat","Cultural Practices","ask for sowing time information","suggest:octo-nov for it","GUJARAT","AMRELI","BABRA                                             ","2014-12-28 16:33:40.697"
"JAYAD","HORTICULTURE","Vegetables","Brinjal","Seeds and Planting Material","ASK ABOUT SOWING TIME OF BRINJAL","I SUGGESTED TO FEBRUARY TO MARCH SOWING TIME OF BRINJAL","GUJARAT","AMRELI","KUNKAVAV -VADIA                                   ","2014-12-28 17:04:43.277"
"RABI","AGRICULTURE","Others","Others","Government Schemes","ask for market price information","suggest:call:18001028767 for market price","GUJARAT","AMRELI","LILIA                                             ","2014-12-28 17:35:37.827"
"RABI","AGRICULTURE","Others","Others","	Field Preparation	","ask abt fertilizer in drip irrigation ?","sggested micro mix and 19-19-19.","GUJARAT","AMRELI","RAJULA                                            ","2014-12-28 18:06:15.467"
"RABI","AGRICULTURE","Others","Others","Government Schemes","ask about governmaent schemes","i suggested to contact district agriculture officer","GUJARAT","AMRELI","BAGASARA                                          ","2014-12-28 18:43:13.137"
"RABI","AGRICULTURE","Fiber Crops","Cotton (Kapas)","	Plant Protection	","Ask for cotton aphide problem.","I suggested to spray rogar 20 ml./pump.","GUJARAT","AMRELI","AMRELI","2014-12-28 20:31:06.343"
"RABI","HORTICULTURE","Vegetables","Bhindi(Okra/Ladysfinger)","Agriculture Mechanization","ask for okra sowing time information","suggest: sowing time is feb-march","GUJARAT","AMRELI","SAVERKUNDLA                                       ","2014-12-29 15:13:09.603"
"RABI","HORTICULTURE","Vegetables","Onion","Seeds and Planting Material","ask for sowing information","suggest:oct-nov for sowing","GUJARAT","AMRELI","DHARI                                             ","2014-12-29 16:50:54.103"
"RABI","AGRICULTURE","Millets","Sorghum (Jowar/Great Millet)","Agriculture Mechanization","ask for sorghum  thrips information","""suggest: spray  dimethoate 20ml/pump 
""","GUJARAT","AMRELI","KHAMBHA                                           ","2014-12-29 16:56:11.240"
"RABI","HORTICULTURE","Condiments and Spices","Cumin","Agriculture Mechanization","ask for cumin  thrips information","suggest: spray prophenphose 20ml/pump","GUJARAT","AMRELI","KHAMBHA                                           ","2014-12-29 17:46:59.643"
"RABI","HORTICULTURE","Condiments and Spices","Coriander","	Plant Protection	","ask for white fly control information","suggest:prophenophose 25 ml/pump sprey","GUJARAT","AMRELI","RAJULA                                            ","2014-12-29 19:12:56.037"
"RABI","AGRICULTURE","Others","Others","Market Information","ask for market price information","suggest:call:18001028767 for market price","GUJARAT","AMRELI","SAVERKUNDLA                                       ","2014-12-30 11:22:11.403"
"RABI","AGRICULTURE","Fiber Crops","Cotton (Kapas)","	Plant Protection	","ask for fungus problem","suggest:mancozeb 30 gm per pamp and to sprey","GUJARAT","AMRELI","BAGASARA                                          ","2014-12-30 14:19:59.480"
"RABI","HORTICULTURE","Condiments and Spices","Coriander","	Plant Protection	","Ask for coriander thrips problem.","I suggested to spray fipronil 12 ml./pump.","GUJARAT","AMRELI","KUNKAVAV -VADIA                                   ","2014-12-30 14:55:07.330"
"RABI","AGRICULTURE","Fodder Crops","Lucerne (Alfalfa)","	Plant Protection	","ask about control of larva","i suggested cyper methrin 15 ml / pamp","GUJARAT","AMRELI","RAJULA                                            ","2014-12-30 15:36:51.853"
"RABI","HORTICULTURE","Vegetables","Brinjal","	Plant Protection	","ask for varity information","suggest:guj hybrid-1dolly-5,surti raveya","GUJARAT","AMRELI","BAGASARA                                          ","2014-12-30 15:56:00.153"
"RABI","AGRICULTURE","Millets","Sorghum (Jowar/Great Millet)","	Plant Protection	","ask for market price","give number : 1800 102 8767 for market rate","GUJARAT","AMRELI","LATHI                                             ","2014-12-30 17:13:12.057"
"RABI","AGRICULTURE","Fiber Crops","Cotton (Kapas)","	Plant Protection	","ask for  larva problem /iyal","suggest:cypermethrin 10 ml. per pump and to spray.","GUJARAT","AMRELI","SAVERKUNDLA                                       ","2014-12-30 17:20:02.217"
"RABI","AGRICULTURE","Fiber Crops","Cotton (Kapas)","Agriculture Mechanization","ask for market rate information","suggest: 18001028767 please contact on this number","GUJARAT","AMRELI","SAVERKUNDLA                                       ","2014-12-31 09:47:09.403"
"RABI","AGRICULTURE","Others","Others","Government Schemes","ask for subcidy","contact jilla khetiwadi adhikari","GUJARAT","AMRELI","DHARI                                             ","2014-12-31 11:30:46.220"
"RABI","HORTICULTURE","Vegetables","Onion","	Plant Protection	","Ask for market rate","call 1800 102 8767 for market rate","GUJARAT","AMRELI","SAVERKUNDLA                                       ","2014-12-31 15:59:27.047"
"RABI","AGRICULTURE","Fiber Crops","Cotton (Kapas)","Government Schemes","Ask for Gujarat energy development agency,gandhinagar.","Gujarat energy development agency,gandhinagar.:079 23257251,52,53,54.","GUJARAT","AMRELI","JAFRABAD                                          ","2014-12-31 19:43:40.630"
"RABI","AGRICULTURE","Fiber Crops","Cotton (Kapas)","Government Schemes","Ask for drip irrigation information.","I suggested to visit gram panchayat.","GUJARAT","AMRELI","BAGASARA                                          ","2014-12-31 19:48:12.967"
"RABI","AGRICULTURE","Others","Others","	Plant Protection	","Ask for market rate","call 1800 102 8767 for market rate","GUJARAT","AMRELI","KHAMBHA                                           ","2014-12-31 20:48:11.057"
