"Season","Sector","Category","Crop","QueryType","QueryText","KCCAns","StateName","DistrictName","BlockName","CreatedOn"
"RABI","HORTICULTURE","Plantation Crops","Coconut","	Plant Protection	","CONTROL MEASURES OF SPINDLE ROT","ADVICE TO SPRAY BAVISTIN @ 2 GM/L WATER","ASSAM","DIBRUGARH","PANITOLA                                          ","2014-11-30 07:54:53.470"
"RABI","HORTICULTURE","Vegetables","Chillies","	Plant Protection	","ASKING ABOUT FRUIT ROT","ADVICE TO SPRAY AMISTER @ 1 ML/L WATER","ASSAM","DIBRUGARH","TENGAKHAT                                         ","2014-11-30 09:12:14.037"
"RABI","AGRICULTURE","Cereals","Paddy (Dhan)","Fertilizer Use and Availability","ASKING ABOUT THE RECOMMENDED FERTILIZER DOSE FOR CHILLI","SUGGESTED THAT RECOMMENDED FERTILIZER DOSE IS LIKE-UREA@30 KILOGRAM/BIGHA,SSP@50 KILOGRAM/BIGHA,MOP@13 KILOGRAM/BIGHA,FYM@2 QUINTAL/BIGHA.HALF DOSE OF UREA AND FULL DOSES OF SSP AND MOP, FYM SHOULD BE APPLIED AT THE TIME OF LAND PREPARATION AND REMAINING UREA SHOULD BE TOP DRESSED 20-25 DAYS AFTER PLANTING","ASSAM","DIBRUGARH","LAHOAL                                            ","2014-11-30 10:08:03.050"
"RABI","HORTICULTURE","Vegetables","Pumpkin","Nutrient Management","ASKING FOR THE VITAMEN REQUIREMENT OF PUMPKI","RECOMMENDED TO SPRAY TRACEL 2 @ 2 GM PER LITRE OF WATER","ASSAM","DIBRUGARH","KHOWANG                                           ","2014-11-30 10:18:19.787"
"RABI","HORTICULTURE","Vegetables","Potato","	Plant Protection	","ASKING ABOUT THE CONTROL MEASURE TO CONTROL LEAF CURL DISEASE IN POTATO","SUGGESTED TO SPRAY ROGOR 35EC@2MILILLITER/LITER OF WATER FOLLOWED BY WAITING PERIOD FOR 5-7DAYS","ASSAM","DIBRUGARH","LAHOAL                                            ","2014-11-30 11:12:51.323"
"RABI","AGRICULTURE","Beekeeping","Beekeeping","Cultural Practices","ASKING ABOUT TRAINIG OF BEEKEEPING.","ADVISED HIM TO CONTACT WITH SIRD.","ASSAM","DIBRUGARH","KHOWANG                                           ","2014-11-30 11:36:07.690"
"RABI","HORTICULTURE","Vegetables","Bitter Gourd","	Plant Protection	","ASKING ABOUT FRUIT BORER","ADVICE TO APPLY FLUTON @ 1 ML / LITRE","ASSAM","DIBRUGARH","LAHOAL                                            ","2014-11-30 11:52:31.833"
"RABI","HORTICULTURE","Vegetables","Potato","	Plant Protection	","ASKING ABOUT THE ROOT ROT IN POTATO","ADVICE HIM TO SPRAY ENDOPHIL M 45 @ 2GM/ 1LITRES OF WATER","ASSAM","DIBRUGARH","BORBORUAH                                         ","2014-11-30 14:01:20.540"
"RABI","HORTICULTURE","Vegetables","Potato","	Plant Protection	","Asking about the late blight of Potato","Advised to spray  Indofil M-45 @ 2gram/litres of water","ASSAM","DIBRUGARH","BORBORUAH                                         ","2014-11-30 14:05:18.890"
"RABI","HORTICULTURE","Vegetables","Tomato","	Plant Protection	","ASKING ABOUT BACTERIAL DISEASE","ADVICE TO APPLY PLANTOMYCINE @ 1 GM / 10 LITRE WATER","ASSAM","DIBRUGARH","BORBORUAH                                         ","2014-11-30 15:39:13.700"
