"Season","Sector","Category","Crop","QueryType","QueryText","KCCAns","StateName","DistrictName","BlockName","CreatedOn"
"KHARIF","AGRICULTURE","Others","Others","Weather","WEATHER REPORT.","NO RAIN FALL.","WEST BENGAL","MIDNAPUR (WEST)","NARAYANGARH                                       ","2014-11-13 18:36:23.010"
"RABI","AGRICULTURE","Cereals","Paddy (Dhan)","Seeds","ASKING ABOUT VARIETIES OF PADDY FOR BORO SEASON.","RECOMMENDED VARIETIES OF PADDY FOR BORO SEASON ARE I.R.- 36, IR - 64, SATABDI (MINIKIT), MTU- 1010, WGL-20471, NAYANMONI, PARIJAT, PNR- 381 ETC.","WEST BENGAL","MIDNAPUR (WEST)","KHARAGPUR-II                                      ","2014-11-13 18:40:39.173"
"KHARIF","AGRICULTURE","Cereals","Paddy (Dhan)","	Plant Protection	","CONTROL OF BPH IN PADDY.","RECOMMENDED FOR SPRAY  BUPROFEZIN 5.65% + DELTAMETHRIN 0.72% (6.37 % EC) @ 2 ML / LIT OF WATER.","WEST BENGAL","MIDNAPUR (WEST)","NARAYANGARH                                       ","2014-11-13 18:41:17.780"
"RABI","HORTICULTURE","Vegetables","Brinjal","Fertilizer Use and Availability","APPLICATION OF FERTILISER IN BRINJAL","CONTACT WITH BLOCK  [ ASSISTANT DIRECTOR OF AGRICULTURE(A.D.A)]","WEST BENGAL","MIDNAPUR (WEST)","SABANG                                            ","2014-11-13 19:00:59.170"
"RABI","HORTICULTURE","Fruits","Mango","	Plant Protection	","CONTROL OF LEAF EATTING CATERPILLAR IN MANGO.","RECOMMENDED FOR SPRAY ACEPHATE 75% SP @ 0.75 GM/ LIT. OF WATER.","WEST BENGAL","MIDNAPUR (WEST)","GARBETA-I                                         ","2014-11-13 19:01:41.933"
"RABI","HORTICULTURE","Vegetables","Chillies","	Plant Protection	","CONTROL OF WHITE FLY IN TOMATO.","RECOMMENDED FOR SPRAY ACETAMIPRID 20% SP @ 1 GM / 5 LIT. OF WATER.","WEST BENGAL","MIDNAPUR (WEST)","PINGLA                                            ","2014-11-13 19:24:22.630"
"KHARIF","AGRICULTURE","Cereals","Paddy (Dhan)","	Plant Protection	","ASKING ABOUT SEED DORMANCY IN PADDY.","RECOMMENDED FOR EXPLAIN SEED DORMANCY BRIFLY.","WEST BENGAL","MIDNAPUR (WEST)","KESHPUR                                           ","2014-11-13 19:56:03.800"
"RABI","AGRICULTURE","Cereals","Paddy (Dhan)","	Plant Protection	","ATTACK OF BROWN PLANT HOPPER IN PADDY FIELD","RECOMMENDED FOR SPRAY OF   BUPROFEZIN 25 % SC @ 1 ML/LIT OF WATER","WEST BENGAL","MIDNAPUR (WEST)","MOHANPUR                                          ","2014-11-13 19:56:36.060"
"RABI","AGRICULTURE","Others","Others","Government Schemes","ASKING ABOUT KISAN CREDIT CARD ( CONTACT PERSON).","ADVICE TO CONTACT WITH BLOCK A.D.A.","WEST BENGAL","MIDNAPUR (WEST)","SALBANI                                           ","2014-11-13 20:03:56.113"
"RABI","HORTICULTURE","Vegetables","Onion","	Plant Protection	","ATTACK OF LEAF BLIGHT IN ONION","RECOMMENDED FOR SPRAY OF  COPPER OXYCHLORIDE 50 % WP @ 4 GM /LIT OF WATER","WEST BENGAL","MIDNAPUR (WEST)","SABANG                                            ","2014-11-13 20:15:44.790"
"RABI","HORTICULTURE","Vegetables","Potato","	Plant Protection	","APPLICATION OF FERTILISER IN POTATO FIELD","CONTACT WITH BLOCK  [ ASSISTANT DIRECTOR OF AGRICULTURE(A.D.A)]","WEST BENGAL","MIDNAPUR (WEST)","SALBANI                                           ","2014-11-14 06:40:04.340"
"RABI","AGRICULTURE","Oilseeds","Mustard","	Plant Protection	","WEED CONTROL IN MUSTARD FIELD (AFTER 30 DAYS OF SOWING).","RECOMMENDED FOR GIVE HAND WEEDING FOR CONTROL WEED.","WEST BENGAL","MIDNAPUR (WEST)","MIDNAPORE                                         ","2014-11-14 07:46:07.410"
"RABI","HORTICULTURE","Vegetables","Brinjal","	Plant Protection	","FLOWER DROPPING IN BRINJAL","RECOMENDED FOR SPRAY PLANOFIX @ 1ML/ 4 LIT OF WATER","WEST BENGAL","MIDNAPUR (WEST)","KHARAGPUR-I                                       ","2014-11-14 08:57:39.060"
"RABI","HORTICULTURE","Fruits","Mango","	Plant Protection	","ATTACK OF LEAF EATING CATERPILLARS IN MANGO FRUIT","RECOMMENDED FOR SPRAY OF  CARBOSULFAN 25 % EC @ 2 ML/LIT OF WATER","WEST BENGAL","MIDNAPUR (WEST)","KESHIARY                                          ","2014-11-14 09:08:43.363"
"KHARIF","FISHERIES","Inland","Fresh Water","Water Testing for Fish Production","WANT TO KNOW ABOUT WATER TESTING FOR FISH PRODUCTION","RECOMMENDED FOR CONTACT WITH LOCAL BLOCK A.D.A","WEST BENGAL","MIDNAPUR (WEST)","CHANDRAKONA-I                                     ","2014-11-14 11:53:15.803"
"RABI","HORTICULTURE","Vegetables","Brinjal","	Plant Protection	","CONTROL OF STEM ROT IN BRINJAL.","RECOMMENDED FOR SPRAY COPPER OXYCHLORIDE 50% WP @  4 GM / LIT OF WATER.","WEST BENGAL","MIDNAPUR (WEST)","DASPUR-I                                          ","2014-11-14 14:13:36.200"
"RABI","AGRICULTURE","Pulses","Lentil (Masur)","Cultural Practices","ASKING ABOUT SEED RATE IN LENTIL","RECOMMENDED FOR SEED RATE IN LENTIL 4-5 KG /BIGHA","WEST BENGAL","MIDNAPUR (WEST)","DEBRA                                             ","2014-11-14 14:22:03.927"
"KHARIF","AGRICULTURE","Cereals","Paddy (Dhan)","	Plant Protection	","seed treatment in paddy","RECOMMENDED FOR SPRAY  MANCOZEB 75% WP @ 3 GM /kg OF SEEDS","WEST BENGAL","MIDNAPUR (WEST)","KHARAGPUR-II                                      ","2014-11-14 14:23:21.560"
"RABI","HORTICULTURE","Vegetables","Potato","Seeds and Planting Material","CONTROL OF BLIGHT IN POTATO.","RECOMENDED FOR SPRAY COPPER OXYCHLORIDE 50%WP @ 4 GM / LITER OF WATER.","WEST BENGAL","MIDNAPUR (WEST)","CHANDRAKONA-I                                     ","2014-11-14 14:30:35.817"
"RABI","HORTICULTURE","Plantation Crops","Coconut","	Plant Protection	","CONTROL OF FRUIT DROPPING IN COCONUT","RECOMMENDED FOR  SPRAY ALPHA NAPTHALENE ACETIC ACID @ 1 ML/4.5 LT. OF WATER","WEST BENGAL","MIDNAPUR (WEST)","CHANDRAKONA-I                                     ","2014-11-14 14:48:36.097"
"KHARIF","HORTICULTURE","Vegetables","Cucumber","	Plant Protection	","CONTROL OF LEAF CURL IN CUCUMBER.","RECOMMENDED FOR SPRAY MIX MICRONUTRIANT(GRED-2)@3 ML/LIT OF WATER AND SPRAY AZADIRECTIN @ 3 ML/LIT OF WATER.","WEST BENGAL","MIDNAPUR (WEST)","GHATAL                                            ","2014-11-14 16:03:17.723"
"RABI","AGRICULTURE","Others","Others","Weather","ASKING ABOUT WEATHER INFORMATION IN MIDNAPUR(WEST)","NO RAINFALL IN NEXT 5 DAYS.(15.11.14-19.11.14)","WEST BENGAL","MIDNAPUR (WEST)","NARAYANGARH                                       ","2014-11-14 16:35:02.823"
"KHARIF","HORTICULTURE","Vegetables","Cucumber","	Plant Protection	","control of Caterpillar in cucumber","recommended for spray chlorpiriphos 2.5ml/lit of water","WEST BENGAL","MIDNAPUR (WEST)","GOPIBALLAVPUR-I                                   ","2014-11-14 17:42:09.393"
"KHARIF","HORTICULTURE","Vegetables","Brinjal","	Plant Protection	","CONTROL OF BACTERIAL WILT IN BRINJAL","RECOMMENDED FOR SPRAY STREPTOCYCLINE 9:1 SP ( 90:10 SP) @ 1 GM / 10 LIT OF WATER.","WEST BENGAL","MIDNAPUR (WEST)","SALBANI                                           ","2014-11-14 17:50:40.277"
"RABI","AGRICULTURE","Cereals","Paddy (Dhan)","	Plant Protection	","CONTROL OF STEM BORER IN PADDY","RECOMMENDED FOR SPRAY AZADIRACTIN 1% (10000 PPM) @ 3 ML / LIT OF WATER.","WEST BENGAL","MIDNAPUR (WEST)","MIDNAPORE                                         ","2014-11-14 18:07:17.030"
"KHARIF","HORTICULTURE","Vegetables","Cucumber","	Plant Protection	","CONTROL OF WHITE FLY IN CUCUMBER","RECOMMENDED FOR SPRAY IMIDACLOPRID 17.8% SL  @  1 ML / 5 LIT OF WATER.","WEST BENGAL","MIDNAPUR (WEST)","PINGLA                                            ","2014-11-14 19:20:34.743"
"RABI","HORTICULTURE","Flowers","Marigold","	Plant Protection	","CONTROL OF BLACK SPOT IN MARIGOLD.","RECOMMENDED FOR SPRAY  CARBENDAZIM 50% WP @ 1 GM  / LIT. OF WATER.","WEST BENGAL","MIDNAPUR (WEST)","KHARAGPUR-II                                      ","2014-11-14 20:04:01.650"
"KHARIF","HORTICULTURE","Vegetables","Potato","	Plant Protection	","SEED TREATMENT OF POTATO","RECOMMENDED FOR TREAT THE SEEDS WITH MANCOZEB 75% WP @2.5GM /LIT. OF WATER","WEST BENGAL","MIDNAPUR (WEST)","CHANDRAKONA-II                                    ","2014-11-14 20:07:18.763"
"KHARIF","HORTICULTURE","Vegetables","Chillies","	Plant Protection	","CONTROL OF LEAF CURL IN CHILLI","RECOMMENDED FOR SPRAY  DIMETHOATE 30% EC @ 2 ML  / LIT OF WATER.","WEST BENGAL","MIDNAPUR (WEST)","NARAYANGARH                                       ","2014-11-14 20:17:54.807"
"RABI","HORTICULTURE","Vegetables","Potato","Seeds and Planting Material","ASKING ABOUT SEED TREATMENT OF POTATO.","SEED TREATMENT WITH MANCOZEB 75 %WP @ 3 GM / LITER OF WATER.","WEST BENGAL","MIDNAPUR (WEST)","GARBETA-I                                         ","2014-11-14 20:24:20.633"
"RABI","HORTICULTURE","Vegetables","Bitter Gourd","	Plant Protection	","CONTROL OF LEAF CURL IN BITTER GOURD.","RECOMENDED FOR SPRAY AZADIRECTIN 1 % EC @ 3 ML / LITER OF WATER.","WEST BENGAL","MIDNAPUR (WEST)","GARBETA-I                                         ","2014-11-14 21:01:36.990"
"RABI","HORTICULTURE","Vegetables","Cauliflower","	Plant Protection	","CONTROL OF BLACK VEIN DIEASE IN CAULIFLOWER.","RECOMMENDED FOR SPRAY COPPER OXYCHLORIDE 50% WP @  3 GM / LIT OF WATER+STREPTOCYCLINE 9:1 SP ( 90:10 SP) @ 1 GM / 10 LIT OF WATER.","WEST BENGAL","MIDNAPUR (WEST)","GARBETA-I                                         ","2014-11-15 07:06:25.550"
"RABI","AGRICULTURE","Others","Others","Weather","ASKING WATHER REPORT","NO RAINFAL","WEST BENGAL","MIDNAPUR (WEST)","DASPUR-I                                          ","2014-11-15 07:43:28.453"
"RABI","AGRICULTURE","Others","Others","Weather","ASKING WATHER REPORT","NO RAINFAL","WEST BENGAL","MIDNAPUR (WEST)","DEBRA                                             ","2014-11-15 08:43:32.397"
"RABI","HORTICULTURE","Vegetables","Potato","Cultural Practices","ASKING ABOUT SEED TREATMENT IN POTATO.","RECOMMENDED FOR APPLY MANCOZEB 75% WP @ 2.5 GM / LIT OF WATER.","WEST BENGAL","MIDNAPUR (WEST)","CHANDRAKONA-II                                    ","2014-11-15 08:47:16.230"
"KHARIF","HORTICULTURE","Vegetables","Tomato","	Plant Protection	","CONTROL OF BACTERIAL WILT IN TOMATO.","RECOMMENDED FOR SPRAY STREPTOCYCLINE 9:1 SP ( 90:10 SP) @ 1 GM / 10 LIT OF WATER.","WEST BENGAL","MIDNAPUR (WEST)","NARAYANGARH                                       ","2014-11-15 09:29:05.153"
"RABI","HORTICULTURE","Vegetables","Potato","	Plant Protection	","LEAF CURL IN POTATO","RECOMENDED FOR SPRAY DIMETHOIAT 30%EC @ 2 ML/ LIT OF WATER","WEST BENGAL","MIDNAPUR (WEST)","SALBANI                                           ","2014-11-15 09:33:59.057"
"RABI","HORTICULTURE","Vegetables","Tomato","	Plant Protection	","CONTROL OF BACTARIEAL WILT IN TOMATO","RECOMMENDED FOR SPRAY STEPTOMYCIN @ 1GM/10LIT OF WATER","WEST BENGAL","MIDNAPUR (WEST)","NARAYANGARH                                       ","2014-11-15 09:51:38.473"
"RABI","AGRICULTURE","Cereals","Paddy (Dhan)","Cultural Practices","cultivation of paddy","CONTACT WITH BLOCK  [ ASSISTANT DIRECTOR OF AGRICULTURE(A.D.A)]","WEST BENGAL","MIDNAPUR (WEST)","GHATAL                                            ","2014-11-15 10:24:49.987"
"RABI","HORTICULTURE","Vegetables","Potato","	Plant Protection	","SEED TREATMENT OF  POTATO","SEED TREATMENT WITH METHOXY ETHYL MERCURIC CHLORIDE @ 2 GM /LIT OF WATER","WEST BENGAL","MIDNAPUR (WEST)","GHATAL                                            ","2014-11-15 10:57:04.183"
"RABI","AGRICULTURE","Cereals","Paddy (Dhan)","	Plant Protection	","ASKING ABOUT MICRO-NUTRIENT DEFICIENCY IN PADDY.","RECOMMENDED FOR SPRAY GRADE 2  @  2-3 ML / LIT OF WATER.","WEST BENGAL","MIDNAPUR (WEST)","MIDNAPORE                                         ","2014-11-15 11:20:09.987"
"RABI","HORTICULTURE","Vegetables","Cucumber","	Plant Protection	","ATTACK OF LEAF CURL IN CUCUMBER","RECOMMENDED FOR SPRAY OF  DIMETHOATE 30 % EC @ 2 ML/LIT OF WATER","WEST BENGAL","MIDNAPUR (WEST)","GOPIBALLAVPUR-I                                   ","2014-11-15 12:08:06.737"
"KHARIF","HORTICULTURE","Vegetables","Potato","	Plant Protection	","STEM ROT OF PORARO.","RECOMMENDED FOR SPRAY COPPER OXYCHLORIDE 50% WP @ 4GM./LIT. OF WATER.","WEST BENGAL","MIDNAPUR (WEST)","GARBETA-II                                        ","2014-11-15 14:34:07.010"
"RABI","AGRICULTURE","Others","Others","Weather","ASKING WATHER REPORT IN MADNIPUR","NO RAINFAL","WEST BENGAL","MIDNAPUR (WEST)","KHARAGPUR-II                                      ","2014-11-15 14:34:27.310"
"RABI","AGRICULTURE","Cereals","Paddy (Dhan)","Seeds","ASKING ABOUT SEED TREATMENT OF PADDY.","SEED TREATMENT WITH CARBENDAZIM 50 % WP 2 GM / KG OF SEED.","WEST BENGAL","MIDNAPUR (WEST)","NARAYANGARH                                       ","2014-11-15 14:42:36.417"
"KHARIF","HORTICULTURE","Vegetables","Potato","	Plant Protection	","ASKING ABOUT SEED TREATMENT IN POTATO.","SEED TREATMENT WITH MANCOZEB @ 3 GM/ LIT WATER IN SEED POTATO 8-10 MINUTEE.","WEST BENGAL","MIDNAPUR (WEST)","KHARAGPUR-I                                       ","2014-11-15 15:21:37.720"
"RABI","HORTICULTURE","Vegetables","Brinjal","	Plant Protection	","CONTROL OF FRUIT BORER IN BRINJAL","RECOMMENDED FOR SPRAY FLUBENDIAMIDE 39.35% S.C. @ 1 ML/5 LIT. OF WATER","WEST BENGAL","MIDNAPUR (WEST)","DEBRA                                             ","2014-11-15 15:58:02.907"
"RABI","HORTICULTURE","Vegetables","Brinjal","	Plant Protection	","CONTROL OF BLIGHT IN BRINJAL.","RECOMENDED FOR SPRAY COPPER OXYCHLORIDE 50%WP @ 4 GM/ LITER OF WATER.","WEST BENGAL","MIDNAPUR (WEST)","KESHIARY                                          ","2014-11-15 16:02:42.283"
"RABI","HORTICULTURE","Vegetables","Bitter Gourd","	Plant Protection	","CONTROL OF APHID IN BITTER GOURD","RECOMMENDED FOR SPRAY  ACETAMIPRID 20%SP @ 1 GM / 5 LIT. OF WATER","WEST BENGAL","MIDNAPUR (WEST)","GARBETA-II                                        ","2014-11-15 16:03:31.307"
"KHARIF","AGRICULTURE","Others","Others","Weather","WEATHER REPORT.","NO RAIN FALL.","WEST BENGAL","MIDNAPUR (WEST)","DANTAN-II                                         ","2014-11-15 16:26:39.843"
"RABI","AGRICULTURE","Others","Others","Weather","WANT TO KNOW ABOUT WEATHER REPORT IN THE DISTRICT OF WEST MIDNAPUR","NO RAIN FALL IN THE DISTRICT OF WEST MIDNAPUR","WEST BENGAL","MIDNAPUR (WEST)","KESHPUR                                           ","2014-11-15 17:37:15.570"
"KHARIF","AGRICULTURE","Others","Others","Weather","WEATHER REPORT.","NO RAIN FALL.","WEST BENGAL","MIDNAPUR (WEST)","KHARAGPUR-II                                      ","2014-11-15 17:52:14.493"
"KHARIF","AGRICULTURE","Others","Others","Weather","WEATHER REPORT.","NO RAIN FALL.","WEST BENGAL","MIDNAPUR (WEST)","KHARAGPUR-II                                      ","2014-11-15 17:54:53.137"
"RABI","AGRICULTURE","Cereals","Paddy (Dhan)","Seeds","ASKING ABOUT SEED TREATMENT OF PADDY.","SEED TREATMENT  WITH CARBENDAZIM 50 % WP @  2 GM / KG OF SEED.","WEST BENGAL","MIDNAPUR (WEST)","PINGLA                                            ","2014-11-15 17:57:19.277"
"KHARIF","HORTICULTURE","Vegetables","Chillies","Fertilizer Use and Availability","FERTILIZER DOSE OF CHILLI.","ADVICE SOIL TEST AND CONTACT WITH ADA/KPS/BTM-ATMA, BLOCK.","WEST BENGAL","MIDNAPUR (WEST)","KESHPUR                                           ","2014-11-15 18:04:10.183"
"RABI","HORTICULTURE","Vegetables","Bitter Gourd","	Plant Protection	","CONTROL OF LEAF CURL IN BITTER GOURD.","RECOMENDED FOR SPRAY FENAZAQUIN 10%EC @ 1.5 ML/ LITER OF WATER.","WEST BENGAL","MIDNAPUR (WEST)","DASPUR-I                                          ","2014-11-15 18:10:20.530"
"RABI","AGRICULTURE","Others","Others","Soil Testing","WANT TO KNOW ABOUT SOIL TEST","ADVICE TO CONTACT WITH A.D.A. (BLOCK).","WEST BENGAL","MIDNAPUR (WEST)","KHARAGPUR-II                                      ","2014-11-15 18:57:08.577"
"KHARIF","AGRICULTURE","Others","Others","Weather","WEATHER REPORT.","NO RAIN FALL.","WEST BENGAL","MIDNAPUR (WEST)","KHARAGPUR-II                                      ","2014-11-15 18:59:23.837"
"RABI","HORTICULTURE","Flowers","Marigold","	Plant Protection	","CONTROL OF APHID IN MARIGOLD.","RECOMENDED FOR SPRAY DIMETHOATE 30%EC @ 2 ML / LITER OF WATER.","WEST BENGAL","MIDNAPUR (WEST)","KHARAGPUR-I                                       ","2014-11-15 19:58:21.173"
"KHARIF","AGRICULTURE","Others","Others","Government Schemes","ASKED ABOUT GOVT SCHEMES.","ADVICE SOIL TEST AND CONTACT WITH ADA/KPS/BTM-ATMA, BLOCK.","WEST BENGAL","MIDNAPUR (WEST)","SABANG                                            ","2014-11-15 19:59:28.807"
"KHARIF","HORTICULTURE","Vegetables","Potato","	Plant Protection	","CONTROL OF SEED TREATMENT IN POTATO.","RECOMMENDED FOR USE MANCOZEB @ 2.5 GM / KG OF SEED FOR SOCKING.","WEST BENGAL","MIDNAPUR (WEST)","KESHPUR                                           ","2014-11-15 20:13:59.590"
"RABI","AGRICULTURE","Cereals","Paddy (Dhan)","	Plant Protection	","CONTROL OF BROWN PLANT HOPPER IN PADDY.","RECOMMENDED FOR SPRAY  ACEPHATE 75% SP @ 1.5 GM / 2 LIT OF WATER.","WEST BENGAL","MIDNAPUR (WEST)","JAMBANI                                           ","2014-11-16 08:32:57.577"
"RABI","AGRICULTURE","Cereals","Paddy (Dhan)","Seeds","ASKING ABOUT SEED TREATMENT OF PADDY.","SEED TREATMENT WITH CARBENDAZIM 50 % WP @ 2 GM / LITER OF WATER.","WEST BENGAL","MIDNAPUR (WEST)","PINGLA                                            ","2014-11-16 08:44:38.250"
"RABI","AGRICULTURE","Cereals","Paddy (Dhan)","Cultural Practices","ASKING ABOUT SEED TREATMENT IN PADDY","RECOMMENDED FOR SEED TREATMENT IN PADDY USE CARBENDAZIM 50% WP @ 2 GM  / LIT OF WATER.","WEST BENGAL","MIDNAPUR (WEST)","KHARAGPUR-I                                       ","2014-11-16 09:01:17.360"
"RABI","HORTICULTURE","Flowers","Tuberose","Nutrient Management","SOIL TESTING IN TUBEROSE","RECOMMENDED FOR GOING TO BLOCK ADA AND DO THE SOIL TESTING","WEST BENGAL","MIDNAPUR (WEST)","KHARAGPUR-II                                      ","2014-11-16 10:35:56.167"
"RABI","HORTICULTURE","Vegetables","Chillies","	Plant Protection	","CONTRROL OF LEAF CURL IN CHILLIES.","RECOMENDED FOR SPRAY AZADIRECTIN 1 % EC @ 3 ML / LITER OF WATER.","WEST BENGAL","MIDNAPUR (WEST)","DANTAN-II                                         ","2014-11-16 10:51:31.120"
"KHARIF","HORTICULTURE","Vegetables","Pumpkin","	Plant Protection	","CONTROL OF FRUIT ROT IN PUMPKIN.","RECOMMENDED FOR SPRAY  COPPER OXYCHLORIDE 50% WP @  4 GM / LIT OF WATER.","WEST BENGAL","MIDNAPUR (WEST)","GHATAL                                            ","2014-11-16 10:54:17.040"
"RABI","HORTICULTURE","Vegetables","Potato","	Plant Protection	","CULTIVATION POTATO","CONTACT WITH BLOCK  [ ASSISTANT DIRECTOR OF AGRICULTURE(A.D.A)]","WEST BENGAL","MIDNAPUR (WEST)","GHATAL                                            ","2014-11-16 11:01:59.300"
"RABI","HORTICULTURE","Vegetables","Potato","Cultural Practices","CULTIVATION OF POTATO","CONTACT WITH BLOCK  [ ASSISTANT DIRECTOR OF AGRICULTURE(A.D.A)]","WEST BENGAL","MIDNAPUR (WEST)","GHATAL                                            ","2014-11-16 11:03:24.887"
"RABI","AGRICULTURE","Cereals","Paddy (Dhan)","	Plant Protection	","ASKING ABOUT KISAN CREDIT CARD.","ADVICE TO CONTACT WITH LOCAL ADA.","WEST BENGAL","MIDNAPUR (WEST)","KHARAGPUR-I                                       ","2014-11-16 13:23:58.877"
"RABI","HORTICULTURE","Flowers","Marigold","	Plant Protection	","CONTROL OF LEAF EATING CATERPILLAR IN MARIGOLD.","RECOMMENDED FOR SPRAY CHLORPYRIPHOS 20% EC @ 2.5 ML / LIT OF WATER.","WEST BENGAL","MIDNAPUR (WEST)","KHARAGPUR-II                                      ","2014-11-16 13:32:24.080"
"RABI","HORTICULTURE","Vegetables","Dolichos Bean","	Plant Protection	","DRYING OF FRUIT IN DOLICHUS","RECOMMENDED FOR SPRAYING MANCOZEB @ 2.5 GM/L OF WATER","WEST BENGAL","MIDNAPUR (WEST)","NARAYANGARH                                       ","2014-11-16 14:07:21.960"
"KHARIF","HORTICULTURE","Vegetables","Cucumber","	Plant Protection	","CONTROL OF LEAF MINOR IN CUCUMBER.","RECOMMENDED FOR SPRAY  ACEPHATE 75% SP @ 1.5 GM / 2 LIT OF WATER.","WEST BENGAL","MIDNAPUR (WEST)","KESHPUR                                           ","2014-11-16 14:10:49.663"
"RABI","AGRICULTURE","Cereals","Paddy (Dhan)","Weather","WEATHER REPORT","NO RAINFALL FOR NEXT FIVE DAYS","WEST BENGAL","MIDNAPUR (WEST)","KHARAGPUR-II                                      ","2014-11-16 14:16:26.757"
"KHARIF","HORTICULTURE","Vegetables","Cucumber","	Plant Protection	","CONTROL OF LEAF MINOR IN CUCUMBER.","RECOMMENDED FOR SPRAY ACEPHATE 75% S.P. @ 1.5 GM/2 LIT. OF WATER.","WEST BENGAL","MIDNAPUR (WEST)","KESHPUR                                           ","2014-11-16 14:18:05.097"
"RABI","HORTICULTURE","Vegetables","Potato","Seeds and Planting Material","WANT TO KNOW ABOUT SEED TREATMENT OF POTATO","RECOMMENDED FOR APPLY MANCOZEB @ 2.5 GM/ KG OF SEED.","WEST BENGAL","MIDNAPUR (WEST)","CHANDRAKONA-I                                     ","2014-11-16 14:49:18.560"
"KHARIF","HORTICULTURE","Vegetables","Brinjal","	Plant Protection	","CONTROL OF WHITE FLY IN BRINJAL.","RECOMMENDED FOR SPRAY FIPRONIL 5%S.C @ 1ML/ LIT. OF WATER.","WEST BENGAL","MIDNAPUR (WEST)","CHANDRAKONA-II                                    ","2014-11-16 15:06:54.920"
"RABI","HORTICULTURE","Vegetables","Bitter Gourd","	Plant Protection	","CONTROL OF  LEAF SPOT IN BITTER GOURD","RECOMMENDED FOR SPRAY MANCOZEB 75%WP @ 2.5 GM /LIT.OF WATER","WEST BENGAL","MIDNAPUR (WEST)","DASPUR-I                                          ","2014-11-16 17:11:03.440"
"RABI","HORTICULTURE","Vegetables","Potato","	Plant Protection	","CONTROL OF WHITE ANT IN POTATO.","RECOMMENDED FOR SPRAY CHLORPYRIPHOS 20% EC @ 2.5 ML  / LIT OF WATER.","WEST BENGAL","MIDNAPUR (WEST)","GHATAL                                            ","2014-11-16 18:46:55.453"
"KHARIF","HORTICULTURE","Vegetables","Beans ","	Plant Protection	","CONTROL OF LEAF SPOT IN BEANS","RECOMMENDED FOR SPRAY  COPPER OXYCHLORIDE 50% WP @  4 GM / LIT OF WATER.","WEST BENGAL","MIDNAPUR (WEST)","DEBRA                                             ","2014-11-16 19:48:14.063"
"RABI","HORTICULTURE","Vegetables","Bitter Gourd","	Plant Protection	","CONTROL OF LEAF CURL IN BITTER GOURD.","RECOMENDED FOR SPRAY FENAZAQUIN 10%EC @ 1.5 ML/ LITER OF WATER","WEST BENGAL","MIDNAPUR (WEST)","GHATAL                                            ","2014-11-16 20:01:40.470"
"KHARIF","HORTICULTURE","Vegetables","Cabbage","	Plant Protection	","CONTROL OF LEAF SPOT IN CABBAGE","RECOMMENDED FOR SPRAY  COPPER OXYCHLORIDE 50% WP @  4 GM / LIT OF WATER.","WEST BENGAL","MIDNAPUR (WEST)","GOPIBALLAVPUR-I                                   ","2014-11-16 20:39:26.763"
"RABI","HORTICULTURE","Fruits","Ber","	Plant Protection	","FRUIT ROT IN BER","RECOMMENDED FOR SPRAAY COPPER OXYCHLORIDE @ 4 GM/ LT. OF WATER.","WEST BENGAL","MIDNAPUR (WEST)","GARBETA-II                                        ","2014-11-17 07:11:51.690"
"KHARIF","HORTICULTURE","Vegetables","Chillies","	Plant Protection	","CONTROL OF LEAF CURL IN CHILLI.","REMOVED THE INFECTED PLANT AND RECOMMENDED FOR SPRAY  DIMETHOATE 30% EC @ 2 ML / LIT OF WATER.","WEST BENGAL","MIDNAPUR (WEST)","GOPIBALLAV PUR -II                                ","2014-11-17 08:12:43.880"
"RABI","HORTICULTURE","Vegetables","Chillies","	Plant Protection	","LEAF CURLING IN CHILLY","RECOMMENDED FOR SPRAYING DIMETHOATE @ 2ML/L OF WATER","WEST BENGAL","MIDNAPUR (WEST)","GHATAL                                            ","2014-11-17 08:21:00.160"
"RABI","HORTICULTURE","Vegetables","Bottle Gourd ","	Plant Protection	","CONTROL OF LEAF CATERPILLAR IN BOTTLE GOURD.","RECOMMENDED FOR SPRAY  FLUBENDIAMIDE 39.35% SC @ 1 ML  / 5  LIT OF WATER.","WEST BENGAL","MIDNAPUR (WEST)","JHARGRAM                                          ","2014-11-17 08:21:33.270"
"RABI","HORTICULTURE","Medicinal and Aromatic Plants","Betel Vine","	Plant Protection	","CONTROL OF LEAF SPOT IN BETEL VINE.","RECOMMENDED FOR SPRAY  COPPER OXYCHLORIDE 50% WP @  3 GM / LIT OF WATER.","WEST BENGAL","MIDNAPUR (WEST)","MOHANPUR                                          ","2014-11-17 08:35:27.340"
"RABI","HORTICULTURE","Vegetables","Potato","Fertilizer Use and Availability","ASKING ABOUT FERTILIZER DOSE OF POTATO FIELD","CONTACT WITH BLOCK  ASSISTANT DIRECTOR OF AGRICULTURE (A.D.A).","WEST BENGAL","MIDNAPUR (WEST)","GARBETA-III                                       ","2014-11-17 09:44:18.790"
"RABI","HORTICULTURE","Vegetables","Brinjal","	Plant Protection	","STEM BORER IN BRINJAL","RECOMMENDED FOR SPRAYING FIPRONIL @ 1ML/L OF WATER","WEST BENGAL","MIDNAPUR (WEST)","SANKRAIL                                          ","2014-11-17 11:14:08.533"
"KHARIF","HORTICULTURE","Vegetables","Bhindi(Okra/Ladysfinger)","	Plant Protection	","CONTROL OF WEEDS IN BHINDI.","RECOMMENDED FOR SPRAY ALACHLOR 50 % EC@6.4 ML/LIT OF WATER AND FLUCHLORALIN 45% EC @ 4 ML/LIT OF WATER.","WEST BENGAL","MIDNAPUR (WEST)","KHARAGPUR-II                                      ","2014-11-17 11:25:01.393"
"RABI","HORTICULTURE","Vegetables","Chillies","	Plant Protection	","CONTROL OF LEAF CURL IN CHILLIES.","RECOMMENDED FOR SPRAY  DIMETHOATE 30% EC @ 2 ML  / LIT OF WATER.","WEST BENGAL","MIDNAPUR (WEST)","KESHPUR                                           ","2014-11-17 11:43:15.730"
"RABI","FISHERIES","Inland","Fresh Water","Tank, Pond and Reservoir Management","WANT TO KNOW ABOUT POND MANAGEMENT IN A 1 BIGHA POND","ALL INFORMATION GIVEN IN DETAILS","WEST BENGAL","MIDNAPUR (WEST)","GARBETA-II                                        ","2014-11-17 12:24:50.790"
"KHARIF","AGRICULTURE","Others","Others","Credit","WANT TO KNOW ABOUT KISAN CREDIT CARD.","RECOMMENDED FOR CONTACT WITH A.D.A. IN BLOCK.","WEST BENGAL","MIDNAPUR (WEST)","KESHIARY                                          ","2014-11-17 13:41:19.690"
"KHARIF","HORTICULTURE","Vegetables","Brinjal","	Plant Protection	","ROOT ROT OF BRINJAL.","RECOMMENDED FOR SPRAY COPPER OXYCHLORIDE 50% WP @ 4 GM./LIT. OF WATER.","WEST BENGAL","MIDNAPUR (WEST)","JHARGRAM                                          ","2014-11-17 14:20:32.797"
