"Season","Sector","Category","Crop","QueryType","QueryText","KCCAns","StateName","DistrictName","BlockName","CreatedOn"
"KHARIF","AGRICULTURE","Cereals","Paddy (Dhan)","Weather","WANT TO KNOW ABOUT WEATHERING REPORT IN MIDNAPUR(WEST)","INDIA METEOROLOGICAL DEPARTMENT RAINFALL (MM) NEXT FIVE (22/11/14-26/11/14) DAYS 0,0,0,0,0,","WEST BENGAL","MIDNAPUR (WEST)","SABANG                                            ","2014-11-21 12:55:15.300"
"RABI","HORTICULTURE","Vegetables","Tomato","Soil Testing","ASKIN ABOUT SOIL TESTING","CONTACT WITH LOCAL BLOCK OFFICE- A.D.A.","WEST BENGAL","MIDNAPUR (WEST)","NARAYANGARH                                       ","2014-11-21 13:57:25.217"
"KHARIF","HORTICULTURE","Vegetables","Potato","	Plant Protection	","WEED CONTROL IN POTATO FIELD","APPLY HAND WEEDING","WEST BENGAL","MIDNAPUR (WEST)","KESHIARY                                          ","2014-11-21 15:40:21.647"
"RABI","HORTICULTURE","Vegetables","Bitter Gourd","	Plant Protection	","CONTROL OF BROWN SPOTS IN BITTER GOURD","RECOMMENDED FOR SPRAY MANCOZEB 2.5GM/LIT OF WATER","WEST BENGAL","MIDNAPUR (WEST)","GARBETA-II                                        ","2014-11-21 16:52:44.163"
"KHARIF","AGRICULTURE","Cereals","Paddy (Dhan)","Government Schemes","asked about govt schemes.","ADVICE to CONTACT WITH ADA/KPS/BTM-ATMA, BLOCK/ district information officer-03222275205 and district horticulture officer-03222263955","WEST BENGAL","MIDNAPUR (WEST)","JAMBANI                                           ","2014-11-21 17:32:27.760"
"KHARIF","AGRICULTURE","Cereals","Paddy (Dhan)","Weather","WANT TO KNOW  ABOUT WEATHERING REPOT IN MIDNAPUR(WEST)","NEXT FIVE DAYS NO RAIN FALL","WEST BENGAL","MIDNAPUR (WEST)","KHARAGPUR-II                                      ","2014-11-21 17:58:46.257"
"KHARIF","AGRICULTURE","Others","Others","Soil Testing","WANT TO KNOW ABOUT SOIL TEST","CONTACT WITH LOCAL A.D.A.","WEST BENGAL","MIDNAPUR (WEST)","MIDNAPORE                                         ","2014-11-21 18:24:01.833"
"KHARIF","HORTICULTURE","Vegetables","Potato","	Plant Protection	","CONTROL OF LEAF CURL OF POTATO","RECOMMENDED FOR SPRAY DIMETHOATE 30% E.C. @ 2 ML/LT. OF WATER","WEST BENGAL","MIDNAPUR (WEST)","MIDNAPORE                                         ","2014-11-21 19:16:37.270"
"KHARIF","HORTICULTURE","Vegetables","Cucumber","	Plant Protection	","CONTROL OF WHITE FLY IN CUCUMBER","RECOMMENDED FOR SPRAY ACETAMIPRID 20% SP @ 1 GM  / 5 LIT OF WATER.","WEST BENGAL","MIDNAPUR (WEST)","DEBRA                                             ","2014-11-21 19:44:16.030"
"KHARIF","HORTICULTURE","Vegetables","Cucumber","	Plant Protection	","CONTROL OF STEM ROT OF CUCUMBER","RECOMMENDED FOR SPRAY COPPER OXYCHLORIDE 50% W.P. @ 4 GM/LT. OF WATER","WEST BENGAL","MIDNAPUR (WEST)","PINGLA                                            ","2014-11-21 20:17:47.473"
"RABI","AGRICULTURE","Oilseeds","Mustard","Seeds","ASKING ABOUT VARIETIES OF MUSTARD","RECOMMENDED JHUMKA, B-9 ETC.","WEST BENGAL","MIDNAPUR (WEST)","JHARGRAM                                          ","2014-11-22 08:02:13.640"
"RABI","HORTICULTURE","Vegetables","Bitter Gourd","Cultural Practices","CULTIVATION OF BITTER GOURD","CONTACT WITH BLOCK  [ ASSISTANT DIRECTOR OF AGRICULTURE(A.D.A)]","WEST BENGAL","MIDNAPUR (WEST)","SABANG                                            ","2014-11-22 08:13:53.877"
"RABI","HORTICULTURE","Vegetables","Potato","Cultural Practices","ASKING ABOUT CULTURAL PRACTICES IN POTATO","VARIETIES IN POTATO =RECOMMENDED FOR 
KUFRI JYOTI, KUFRI MUTHU, KUFRI SWARNA, KUFRI THANGAM, KUFRI MALAR, KUFRI SOGA AND KUFRI GIRIRAJ ARE COMMONLY CULTIVATED.","WEST BENGAL","MIDNAPUR (WEST)","KESHPUR                                           ","2014-11-22 09:08:26.487"
"RABI","HORTICULTURE","Vegetables","Tomato","	Plant Protection	","CONTROL OF FRUIT BORER IN TOMATO","RECOMMENDED FOR SPRAY METHOMYL 40% SP @ 1 GM/LIT OF WATER.","WEST BENGAL","MIDNAPUR (WEST)","BINPUR-I                                          ","2014-11-22 09:49:40.047"
"RABI","AGRICULTURE","Cereals","Paddy (Dhan)","Cultural Practices","CULTIVATION OF PADDY","CONTACT WITH BLOCK  [ ASSISTANT DIRECTOR OF AGRICULTURE(A.D.A)]","WEST BENGAL","MIDNAPUR (WEST)","NARAYANGARH                                       ","2014-11-22 09:59:30.793"
"RABI","HORTICULTURE","Vegetables","Tomato","	Plant Protection	","CONTROL OF LEAF CURL IN TAMATO","RECOMMENDED FOR SPRAY  DIMETHOATE 30% EC @ 2 ML  / LIT OF WATER.","WEST BENGAL","MIDNAPUR (WEST)","KHARAGPUR-I                                       ","2014-11-22 10:04:32.843"
"RABI","HORTICULTURE","Fruits","Jack Fruit","	Plant Protection	","CONTROL OF LEAF SPOT IN JACK FRUIT","RECOMMENDED FOR SPRAY CARBENDAZIM @ 2 GM / LIT.OF WATER","WEST BENGAL","MIDNAPUR (WEST)","GHATAL                                            ","2014-11-22 11:09:11.950"
"RABI","HORTICULTURE","Vegetables","Onion","Cultural Practices","ASKING ABOUT TRANSPLANTING DISTANCE OF ONION.","RECOMMENDED TRANSPLANTING DISTANCE OF ONION LINE TO 15 CM -20 CM AND PLANT TO PLANT 7 CM - 10 CM.","WEST BENGAL","MIDNAPUR (WEST)","DEBRA                                             ","2014-11-22 12:41:06.620"
"KHARIF","HORTICULTURE","Fruits","Mango","	Plant Protection	","CONTROL OF STEM BORER IN MANGO.","RECOMMENDED FOR SPRAY ACEPHATE @ 1.5 GM / 2 LIT OF WATER.","WEST BENGAL","MIDNAPUR (WEST)","KHARAGPUR-II                                      ","2014-11-22 14:17:22.147"
"KHARIF","HORTICULTURE","Vegetables","Pumpkin","	Plant Protection	","CONTROL OF YELLOW LEAF SPOT IN PUMPKIN","RECOMMENDED FOR SPRAY GRADE 2  @  2-3 ML / LIT OF WATER.","WEST BENGAL","MIDNAPUR (WEST)","NARAYANGARH                                       ","2014-11-22 14:22:42.260"
"RABI","HORTICULTURE","Vegetables","Potato","	Plant Protection	","CONTROL OF LATE BLIGHT IN POTATO.","RECOMMENDED FOR SPRAY COPPER OXYCHLORIDE 50%WP @ 4 GM / LIT. OF WATER.","WEST BENGAL","MIDNAPUR (WEST)","GARBETA-III                                       ","2014-11-22 15:05:47.787"
"RABI","HORTICULTURE","Vegetables","Potato","Fertilizer Use and Availability","ASKING ABOUT CHEMICAL FERTILIZERS REQUIRE IN POTATO FIELD.","RECOMMENDED CHEMICAL FERTILIZERS ARE NITROGEN = 200 KG / HRCTOR, S.S.P.= 150 KG / HECTOR, M.O.P = 150 KG / HECTOR.","WEST BENGAL","MIDNAPUR (WEST)","CHANDRAKONA-I                                     ","2014-11-22 17:48:07.570"
"KHARIF","AGRICULTURE","Oilseeds","Mustard","	Plant Protection	","CONTROL OF APHID IN MUSTARD.","RECOMMENDED FOR SPRAY  DIMETHOATE 30% EC @ 2 ML  / LIT OF WATER.","WEST BENGAL","MIDNAPUR (WEST)","NAYAGRAM                                          ","2014-11-22 18:30:06.437"
"KHARIF","AGRICULTURE","Others","Others","Weather","WANT TO KNOW ABOUT WEATHER REPORTS IN MEDNIPUR","INDIA METEOROLOGICAL DEPARTMENT (RAINFALL MM)23/11/14 NO RAINFALL.","WEST BENGAL","MIDNAPUR (WEST)","BINPUR-I                                          ","2014-11-22 18:45:46.810"
"RABI","AGRICULTURE","Pulses","Lentil (Masur)","	Plant Protection	","CONTROL ROOT ROT IN LENTIL.","RECOMMENDED FOR SPRAY  COPPER OXYCHLORIDE 50% WP @  4 GM / LIT OF WATER.","WEST BENGAL","MIDNAPUR (WEST)","GHATAL                                            ","2014-11-22 19:08:40.157"
"KHARIF","HORTICULTURE","Vegetables","Chillies","	Plant Protection	","CONTROL OF STEM ROT IN CHILLI.","RECOMMENDED FOR SPRAY  THIOPHANATE METHYL 75% WP @ 1 GM / 1 LIT. OF WATER.","WEST BENGAL","MIDNAPUR (WEST)","GHATAL                                            ","2014-11-22 19:39:49.060"
"KHARIF","HORTICULTURE","Medicinal and Aromatic Plants","Betel Vine","	Plant Protection	","CONTROL OF BLACK SPOT IN BETEL VINE","RECOMMENDED FOR SPRAY  COPPER OXYCHLORIDE 50% WP @  4 GM / LIT OF WATER.","WEST BENGAL","MIDNAPUR (WEST)","DANTAN-II                                         ","2014-11-22 19:57:03.623"
"RABI","HORTICULTURE","Vegetables","Potato","	Plant Protection	","ASKING ABOUT SEED TREATMENT IN POTATO.","RECOMMENDED FOR APPLY MANCOZEB 75% WP @ 2.5 GM / LIT OF WATER.","WEST BENGAL","MIDNAPUR (WEST)","DANTAN-II                                         ","2014-11-22 21:03:17.010"
"KHARIF","AGRICULTURE","Cereals","Paddy (Dhan)","	Plant Protection	","CONTROL OF BROWN PLANT HOPPER IN PADDY.","RECOMMENDED FOR SPRAY BUPROFEZIN 25% SC @ 1 ML  / LIT OF WATER.","WEST BENGAL","MIDNAPUR (WEST)","NARAYANGARH                                       ","2014-11-22 21:51:06.027"
"RABI","HORTICULTURE","Vegetables","Chillies","	Plant Protection	","CONTROL OF LEAF CURL IN CHILLIES.","RECOMMENDED FOR SPRAY  FENAZAQUIN 10% EC @ 1.5 ML  / LIT OF WATER.","WEST BENGAL","MIDNAPUR (WEST)","NARAYANGARH                                       ","2014-11-23 08:30:23.960"
"RABI","HORTICULTURE","Vegetables","Potato","	Plant Protection	","CONTROL OF ROOT ROT IN POTATO","RECOMMENDED FOR SPRAY COPPER OXYCHLORIDE 50%WP @ 4 GM/LIT.OF WATER","WEST BENGAL","MIDNAPUR (WEST)","JHARGRAM                                          ","2014-11-23 11:07:46.623"
"RABI","HORTICULTURE","Vegetables","Tomato","	Plant Protection	","CONTROL OF BACTERIAL WILT IN TOMATO","RECOMMENDED FOR SPRAY COPPER OXYCHLORIDE 50%WP @ 4 GM/LIT.OF WATER","WEST BENGAL","MIDNAPUR (WEST)","SALBANI                                           ","2014-11-23 11:37:03.350"
"KHARIF","HORTICULTURE","Plantation Crops","Coconut","	Plant Protection	","CONTROL OF FRUT DROP IN COCONUT","RECOMMENDED FOR SPRAY ALPHA NEPTHALENE ACETIC ACID  @ 1 ML / 4.5 LIT OF WATER.","WEST BENGAL","MIDNAPUR (WEST)","SABANG                                            ","2014-11-23 12:07:48.520"
"RABI","AGRICULTURE","Others","Others","Weather","ASKING ABOUT WEATHER REPORT","PARTLY CLOUDY SKY WITH POSSIBILITY OF NO RAINFALL","WEST BENGAL","MIDNAPUR (WEST)","DASPUR-II                                         ","2014-11-23 12:22:25.807"
"KHARIF","HORTICULTURE","Plantation Crops","Coconut","	Plant Protection	","CONTROL OF FRUIT DROP IN COCONUT","RECOMMENDED FOR SPRAY ALPHA NEPTHALENE ACETIC ACID  @ 1 ML / 4.5 LIT OF WATER.","WEST BENGAL","MIDNAPUR (WEST)","DEBRA                                             ","2014-11-23 12:28:55.277"
"RABI","AGRICULTURE","Others","Others","Weather","ASKING ABOUT WEATHER REPORT.","NO RAINFALL WILL BE DONE FROM LAST FIVE DAYS.","WEST BENGAL","MIDNAPUR (WEST)","DASPUR-I                                          ","2014-11-23 14:02:22.433"
"RABI","AGRICULTURE","Others","Others","Market Information","WANT MARKET INFORMATION SMS SERVICE.","MARKET INFORMATION SMS SERVICE ON PADDY HAS BEEN ACTIVATED.","WEST BENGAL","MIDNAPUR (WEST)","KHARAGPUR-II                                      ","2014-11-23 14:34:38.537"
"RABI","HORTICULTURE","Vegetables","Beans ","	Plant Protection	","CONTROL OF LEAF CURLING IN BEAN","RECOMMENDED FOR SPRAY DIMETHOED 30% EC @ 2ML/LIT OF WATER","WEST BENGAL","MIDNAPUR (WEST)","DASPUR-I                                          ","2014-11-23 14:47:28.490"
"RABI","AGRICULTURE","Others","Others","Weather","ASKING ABOUT WEATHER REPORT IN MIDNAPUR WEST","PARTLY CLOUDY SKY WITH POSSIBILITY OF NO RAINFALL","WEST BENGAL","MIDNAPUR (WEST)","DEBRA                                             ","2014-11-23 17:51:55.090"
"RABI","HORTICULTURE","Vegetables","Potato","Seeds and Planting Material","ASKING ABOUT SEED TREATMENT OF POTATO.","SEED TREATMENT WITH MANCOZEB 75 % WP @ 3 GM / LITER OF WATER.","WEST BENGAL","MIDNAPUR (WEST)","GARBETA-I                                         ","2014-11-23 18:38:57.900"
"RABI","HORTICULTURE","Vegetables","Bitter Gourd","	Plant Protection	","CONTROL OF LEAF CURL IN BITTER GOURD.","RECOMENDED FOR SPRAY AZADIRECTIN 1 % EC @ 3ML/ LITER OF WATER.","WEST BENGAL","MIDNAPUR (WEST)","GARBETA-I                                         ","2014-11-23 18:53:13.833"
"RABI","HORTICULTURE","Vegetables","Tomato","Market Information","ASKING ABOUT MARKET PRICE IN TOMATO.","MARKET PRICE IN TOMATO-RS.2030/QUINTAL (HABRA MARKET )","WEST BENGAL","MIDNAPUR (WEST)","BINPUR-I                                          ","2014-11-23 19:00:31.503"
"RABI","AGRICULTURE","Oilseeds","Mustard","	Plant Protection	","CONTROL OF CATERPILLAR IN MUSTARD.","RECOMENDED FOR SPRAY NOVALURON 10 % EC @ 1 ML / LITER OF WATER.","WEST BENGAL","MIDNAPUR (WEST)","SABANG                                            ","2014-11-23 20:19:10.463"
"KHARIF","HORTICULTURE","Vegetables","Chillies","	Plant Protection	","CONTROL OF BACTERIAL WILT IN CHILLIE","RECOMMENDED FOR SPRAY STREPTOCYCLINE 9:1 SP ( 90:10 SP) @ 1 GM / 10 LIT OF WATER.","WEST BENGAL","MIDNAPUR (WEST)","DEBRA                                             ","2014-11-23 20:28:10.027"
"KHARIF","HORTICULTURE","Vegetables","Bitter Gourd","	Plant Protection	","CONTROL OF WHITE FLY IN BITTER GOURD","RECOMMENDED FOR SPRAY  DIMETHOATE 30% EC @ 2 ML  / LIT OF WATER.","WEST BENGAL","MIDNAPUR (WEST)","SABANG                                            ","2014-11-24 06:44:15.113"
"KHARIF","AGRICULTURE","Cereals","Paddy (Dhan)","Soil Testing","WANT TO KNOW ABOUT SOILO TEST","ADVICE TO CONTACT WITH A.D.A. (BLOCK)","WEST BENGAL","MIDNAPUR (WEST)","PINGLA                                            ","2014-11-24 07:02:26.233"
"RABI","HORTICULTURE","Vegetables","Tomato","	Plant Protection	","CONTROL OF LEAF CURL IN TOMATO.","RECOMMENDED FOR SPRAY DIMETHOARE 30% EC @ 2 ML / LIT. OF WATER.","WEST BENGAL","MIDNAPUR (WEST)","GHATAL                                            ","2014-11-24 07:48:32.820"
"RABI","HORTICULTURE","Fruits","Banana","	Plant Protection	","Control of Rhizome weevil in Banana.","Recommended for Soil incorporation at the time of planting: carbofuran 3 G 10g, phorate 10 G 5 g/plant","WEST BENGAL","MIDNAPUR (WEST)","GARBETA-I                                         ","2014-11-24 08:33:43.633"
"RABI","HORTICULTURE","Vegetables","Brinjal","	Plant Protection	","CONTROL OF LITTLE LEAF OF BRINJAL.","RECOMMENDED FOR SPRAY  DIMETHOATE 30% EC @ 2 ML  / LIT OF WATER.","WEST BENGAL","MIDNAPUR (WEST)","JHARGRAM                                          ","2014-11-24 09:48:54.830"
"RABI","HORTICULTURE","Vegetables","Bottle Gourd ","	Plant Protection	","CONTROL OF PUMPKIN BEETLES IN BOTTLE GOURD.","RECOMMENDED FOR SPRAY AZADIRECHTIN 1% EC @ 3 ML / LIT. OF WATER.","WEST BENGAL","MIDNAPUR (WEST)","PINGLA                                            ","2014-11-24 10:36:42.147"
"RABI","AGRICULTURE","Cereals","Paddy (Dhan)","	Plant Protection	","ATTACK OF NECK BLAST IN PADDY FIELD","RECOMMENDED FOR SPRAY OF  TRICYCLAZOLE 75 % WP @ .5 GM/LIT OF WATER","WEST BENGAL","MIDNAPUR (WEST)","SABANG                                            ","2014-11-24 11:15:22.010"
"RABI","AGRICULTURE","Others","Others","Government Schemes","I FORGET MY CLIENT ID NUMBER PLEASE SEND MY ID NUMBER.","YOUR Client ID : WB1396460","WEST BENGAL","MIDNAPUR (WEST)","GOPIBALLAVPUR-I                                   ","2014-11-24 11:45:43.443"
"RABI","HORTICULTURE","Vegetables","Bitter Gourd","	Plant Protection	","CONTROL OF WHITE FLY IN BITTER GOURD.","RECOMMENDED FOR SPRAY IMIDACLOPRID 17.8% SL  @  1 ML / 5 LIT OF WATER.","WEST BENGAL","MIDNAPUR (WEST)","DASPUR-I                                          ","2014-11-24 11:55:23.473"
"RABI","HORTICULTURE","Vegetables","Chillies","	Plant Protection	","LEAF CURLING IN CHILLI","RECOMMENDED FOR SPRAYING DIMETHOATE @ 2ML/L OF WATER","WEST BENGAL","MIDNAPUR (WEST)","KESHPUR                                           ","2014-11-24 13:06:25.660"
"RABI","AGRICULTURE","Cereals","Paddy (Dhan)","Seeds","ASKING ABOUT SEED TREATMENT OF PADDY.","SEED TREATMENT WITH CARBENDAZIM 50 % WP @ 3 GM / LITER OF WATER.","WEST BENGAL","MIDNAPUR (WEST)","NARAYANGARH                                       ","2014-11-24 14:27:44.593"
"KHARIF","HORTICULTURE","Vegetables","Tomato","	Plant Protection	","CONTROL OF WHITE FLY IN TOMATO.","RECOMMENDED FOR SPRAY ACETAMIPRID 20% SP @ 1 GM  / 5 LIT OF WATER.","WEST BENGAL","MIDNAPUR (WEST)","NARAYANGARH                                       ","2014-11-24 15:25:15.657"
"RABI","AGRICULTURE","Others","Others","	Plant Protection	","WANT TO KNOW ABOUT DOSE OF GLYPHOSATE 41% SL","RECOMMENDED FOR APPLY GLYPHOSATE 41% SL @ 500 ML/ BIGHA (33 SATAK)","WEST BENGAL","MIDNAPUR (WEST)","SABANG                                            ","2014-11-24 16:31:05.330"
"RABI","HORTICULTURE","Vegetables","Potato","	Plant Protection	","APHID IN POTATO","RECOMMENDED FOR SPRAY DIMETHOATE @ 2 ML/ LT. OF WATER.","WEST BENGAL","MIDNAPUR (WEST)","GARBETA-III                                       ","2014-11-24 16:40:35.633"
"RABI","AGRICULTURE","Cereals","Paddy (Dhan)","	Plant Protection	","CONTROL OF COLD INJURY IN PADDY SEED BAD","RECOMMENDED FOR SPRAY CARBANDAZIME 12% +MANCOZEB 63% @ 2GM/LIT OF WATER","WEST BENGAL","MIDNAPUR (WEST)","NARAYANGARH                                       ","2014-11-24 17:48:29.930"
"RABI","HORTICULTURE","Medicinal and Aromatic Plants","Betel Vine","Fertilizer Use and Availability","WANT TO KNOW ABOUT DOSE OF GRADE 2","RECOMENDED FOR SPRAY 2GM/ LIT OF WATER","WEST BENGAL","MIDNAPUR (WEST)","DANTAN-I                                          ","2014-11-24 17:59:29.100"
"RABI","HORTICULTURE","Vegetables","Onion","Cultural Practices","ASKING ABOUT SEED TREATMENT FOR ONION.","RECOMMENDED FOR USE CARBENDAZIM 50% WP @ 2 GM  / LIT OF WATER.","WEST BENGAL","MIDNAPUR (WEST)","KHARAGPUR-II                                      ","2014-11-24 18:06:03.613"
"RABI","HORTICULTURE","Vegetables","Tomato","	Plant Protection	","BACTERIAL WILT IN TOMATO","RECOMENDED FOR SPRAY STREPTOCYCLINE @ 1GM/ 8 LIT OF WATER","WEST BENGAL","MIDNAPUR (WEST)","MIDNAPORE                                         ","2014-11-24 19:13:12.800"
"RABI","HORTICULTURE","Vegetables","Tomato","Market Information","ASKING ABOUT TOMATO MARKET IN MIDNAPUR DISTRICT.","TOMATO MARKET IN MIDNAPUR WEST  - Tomato  MINIMUM = 2500, MAXIMUM =  3000,  MODEL PRICE = 3000 Rs/Quintal.","WEST BENGAL","MIDNAPUR (WEST)","BINPUR-I                                          ","2014-11-24 19:24:16.813"
"RABI","AGRICULTURE","Others","Others","Weather","ASKING WATHER REPORT","NO RAINFAL","WEST BENGAL","MIDNAPUR (WEST)","GARBETA-I                                         ","2014-11-24 20:36:15.020"
"RABI","HORTICULTURE","Vegetables","Potato","Cultural Practices","WANT TO KNOW ABOUT SEED TREATMENT OF POTATO.","RECOMMENDED FOR APPLY MANCOZEB 75% WP @ 2.5 GM / LIT. OF WATER FOR POTATO SEED TREATMENT.","WEST BENGAL","MIDNAPUR (WEST)","CHANDRAKONA-I                                     ","2014-11-25 08:14:37.633"
"RABI","AGRICULTURE","Oilseeds","Mustard","Seeds","Want to know about seed rate of Mustard","RECOMMENDED SEED RATE OF MUSTARD IS 3 KG/ ACRE (100 SATAK)","WEST BENGAL","MIDNAPUR (WEST)","GARBETA-II                                        ","2014-11-25 08:23:53.823"
"RABI","HORTICULTURE","Vegetables","Chillies","	Plant Protection	","CONTROL OF LEAF CURL IN CHILLI.","REMOVED THE INFECTED PLANT AND RECOMMENDED FOR SPRAY FIPRONIL 5%SC @ 1ML/ LIT. OF WATER.","WEST BENGAL","MIDNAPUR (WEST)","KESHPUR                                           ","2014-11-25 09:52:53.550"
"KHARIF","HORTICULTURE","Vegetables","Potato","	Plant Protection	","ASKING ABOUT PLANTING DISTANCE IN POTATO.","RECOMMENDED FOR USE 45 CM FOR LINE TO LINE AND 15 CM FOR PLANT TO PLANT DISTANCE.","WEST BENGAL","MIDNAPUR (WEST)","GARBETA-I                                         ","2014-11-25 10:28:14.063"
"KHARIF","HORTICULTURE","Vegetables","Potato","	Plant Protection	","ASKING ABOUT SEED TREATMENT OF POTATO.","RECOMMENDED FOR SEED TREATMENT WITH MANCOZEB 75% @ 3 GM / LIT. OF WATER, SEEDS SOAKED UPTO MINUTE.","WEST BENGAL","MIDNAPUR (WEST)","GARBETA-I                                         ","2014-11-25 10:32:50.410"
"RABI","HORTICULTURE","Vegetables","Brinjal","	Plant Protection	","CONTROL OF FRUIT BRORER IN BRINJAL","RECOMMENDED FOR SPRAY SPINOSAD AND FLUBANDIYAMIT @ 1ML /4LIT OF WATER","WEST BENGAL","MIDNAPUR (WEST)","CHANDRAKONA-II                                    ","2014-11-25 12:07:12.773"
"KHARIF","HORTICULTURE","Vegetables","Potato","Fertilizer Use and Availability","ASKING ABOUT TOP DRESSING FERTILIZERS APPLICATION TIME IN POTATO.","RECOMMENDED FOR TOP DRESSING FERTILIZERS APPLICATION TIME IN POTATO IS AFTER 21 DAYS OF SOWING.","WEST BENGAL","MIDNAPUR (WEST)","KESHPUR                                           ","2014-11-25 12:44:18.857"
"RABI","AGRICULTURE","Cereals","Paddy (Dhan)","	Plant Protection	","ASKING ABOUT SEED TREATMENT OF PADDY.","RECOMMENDED FOR SEED TREATMENT WITH CARBENDAZIM 50% @ 2 GM / LIT. OF WATER, SEEDS SOAKED UPTO LAST 8-10 HRS.","WEST BENGAL","MIDNAPUR (WEST)","NARAYANGARH                                       ","2014-11-25 13:32:06.960"
"RABI","AGRICULTURE","Cereals","Paddy (Dhan)","Cultural Practices","ASKING ABOUT VARIETY IN PADDY.","PADDY VARIETY ARE IR-36,IR-64,MTU-1010,LALAT,RATNA.","WEST BENGAL","MIDNAPUR (WEST)","DEBRA                                             ","2014-11-25 13:34:03.617"
"RABI","AGRICULTURE","Others","Others","Soil Testing","ASKING ABOUT SOIL TESTING.","ADVICE TO CONTACT WITH ADA.","WEST BENGAL","MIDNAPUR (WEST)","JHARGRAM                                          ","2014-11-25 13:41:39.267"
"KHARIF","HORTICULTURE","Vegetables","Cucumber","Fertilizer Use and Availability","FERTILIZER DOSE OF CUCUMBER.","ADVICE SOIL TEST AND CONTACT WITH ADA/KPS/BTM-ATMA, BLOCK.","WEST BENGAL","MIDNAPUR (WEST)","PINGLA                                            ","2014-11-25 13:59:01.177"
"KHARIF","HORTICULTURE","Vegetables","Cucumber","	Plant Protection	","CONTROL OF LEAF CURL IN CUCUMBER.","RECOMMENDED FOR SPRAY  DIMETHOATE 30% EC @ 2 ML / LIT OF WATER.","WEST BENGAL","MIDNAPUR (WEST)","GHATAL                                            ","2014-11-25 14:48:26.117"
"RABI","AGRICULTURE","Others","Others","Weather","ASKING WATHER REPORT","NO RAINFAL","WEST BENGAL","MIDNAPUR (WEST)","GHATAL                                            ","2014-11-25 15:25:01.263"
"KHARIF","AGRICULTURE","Cereals","Paddy (Dhan)","Seeds","ASKED ABOUT SEED TREATMENT OF PADDY.","RECOMMENDED FOR CARBENDAZIM  50% WP @ 3 GM./KG SEED.","WEST BENGAL","MIDNAPUR (WEST)","PINGLA                                            ","2014-11-25 16:06:11.880"
"KHARIF","HORTICULTURE","Vegetables","Chillies","	Plant Protection	","BACTERIAL WILT OF CHILLI.","RECOMMENDED FOR SPRAY TRICHODERMA VIRIDE @ 5 GM./LIT. OF WATER AND PSEUDOMONAS FLUORESCENCE @ 5 GM./LIT. OF WATER.","WEST BENGAL","MIDNAPUR (WEST)","DASPUR-I                                          ","2014-11-25 16:15:41.730"
"RABI","AGRICULTURE","Oilseeds","Mustard","	Plant Protection	","CONTROL OF BLIGHT IN MUSTARD.","RECOMENDED FOR SPRAY CARBENDAZIM + MANCOZEB @ 2 GM/ LITER OF WATER.","WEST BENGAL","MIDNAPUR (WEST)","CHANDRAKONA-II                                    ","2014-11-25 17:23:17.560"
"KHARIF","HORTICULTURE","Vegetables","Potato","	Plant Protection	","CONTROL OF STEM ROT IN POTATO.","RECOMMENDED FOR SPRAY  COPPER OXYCHLORIDE 50% WP @  4 GM / LIT OF WATER.","WEST BENGAL","MIDNAPUR (WEST)","GARBETA-III                                       ","2014-11-25 18:20:06.557"
"RABI","HORTICULTURE","Vegetables","Chillies","	Plant Protection	","whitish tip in chilli","RECOMENDED FOR SPRAY BUPROFRAZIN (APPLOD) 25%EC @ 1ML/ LIT OF WATER","WEST BENGAL","MIDNAPUR (WEST)","GARBETA-II                                        ","2014-11-25 18:20:07.350"
"RABI","AGRICULTURE","Oilseeds","Mustard","Seeds","ASKING ABOUT SEED RATE OF MUSTARD.","RECOMENDED SEED RATE OF MUSTARD @ 3 KG / ACRE.","WEST BENGAL","MIDNAPUR (WEST)","GARBETA-II                                        ","2014-11-25 18:36:49.693"
"RABI","FISHERIES","Inland","Fresh Water","Water Testing for Fish Production","ASKING ABOUT FISH PRODUCTION.","ADVICE TO CONTACT WITH BLOCK FISHERY OFFICER.","WEST BENGAL","MIDNAPUR (WEST)","GHATAL                                            ","2014-11-25 18:45:35.647"
"RABI","HORTICULTURE","Fruits","Lemon","Crop Insurance","ASKING ABOUT FERTILIZER USE IN LEMON.","RECOMMENDED FOR USE FYM AND N:P:K AS PER YOUR SOIL REQUARMENT.","WEST BENGAL","MIDNAPUR (WEST)","KHARAGPUR-II                                      ","2014-11-25 19:21:38.193"
"RABI","AGRICULTURE","Others","Others","Weather","ASKING ABOUT WEATHER REPORT IN MEDINIPUR DISTRICT.","NO RAIN FALL UPTO  27.11.2014 IN MEDINIPUR DISTRICT.","WEST BENGAL","MIDNAPUR (WEST)","GHATAL                                            ","2014-11-25 19:24:53.130"
"RABI","HORTICULTURE","Vegetables","Potato","Cultural Practices","ASKING ABOUT SEED TREATMENT IN POTATO.","RECOMMENDED FOR APPLY MANCOZEB 75% WP @ 2.5 GM / LIT OF WATER.","WEST BENGAL","MIDNAPUR (WEST)","MIDNAPORE                                         ","2014-11-25 19:49:35.367"
"RABI","HORTICULTURE","Vegetables","Tomato","	Plant Protection	","CONTROL OF BACTERIAL WILT IN TOMATO.","RECOMENDED FOR SPAY STREPTOCYCLINE @ 1 GM/ 10 LITER OF WATER.","WEST BENGAL","MIDNAPUR (WEST)","KHARAGPUR-I                                       ","2014-11-25 20:05:46.113"
"RABI","AGRICULTURE","Others","Others","Cultural Practices","ASKING ABOUT WEATHER REPORT.","NO RAINFALL WILL BE DONE FROM LAST FIVE DAYS.","WEST BENGAL","MIDNAPUR (WEST)","GARBETA-II                                        ","2014-11-25 20:12:52.923"
"RABI","HORTICULTURE","Vegetables","Chillies","	Plant Protection	","CONTROL OF LEAF CURL IN CHILLIES.","RECOMENDED FOR SPRAY DIMETHOATE 30%EC @ 2 ML/ LITER OF WATER.","WEST BENGAL","MIDNAPUR (WEST)","GHATAL                                            ","2014-11-25 20:14:28.300"
"RABI","HORTICULTURE","Vegetables","Chillies","	Plant Protection	","CONTROL OF LEAF CURL IN CHILLIES.","RECOMMENDED FOR SPRAY  DIMETHOATE 30% EC @ 2 ML  / LIT OF WATER.","WEST BENGAL","MIDNAPUR (WEST)","GHATAL                                            ","2014-11-26 09:07:04.313"
