"Season","Sector","Category","Crop","QueryType","QueryText","KCCAns","StateName","DistrictName","BlockName","CreatedOn"
"RABI","AGRICULTURE","Cereals","Wheat","	Water Management	","water management in wheat?","irrigation scheduling for wheat
?????? ?? ??????u - Crown Root Initiation (21 days after sowing)
?????? ????? ?? ??????t - Late Tillering (42 days after sowing)
???? ??? ?? ??????? - Late Joinging(60 days after sowing)
?????? ??? ?? ??????? - Flowering (80 days after sowing)
???? ??? ??? ???? ?? ??????? - Milk stage (95 days after sowing) and
???? ?? ??????? - Dough Ripe (115 days after sowing)","MADHYA PRADESH","DHAR","DHAR                                              ","2014-12-01 07:56:14.563"
"RABI","HORTICULTURE","Condiments and Spices","Garlic","Market Information","Farmer wants to know about mandi rate of garlic at neemuch  mandi of Madhya Pradesh?","Dear in your's neemuch mandi rate of garlic crop is 1500 Rs. minimum/quintal 7450 Rs. maximum/quintal 2500 Rs. average/quintal.","MADHYA PRADESH","DHAR","BADNAWAR                                          ","2014-12-01 09:31:38.217"
"RABI","HORTICULTURE","Vegetables","Peas (field peas/ garden peas/matar)","	Plant Protection	","How to control caterpillars in pea crop?","Recommended for Spray of Profenofos 40% + Cypermethrin 4% EC 1000 Ml. / hac.","MADHYA PRADESH","DHAR","BADNAWAR                                          ","2014-12-01 09:40:24.560"
"RABI","ANIMAL HUSBANDRY","Animal","Goat","Integrated Farming","how to start got rearing ?","Please contact with your nearest Veterinary department & bank or laghu udyog nigam or khadi gram udyog.","MADHYA PRADESH","DHAR","NISARPUR                                          ","2014-12-01 10:19:03.863"
"RABI","HORTICULTURE","Fruits","Pomegranate","	Plant Protection	","flower drop in pomegranate?","spraying of malathion@ 30 ml /pump","MADHYA PRADESH","DHAR","BADNAWAR                                          ","2014-12-01 11:35:43.007"
"RABI","HORTICULTURE","Fruits","Pomegranate","Nutrient Management","Recommended Fertilizers Doses for 3 year old pomegranate tree?","Recommended Fertilizers Doses for 3 year old pomegranate tree   30FYM (kg)	500Nitrogen (g)125	Phosphorous (g)125		    Potassium (g)/tree /year In bearing trees, apply N in 2 split does, starting at the time of first irrigation after bahar treatment and next at 3–4 weeks interval. Full dose of P and K should be applied as single dose with first irrigation.","MADHYA PRADESH","DHAR","BADNAWAR                                          ","2014-12-01 11:46:59.177"
"RABI","HORTICULTURE","Condiments and Spices","Ginger","	Plant Protection	","root rot in ginger cause the spoilage in plant what can I do ?","Recommended for Dranching of Cooper oxychloride @ 45 gm./pump + Streptrocyclin @ 2 gm./pump with 15 liter of water.","MADHYA PRADESH","DHAR","MANAWAR                                           ","2014-12-01 12:13:45.420"
"RABI","AGRICULTURE","Others","Others","Market Information","farmer want to know information about mandi registration ?","your number is ragistared","MADHYA PRADESH","DHAR","BADNAWAR                                          ","2014-12-01 12:36:58.830"
"RABI","AGRICULTURE","Others","Others","	Plant Protection	","farmer want to know information about How to control of fungal attack in crop ?","spray mencojeb + carbandazim 45 gram and steptrocyclin 2 gram at 15 liter of water","MADHYA PRADESH","DHAR","BADNAWAR                                          ","2014-12-01 14:25:07.600"
"KHARIF","HORTICULTURE","Vegetables","Potato","	Plant Protection	","farmer want to know information about Which fertilizer and nutrient give for better growth in potato crop?","Spray N: P: K 19:19:19 100 grams /15 liter of water.","MADHYA PRADESH","DHAR","BADNAWAR                                          ","2014-12-01 15:09:36.233"
"RABI","HORTICULTURE","Condiments and Spices","Garlic","Fertilizer Use and Availability","spray of weedicide on garlic crop plant become  leaf yellowness what can I do ?","Recommended for spray foliar application of IFFCO 19:19:19 water soluble fertilizer @ 100 gm/pump.","MADHYA PRADESH","DHAR","NALCHHA                                           ","2014-12-01 15:34:07.810"
"RABI","HORTICULTURE","Condiments and Spices","Ginger","	Plant Protection	","farmer want to know information about how to control sucking pest in garlic crop?","recommended for to control sucking pest in garlic crop spray fipronil@ 25 ml at 15 liter of water.","MADHYA PRADESH","DHAR","BADNAWAR                                          ","2014-12-01 15:53:25.533"
"RABI","AGRICULTURE","Others","Others","Market Information","Farmer want to information about mandi  registration?","Now your number is registered hear for manndi  rate","MADHYA PRADESH","DHAR","DHAR                                              ","2014-12-01 19:12:23.047"
"RABI","AGRICULTURE","Cereals","Wheat","Weather","Which fertilizer and nutrient give for better growth in wheat crop?","Recommended for spray foliar application of IFFCO 19:19:19 water soluble fertilizer @ 100 gm/pump.","MADHYA PRADESH","DHAR","DHAR                                              ","2014-12-01 19:19:51.390"
"RABI","HORTICULTURE","Condiments and Spices","Garlic","	Plant Protection	","Which fertilizer and nutrient give for better growth in GARLIC crop?","Spray N: P: K 19:19:19 100 grams and humic acid 30 ml at 15 liter of water.","MADHYA PRADESH","DHAR","BADNAWAR                                          ","2014-12-02 09:02:31.320"
"RABI","AGRICULTURE","Cereals","Wheat","Nutrient Management","foliar spray in wheat?","spray of water soluble fertilizer NPK 19:19:19 @     100 g   /pump","MADHYA PRADESH","DHAR","SARDARPUR                                         ","2014-12-02 09:43:22.050"
"RABI","AGRICULTURE","Fiber Crops","Cotton (Kapas)","	Plant Protection	","farmer want to know information about fungal attack in cotton crop ?","Use copper oxy chloride  50% w  45 gram and steptrocyclin  90% w/w 2 gram at 15 liter of water","MADHYA PRADESH","DHAR","KUKSHI                                            ","2014-12-02 11:36:29.167"
"RABI","AGRICULTURE","Cereals","Wheat","	Plant Protection	","Which fertilizer and nutrient give for better growth in wheat crop?","Recommended for spray foliar application of IFFCO 19:19:19 water soluble fertilizer @ 100 gm/pump.","MADHYA PRADESH","DHAR","DHAR                                              ","2014-12-02 12:13:58.977"
"RABI","AGRICULTURE","Cereals","Wheat","Nutrient Management","Foliar spray in wheat?","spray of water soluble fertilizer NPK 19:19:19 @     100 g   /pump","MADHYA PRADESH","DHAR","NALCHHA                                           ","2014-12-02 12:50:13.240"
"RABI","HORTICULTURE","Vegetables","Potato","	Plant Protection	","Farmer want to information about how to control of late blight on potato crop","spray Metalaxyl 8% + Mancozeb 64% WP 40 gram steptrocyclin 2 gram at 15 liter of water.","MADHYA PRADESH","DHAR","SARDARPUR                                         ","2014-12-02 12:52:10.770"
"RABI","AGRICULTURE","Pulses","Bengal Gram (Gram/Chick Pea/Kabuli/Chana)","	Plant Protection	","How to control of fungal attack in GRAM crop?","Mancozeb 63% + Carbendazim 12% WP 40 gram and steptrocyclin 2 gram at 15 liter of water.","MADHYA PRADESH","DHAR","DHAR                                              ","2014-12-02 13:45:41.387"
"RABI","AGRICULTURE","Pulses","Bengal Gram (Gram/Chick Pea/Kabuli/Chana)","Fertilizer Use and Availability","Which fertilizer  give for better growth in soybean crop?","spray iffco npk 0:52:34 @ 100 gram/pump.","MADHYA PRADESH","DHAR","DHAR                                              ","2014-12-02 13:51:57.780"
"RABI","AGRICULTURE","Others","Others","	Plant Protection	","how to control wilt ?","The affected plants should be removed and destroyed. Spot drenching of the solution Kasubi ( kasukamycine 3% SL) @ 250ml/acer + 50ml Cursur ( Flufilazol 40% EC) or Carbendazim (0.1%). Crop rotation with a non- host crop such as cereals.","MADHYA PRADESH","DHAR","DAHI                                              ","2014-12-02 13:53:36.227"
"RABI","AGRICULTURE","Others","Others","	Plant Protection	","Which fertilizer and nutrient give for better growth in garlic crop?","Spray N: P: K 19:19:19 100 grams and humic acid 30 ml at 15 liter of water.","MADHYA PRADESH","DHAR","BADNAWAR                                          ","2014-12-02 14:30:51.007"
"RABI","HORTICULTURE","Fruits","Mango","	Plant Protection	","farmer want to know information about control of flower and fruit dropin mango ?","recommended for to control of flower and fruit drop spray planofix 5 ml per pump","MADHYA PRADESH","DHAR","SARDARPUR                                         ","2014-12-02 14:35:08.283"
"RABI","HORTICULTURE","Condiments and Spices","Garlic","	Plant Protection	","farmer want to know information about How to control soil insect  in garlic  crop?","Apply cartap hydro chloride 7 to 10 kg at per Acer.","MADHYA PRADESH","DHAR","BADNAWAR                                          ","2014-12-02 15:39:54.337"
"RABI","AGRICULTURE","Others","Others","Market Information","Farmer wants to start mandi rate facility on mobile phone?","Your mandi rate facility registration has been successfully registered at kishan call center.","MADHYA PRADESH","DHAR","DHARAMPURI                                        ","2014-12-02 15:57:42.773"
"RABI","HORTICULTURE","Vegetables","Pea (Vegetable)","	Plant Protection	","farmer want to know information about How to control caterpillars in pea crop?","Spray emamectin benjoate or corajan or fem 10 ml at 15 liter of water or indoxa carb 10 ml at 15 liter of water.","MADHYA PRADESH","DHAR","BADNAWAR                                          ","2014-12-02 16:27:29.787"
"RABI","HORTICULTURE","Vegetables","Brinjal","	Plant Protection	","How to control white fly in brinjal crop?","Recommended for Spray imidaclorprid 17.8%SL 5 to 6 ml per pump.","MADHYA PRADESH","DHAR","NALCHHA                                           ","2014-12-02 16:37:11.573"
"RABI","HORTICULTURE","Vegetables","Pea (Vegetable)","	Plant Protection	","HOW TO CONTROL OF PEA CROP PEST ?","Mancozeb 63% + Carbendazim 12% WP 40 gram and steptrocyclin 2 gram at 15 liter of water.","MADHYA PRADESH","DHAR","DHAR                                              ","2014-12-02 16:50:11.940"
"RABI","AGRICULTURE","Others","Others","Market Information","farmer  want to know information about mandi price  has activate ?","in  your mobile mandi price  has activated within some time  start  on your mobile.","MADHYA PRADESH","DHAR","BADNAWAR                                          ","2014-12-02 17:19:11.757"
"RABI","HORTICULTURE","Condiments and Spices","Garlic","	Plant Protection	","How to control thrips in coriander crop?","Lambda Cyhalothrin 5% EC 120 to 150 ml at per acre.","MADHYA PRADESH","DHAR","BADNAWAR                                          ","2014-12-02 17:26:38.753"
"RABI","AGRICULTURE","Others","Others","Market Information","Farmer wants to start mandi rate facility on mobile phone?","Your mandi rate facility registration has been successfully registered at kishan call center.","MADHYA PRADESH","DHAR","BADNAWAR                                          ","2014-12-02 17:31:19.460"
"RABI","AGRICULTURE","Others","Others","Market Information","Farmer wants to start mandi rate facility on mobile phone?","Your mandi rate facility registration has been successfully registered at kishan call center.","MADHYA PRADESH","DHAR","BADNAWAR                                          ","2014-12-02 17:39:28.597"
"RABI","AGRICULTURE","Others","Others","Government Schemes","farmer want to  know information about        mandi registration ?","You have been registered for market information from kisaan call center","MADHYA PRADESH","DHAR","BADNAWAR                                          ","2014-12-02 19:00:41.480"
"RABI","AGRICULTURE","Others","Others","Government Schemes","farmer want to know information about registration of market and ussd information?","recommended for registration of market information you have been registered for market and ussd information from kisaan call center","MADHYA PRADESH","DHAR","UMARBAN                                           ","2014-12-02 19:21:58.103"
"RABI","HORTICULTURE","Condiments and Spices","Garlic","	Plant Protection	","Farmer want to information about how to control of fungal attack in  Garlic crop?","Use copper oxy chloride 45 gram and steptrocyclin 2 gram at 15 liter of water.","MADHYA PRADESH","DHAR","DHAR                                              ","2014-12-02 19:46:49.263"
"RABI","AGRICULTURE","Others","Others","Market Information","farmer want to add mandi rates?","mandi rates has been updated successfully","MADHYA PRADESH","DHAR","BADNAWAR                                          ","2014-12-02 19:53:04.473"
"RABI","AGRICULTURE","Cereals","Wheat","	Plant Protection	","farmer want to know information about Which fertilizer and nutrient give for better growth in wheat crop?","Spray N: P: K 19:19:19 100 grams /15 liter of water.","MADHYA PRADESH","DHAR","SARDARPUR                                         ","2014-12-02 20:12:08.397"
"RABI","AGRICULTURE","Cereals","Wheat","	Plant Protection	","farmer want to know information about Which fertilizer and nutrient give for better growth in wheat crop?","Spray N: P: K 19:19:19 100 grams /15 liter of water.","MADHYA PRADESH","DHAR","SARDARPUR                                         ","2014-12-02 20:15:34.180"
"RABI","AGRICULTURE","Cereals","Wheat","	Plant Protection	","farmer want to know information about Which fertilizer and nutrient give for better growth in wheat crop?","Spray N: P: K 19:19:19 100 grams /15 liter of water.","MADHYA PRADESH","DHAR","SARDARPUR                                         ","2014-12-02 20:16:00.800"
"RABI","AGRICULTURE","Cereals","Wheat","	Plant Protection	","farmer want to know information about Which fertilizer and nutrient give for better growth in wheat crop?","Spray N: P: K 19:19:19 100 grams /15 liter of water.","MADHYA PRADESH","DHAR","SARDARPUR                                         ","2014-12-02 20:16:44.347"
"RABI","AGRICULTURE","Others","Others","Market Information","Farmer wants to start mandi rate facility on mobile phone?","Your mandi rate facility registration has been successfully registered at kishan call center.","MADHYA PRADESH","DHAR","SARDARPUR                                         ","2014-12-02 21:29:07.730"
"RABI","AGRICULTURE","Cereals","Wheat","Weed Management","how to control the weeds of wheat ?","Spray the solution of Sulphosulfuron 75% WDG  @ 34 gram/ha in 250- 300 liters of water /ha.or Metaveer  (Metribuzin 70 % WP) 250 gram/ hac in at least 500 liters of water /ha. or 2,4- D sodium salt and Isoproteuran @ 1.5 kg / hac in 600- 700lit of water.","MADHYA PRADESH","DHAR","DHAR                                              ","2014-12-03 08:49:57.370"
"RABI","AGRICULTURE","Cereals","Wheat","	Plant Protection	","how to control the weeds of wheat ?","Spray the solution of Sulphosulfuron 75% WDG  @ 34 gram/ha in 250- 300 liters of water /ha.or Metaveer  (Metribuzin 70 % WP) 250 gram/ hac in at least 500 liters of water /ha. or 2,4- D sodium salt and Isoproteuran @ 1.5 kg / hac in 600- 700lit of water.","MADHYA PRADESH","DHAR","DHAR                                              ","2014-12-03 08:50:52.390"
"RABI","AGRICULTURE","Cereals","Wheat","	Plant Protection	","how to control weeds of wheat crop ?","spray Sulfosulfuron 75% WG @ 13.5 gram per acre .","MADHYA PRADESH","DHAR","DHAR                                              ","2014-12-03 09:17:48.917"
"RABI","AGRICULTURE","Cereals","Wheat","Weed Management","How we control weed control in Wheat ?","Spray of Metsulfuron Methyl @ 8 gm. / ha after 30-35 days of sowing..","MADHYA PRADESH","DHAR","SARDARPUR                                         ","2014-12-03 09:35:27.710"
"RABI","AGRICULTURE","Others","Others","Market Information","Farmer want to know information about to activate sms advisory scheme ?","To activate sms advisory scheme on your mobile number","MADHYA PRADESH","DHAR","BADNAWAR                                          ","2014-12-03 09:58:43.883"
"RABI","AGRICULTURE","Others","Others","Market Information","Farmer want to know information about to activate sms advisory scheme ?","To activate sms advisory scheme on your mobile number","MADHYA PRADESH","DHAR","BADNAWAR                                          ","2014-12-03 10:07:09.263"
"RABI","HORTICULTURE","Vegetables","Chillies","Nutrient Management","How we control Flower drop in Crop ?","Recommended of Planofix @ 5 ML./pump for manage the Flower drop condition..","MADHYA PRADESH","DHAR","MANAWAR                                           ","2014-12-03 10:20:35.450"
"RABI","AGRICULTURE","Others","Others","Market Information","Farmer want to know information about to activate sms advisory scheme ?","To activate sms advisory scheme on your mobile number","MADHYA PRADESH","DHAR","BADNAWAR                                          ","2014-12-03 10:21:46.860"
"RABI","AGRICULTURE","Others","Others","Weather","weather information ?","some clouds in your area","MADHYA PRADESH","DHAR","MANAWAR                                           ","2014-12-03 12:30:38.250"
"RABI","AGRICULTURE","Cereals","Wheat","	Plant Protection	","Farmer  want number activate in sms facility ?","your number is resistard in sms facility","MADHYA PRADESH","DHAR","DHAR                                              ","2014-12-03 14:27:08.000"
"RABI","AGRICULTURE","Others","Others","	Plant Protection	","TERMITES PROBLEM IN TREE ?","Chlorpyriphos 20%ec 750 ml per acre apply mix with sand .","MADHYA PRADESH","DHAR","BADNAWAR                                          ","2014-12-03 14:50:50.903"
"RABI","AGRICULTURE","Cereals","Wheat","	Plant Protection	","farmer want to know information about Which fertilizer and nutrient give for better growth in  wheat crop?","Spray N: P: K 19:19:19 100 grams /15 liter of water.","MADHYA PRADESH","DHAR","SARDARPUR                                         ","2014-12-03 15:06:07.530"
"RABI","AGRICULTURE","Cereals","Wheat","	Plant Protection	","Farmer want to know information about fungal attack in wheat     ?","Use copper oxy chloride 45 gram and steptrocyclin 2 gram at 15 liter of water.","MADHYA PRADESH","DHAR","BADNAWAR                                          ","2014-12-03 16:21:15.050"
"RABI","HORTICULTURE","Condiments and Spices","Garlic","Nutrient Management","Which fertilizer and nutrient give for better growth in GARLIC crop?","Recommended for spray foliar application of IFFCO 19:19:19 water soluble fertilizer @ 100 gm/pump.","MADHYA PRADESH","DHAR","DHAR                                              ","2014-12-03 16:36:57.760"
"RABI","AGRICULTURE","Pulses","Bengal Gram (Gram/Chick Pea/Kabuli/Chana)","	Field Preparation	","farmer want to know information about  How to control caterpillars in  gram crop?","Queenolfos 25 EC 1000 Ml. / hac. Rate of spray.","MADHYA PRADESH","DHAR","BADNAWAR                                          ","2014-12-03 16:38:15.127"
"RABI","HORTICULTURE","Condiments and Spices","Garlic","	Plant Protection	","farmer want to know information about How to control of fungal attack in garlic crop?","recommended for to control of fungal attack spray  carbandazim + mancozeb 40gm.and streptocyclin 2 gram at 15 liter of water","MADHYA PRADESH","DHAR","BADNAWAR                                          ","2014-12-03 16:39:58.587"
"RABI","AGRICULTURE","Pulses","Bengal Gram (Gram/Chick Pea/Kabuli/Chana)","Market Information","Market wise Daily Report for Big Gram  on  02/12/2014","Ratlam 8.6 Tonnes NR Other FAQ 2400 3101 2695 Rs/Quintal","MADHYA PRADESH","DHAR","SARDARPUR                                         ","2014-12-03 17:21:26.477"
"RABI","AGRICULTURE","Pulses","Bengal Gram (Gram/Chick Pea/Kabuli/Chana)","	Plant Protection	","wilt control in chickpea?","Tricoderma  viride 2.5 kg/ha mix in 50 kg FYM/acre , sprinkered with water and cover with polythein and apply after 2 days when proper moisture in field","MADHYA PRADESH","DHAR","NALCHHA                                           ","2014-12-03 18:45:36.130"
"RABI","AGRICULTURE","Others","Others","Market Information","Farmer wants to start mandi rate facility on mobile phone?","Your mandi rate facility registration has been successfully registered at kishan call center.","MADHYA PRADESH","DHAR","MANAWAR                                           ","2014-12-03 18:58:09.627"
"RABI","AGRICULTURE","Pulses","Bengal Gram (Gram/Chick Pea/Kabuli/Chana)","	Plant Protection	","farmer want to know information about  How to control caterpillars in gram crop?","Troijofos 40 EC 1000 Ml. / hac. Rate of spray.","MADHYA PRADESH","DHAR","DHAR                                              ","2014-12-03 20:00:13.927"
"RABI","HORTICULTURE","Vegetables","Onion","	Plant Protection	","how to control Purple blotch in onion ?","Three foliar sprayings with Copper oxychloride 2.5gm or Chlorothalonil 2gm or Zineb 2gm or Mancozeb 2 gm per litre of water    to  control Purple blotch in onion   .","MADHYA PRADESH","DHAR","BADNAWAR                                          ","2014-12-03 20:12:23.407"
"RABI","HORTICULTURE","Flowers","Gerbera","Beekeeping","farmer want to add mandi rates?","mandi rates has been updated successfully","MADHYA PRADESH","DHAR","MANAWAR                                           ","2014-12-03 20:30:39.373"
"RABI","AGRICULTURE","Others","Others","Market Information","farmer want to add mandi rates?","mandi rates has been updated successfully","MADHYA PRADESH","DHAR","KUKSHI                                            ","2014-12-03 20:56:34.690"
"RABI","AGRICULTURE","Others","Others","Market Information","Farmer wants to start mandi rate facility on mobile phone?","Your mandi rate facility registration has been successfully registered at kishan call center.","MADHYA PRADESH","DHAR","GANDHWANI                                         ","2014-12-04 07:35:23.100"
"RABI","AGRICULTURE","Millets","Maize (Makka)","Varieties","Farmer wants to know about varieties of maize crop?","Recommended for ganga safed 2,dekkan 101,Vijay Navjot,Mahi,Dhawal,Mahi kanchan are maize verities.","MADHYA PRADESH","DHAR","KUKSHI                                            ","2014-12-04 11:25:21.320"
"RABI","AGRICULTURE","Others","Others","	Field Preparation	","Farmer wants to know information about kvk ?","Dr. K.P. Asathi
Programme Coordinator
Krishi Vigyan Kendra
Post Box No. 18
Distt. Dhar - 454001
07292-223351
07292-408370
- 09827523097","MADHYA PRADESH","DHAR","SARDARPUR                                         ","2014-12-04 12:57:08.210"
"RABI","AGRICULTURE","Others","Others","Government Schemes","Agriculture government schemes information?","Recommended for Please contact your RAEO","MADHYA PRADESH","DHAR","SARDARPUR                                         ","2014-12-04 13:17:47.663"
"RABI","HORTICULTURE","Vegetables","Garden Pea","	Plant Protection	","fertilizer and nutrient give for better growth in pea crop?","Recommended Which for Spray N: P: K 19:19:19 100 grams and humic acid 30 ml at 15 liter of water.","MADHYA PRADESH","DHAR","NALCHHA                                           ","2014-12-04 14:40:09.800"
"RABI","AGRICULTURE","Pulses","Bengal Gram (Gram/Chick Pea/Kabuli/Chana)","	Plant Protection	","how to control of caterpillar in gram crop?","spray indoxacarb (awant) @ 15 ml/pump.","MADHYA PRADESH","DHAR","DHAR                                              ","2014-12-04 14:48:38.853"
"RABI","AGRICULTURE","Others","Others","Weather","Tell me weather information .","Chance of no rain next five days.","MADHYA PRADESH","DHAR","NALCHHA                                           ","2014-12-04 14:54:40.650"
"RABI","HORTICULTURE","Vegetables","Pea (Vegetable)","	Plant Protection	","Farmer want to information about how to control of sucking pest in pea crop?","Spray Dimethoate 30% EC (Rogar) or Triazophos 40% EC @ 40 ml per pump.","MADHYA PRADESH","DHAR","BADNAWAR                                          ","2014-12-04 15:10:21.600"
"RABI","HORTICULTURE","Condiments and Spices","Garlic","	Plant Protection	","Farmer want to information about how to control of sucking pest in garlic crop?","Spray imidaclorprid 17.8%SL 5 to 6 ml per pump.","MADHYA PRADESH","DHAR","BADNAWAR                                          ","2014-12-04 19:03:28.527"
"RABI","AGRICULTURE","Cereals","Wheat","	Plant Protection	","farmer want to know information about How to control weeds in wheat crop?","Ans- clodinofop propargyl  15% + metsulfuron methyl 1%wp +(vesta) 160 gram/acre spray","MADHYA PRADESH","DHAR","MANAWAR                                           ","2014-12-04 21:19:55.320"
"RABI","AGRICULTURE","Cereals","Wheat","Nutrient Management","foliar spray in wheat?","spray of water soluble fertilizer NPK 19:19:19 @     100 g   /pump","MADHYA PRADESH","DHAR","DHAR                                              ","2014-12-05 09:54:42.427"
"RABI","HORTICULTURE","Vegetables","Chillies","Seeds and Planting Material","varieties of chilli?","Chilli
 US Agriseeds ( US 611,US 720) VNR Seeds(Ujala,Aditi,Preeti,Indu) Syngenta India Ltd(No. 1900, No.2024, No. 12) Nirmal Seeds Pvt. Ltd.( Maina) Rasi Seeds(Saniya, Shreya)  Bejo Sheetal (Garima,Disha) Namdhari(No. 1701) Indo American(No. 67 ( Greenish black) Mahyco(Tanya,MHCP 321,MHCP 484,Teja 4,Tejaswini)","MADHYA PRADESH","DHAR","DHAR                                              ","2014-12-05 10:03:40.243"
"RABI","AGRICULTURE","Cereals","Wheat","Fertilizer Use and Availability","Fertilizer dose in wheat crop?","Recommended for Urea 210 kg, DAP 130 kg and MOP 67 kg per hac.","MADHYA PRADESH","DHAR","MANAWAR                                           ","2014-12-05 10:05:19.520"
