"Season","Sector","Category","Crop","QueryType","QueryText","KCCAns","StateName","DistrictName","BlockName","CreatedOn"
"RABI","AGRICULTURE","Others","Others","Market Information","farmer want to start rate facility on mobile phone mandi?","your mandi registration complete.","MADHYA PRADESH","WEST NIMAR(KHARGAON)","KHARGONE                                          ","2014-11-17 11:14:52.260"
"RABI","HORTICULTURE","Vegetables","Chillies","	Plant Protection	","Farmer want to know how to control sucking pest of crop ?","Recommended for spray Fipronil 5 % @ 30 ml per 15 litter water .","MADHYA PRADESH","WEST NIMAR(KHARGAON)","KASRAWAD                                          ","2014-11-17 11:44:24.343"
"RABI","AGRICULTURE","Cereals","Wheat","Fertilizer Use and Availability","what is variety of wheat crop ?","variety of wheat crop is jw-1142,jw-366,jw-1201,jw-1418 .","MADHYA PRADESH","WEST NIMAR(KHARGAON)","KHARGONE                                          ","2014-11-17 11:46:29.697"
"RABI","HORTICULTURE","Vegetables","Chillies","	Plant Protection	","How to control of fungal attack in chilli crop?","Recommended for Mancozeb 63% + Carbendazim 12% WP 40 gram and steptrocyclin 2 gram at 15 liter of water.","MADHYA PRADESH","WEST NIMAR(KHARGAON)","BHIKANGAON                                        ","2014-11-17 11:59:43.157"
"RABI","HORTICULTURE","Vegetables","Brinjal","	Plant Protection	","Which fertilizer and nutrient give for better growth in brinjal crop?","Recommended for Spray N: P: K 19:19:19 100 grams and humic acid 30 ml at 15 liter of water.","MADHYA PRADESH","WEST NIMAR(KHARGAON)","BHIKANGAON                                        ","2014-11-17 12:09:37.253"
"RABI","HORTICULTURE","Vegetables","Chillies","	Plant Protection	","How to control of fungal attack in chilli crop?","Recommended for Use copper oxy chloride 45 gram and steptrocyclin 2 gram at 15 liter of water.","MADHYA PRADESH","WEST NIMAR(KHARGAON)","BHIKANGAON                                        ","2014-11-17 12:20:11.437"
"RABI","AGRICULTURE","Cereals","Wheat","	Plant Protection	","weed management in wheat?","Recommended for phalaris miner control in wheat   apply sulfosulfuron (saltop)13.5 gram /acre at 25-35 days after sowing for weed control in wheat","MADHYA PRADESH","WEST NIMAR(KHARGAON)","BHAGVANPURA                                       ","2014-11-17 12:49:26.680"
"RABI","HORTICULTURE","Vegetables","Chillies","	Plant Protection	","How to control leaf curl of chilli ?","Collect and destroy infected virus plants as soon as they are noticed. If it is not possible spray the crop with systemic insecticides. Like Monocrotophos 1.5 ml or Dimethoate 2ml of Acephate 1g per litre of water.","MADHYA PRADESH","WEST NIMAR(KHARGAON)","KHARGONE                                          ","2014-11-17 12:59:49.187"
"RABI","AGRICULTURE","Cereals","Wheat","Seeds","Want to know about Wheat varieties ?","Wheat varieties > Malav Shakti (HI 8498) , GW 322,GW-273, HD 2864, HI 1077, HI-1544, HI-1500, HI-1531, GW-366","MADHYA PRADESH","WEST NIMAR(KHARGAON)","KHARGONE                                          ","2014-11-17 13:19:05.253"
"RABI","AGRICULTURE","Fiber Crops","Cotton (Kapas)","Market Information","market information on cotton crop khargone mandi (14/11/2014).","Minimum Price(Rs./Quintal)=3760 and Maximum Price(Rs./Quintal)=4050.","MADHYA PRADESH","WEST NIMAR(KHARGAON)","KHARGONE                                          ","2014-11-17 13:22:05.800"
"RABI","AGRICULTURE","Cereals","Wheat","	Field Preparation	","farmer want to start of mandi slert sms in mobile ?","Your number has been on the market price of the messaging service.","MADHYA PRADESH","WEST NIMAR(KHARGAON)","BARWAH                                            ","2014-11-17 13:59:10.040"
"RABI","AGRICULTURE","Cereals","Wheat","	Plant Protection	","How to control of fungal attack in wheat  crop ?","Mancozeb 63% + Carbendazim 12% WP 40 gram and steptrocyclin 2 gram at 15 liter of water","MADHYA PRADESH","WEST NIMAR(KHARGAON)","MAHESHWAR                                         ","2014-11-17 14:10:09.090"
"RABI","AGRICULTURE","Cereals","Wheat","Fertilizer Use and Availability","Farmar want to know informarion about   Fertilizer dose in wheat crop?","Recommended for Urea 210 kg, DAP 130 kg and MOP 67 kg per hac.","MADHYA PRADESH","WEST NIMAR(KHARGAON)","BARWAH                                            ","2014-11-17 15:21:08.037"
"RABI","AGRICULTURE","Others","Others","Market Information","farmer want to know information about registration of market information?","recommended for registration of market information you have been registered for market information from kisaan call center.","MADHYA PRADESH","WEST NIMAR(KHARGAON)","ZIRANYA                                           ","2014-11-17 15:23:17.063"
"RABI","HORTICULTURE","Vegetables","Capsicum","	Plant Protection	","how to control sucking pest of capsicum crop ?","Oxydemeton –Methyl 25 % EC @ 1.0 ml/lit","MADHYA PRADESH","WEST NIMAR(KHARGAON)","BHIKANGAON                                        ","2014-11-17 16:20:25.267"
"RABI","AGRICULTURE","Others","Others","Weather","Weather forecast?","chance of NO rainfall next five days .","MADHYA PRADESH","WEST NIMAR(KHARGAON)","KHARGONE                                          ","2014-11-17 16:48:28.660"
"RABI","AGRICULTURE","Others","Others","Weather","Farmer want to know information about weather khargoan  forecasting ?","DISTRICT :  KHARGAON                                                       STATE :  MADHYA-PRADESH   
------------------- ------------------- ------------------- ------------------- ------------------- -------------------
    PARAMETERS                                            ENSEMBLE FCST   
                   ----------------------------------------------------------------------------------------------------
                              DAY-1               DAY-2               DAY-3               DAY-4               DAY-5
                              18/11               19/11               20/11               21/11               22/11
------------------- ------------------- ------------------- ------------------- ------------------- -------------------
Rainfall (mm)                   0                   0                   0                   0                   0
Max Temperature ( deg C)       32                  33                  33                  33                  33
Min Temperature ( deg C)       21                  20                  20                  19                  18
Total cloud cover (octa)        1                   0                   0                   1                   3
Max Relative Humidity (%)      43                  38                  41                  45                  31","MADHYA PRADESH","WEST NIMAR(KHARGAON)","BARWAH                                            ","2014-11-17 16:56:34.567"
"RABI","AGRICULTURE","Others","Others","Weather","What are fertilizer doses in WHEAT crop?","Urea = 210. KG., DAP = 130. Kg., Muriate of potash = 65. Kg. and zinc sulphate 25 kg   Use per hectare.","MADHYA PRADESH","WEST NIMAR(KHARGAON)","SEGAON                                            ","2014-11-17 19:04:05.840"
"RABI","AGRICULTURE","Cereals","Wheat","	Plant Protection	","farmer want to know information about seed treatment of wheat?","recommended for   seed treatment of wheat treat the seed with vitavex 3gm/kg of seed","MADHYA PRADESH","WEST NIMAR(KHARGAON)","BHIKANGAON                                        ","2014-11-17 21:57:51.307"
"RABI","AGRICULTURE","Cereals","Wheat","	Plant Protection	","farmer want to know information about how to control broad & narrow leaf weeds in wheat crop?","spray salfosulfuron 75% WG  @ 13.5 gram/acre.","MADHYA PRADESH","WEST NIMAR(KHARGAON)","BHIKANGAON                                        ","2014-11-18 07:03:21.940"
"RABI","AGRICULTURE","Others","Others","Market Information","farmer want to start rate facility on mobile phone mandi?","your mandi registration complete.","MADHYA PRADESH","WEST NIMAR(KHARGAON)","KASRAWAD                                          ","2014-11-18 07:16:42.843"
"RABI","AGRICULTURE","Cereals","Wheat","Varieties","variety of wheat?","Irrigated Late sown- Lok-1, GW 173, DL 788-2 (vidisha), HI 1454 (Abha), MP 4010, HI 1418 (Naveen Chandusi), HD 2402, HD 2932 (Pust wheat-111)","MADHYA PRADESH","WEST NIMAR(KHARGAON)","KASRAWAD                                          ","2014-11-18 07:29:35.513"
"RABI","AGRICULTURE","Millets","Maize (Makka)","Seeds","Varieties of maize crop?","NK-6240,baioseed-9681","MADHYA PRADESH","WEST NIMAR(KHARGAON)","KASRAWAD                                          ","2014-11-18 07:40:41.877"
"RABI","AGRICULTURE","Cereals","Wheat","Nutrient Management","what is fertilizer dose of wheat crop ?","Urea260 ,Super Phosphate 375, Potash 50 kilogram per hectore FOR wheat CROP .","MADHYA PRADESH","WEST NIMAR(KHARGAON)","BHIKANGAON                                        ","2014-11-18 07:46:07.647"
"RABI","AGRICULTURE","Others","Others","Government Schemes","About govt. scheme ?","please contact RAEO/ADO for more information ..","MADHYA PRADESH","WEST NIMAR(KHARGAON)","ZIRANYA                                           ","2014-11-18 08:14:55.337"
"RABI","AGRICULTURE","Pulses","Bengal Gram (Gram/Chick Pea/Kabuli/Chana)","	Plant Protection	","farmer want to know information about How to control of fungal attack in gram crop ?","Use copper oxy chloride  50% w  45 gram and steptrocyclin  90% w/w 2 gram at 15 liter of water","MADHYA PRADESH","WEST NIMAR(KHARGAON)","KHARGONE                                          ","2014-11-18 08:48:22.750"
"RABI","AGRICULTURE","Pulses","Bengal Gram (Gram/Chick Pea/Kabuli/Chana)","	Plant Protection	","Seed treatment in gram wheat  soyabean  crop?","Recommended for Use bavastim 3 gm per kg of seed.","MADHYA PRADESH","WEST NIMAR(KHARGAON)","BARWAH                                            ","2014-11-18 08:51:20.513"
"RABI","AGRICULTURE","Pulses","Bengal Gram (Gram/Chick Pea/Kabuli/Chana)","Fertilizer Use and Availability","Which fertilizer and nutrient give for better growth in bengal gram  crop?","Spray N: P: K 19:19:19 100 grams  at 15 liter of water.","MADHYA PRADESH","WEST NIMAR(KHARGAON)","KASRAWAD                                          ","2014-11-18 09:35:36.190"
"RABI","AGRICULTURE","Cereals","Wheat","Fertilizer Use and Availability","Farmer want to know information about fertilizer doses in wheat ?","Wheat-Urea-100kg,DAP-50kg,MOP-25kg/acre","MADHYA PRADESH","WEST NIMAR(KHARGAON)","KASRAWAD                                          ","2014-11-18 09:45:44.720"
"RABI","AGRICULTURE","Others","Others","Government Schemes","Q:-Farmer Want To Start The Sms Advisory Facility For Mandi Rate And Different Crops ?","The Sms Advaisory Fasility For Mandi Rate And Different Crops Will Be Start As Soon As Possible.","MADHYA PRADESH","WEST NIMAR(KHARGAON)","GOGAWAN                                           ","2014-11-18 09:55:14.797"
"RABI","AGRICULTURE","Pulses","Bengal Gram (Gram/Chick Pea/Kabuli/Chana)","	Plant Protection	","how to control defoliators in Chickpea?","Spray the solution of Quinalphose 25EC @ 1ml/lit or Indoxacarb 14.5 % SC @ 13- 15ml /pump or Trizophos 30ml/pump or cholrofinexypyr @ 1ml/lit or Emamectin benzoate 5 % SG ( M One) @ 7gm/ pump.","MADHYA PRADESH","WEST NIMAR(KHARGAON)","KASRAWAD                                          ","2014-11-18 10:28:24.950"
"RABI","AGRICULTURE","Cereals","Wheat","Nutrient Management","Fertilizer dose in wheat crop?","Urea 175 kg, DAP 109 kg and MOP 50 kg per hac.","MADHYA PRADESH","WEST NIMAR(KHARGAON)","SEGAON                                            ","2014-11-18 10:36:07.623"
"RABI","HORTICULTURE","Flowers","Marigold","Seeds and Planting Material","Farmers wants to know about sowing time marigold flower?","The marigold flower seeds are sown throughout the year","MADHYA PRADESH","WEST NIMAR(KHARGAON)","SEGAON                                            ","2014-11-18 10:52:17.077"
"RABI","HORTICULTURE","Flowers","Marigold","Seeds and Planting Material","Farmers wants to know about sowing time marigold flower?","The marigold flower seeds are sown throughout the year","MADHYA PRADESH","WEST NIMAR(KHARGAON)","SEGAON                                            ","2014-11-18 10:52:19.217"
"RABI","HORTICULTURE","Condiments and Spices","Garlic","	Plant Protection	","what is the fertilizer dose of garlic ?","During last ploughing incorporate 50 t/ha of FYM; Apply Azospirillum 2 kg and Phosphobacteria 2 kg/ha, 40:75:75 kg/ha NPK(16okg DAP, 125kgMOP), 50 MgSO4 and 1 ton neem cake as basal and N 35 kg/ha at 45 days after planting.","MADHYA PRADESH","WEST NIMAR(KHARGAON)","MAHESHWAR                                         ","2014-11-18 11:26:30.043"
"RABI","AGRICULTURE","Cereals","Wheat","Nutrient Management","Fertilizer dose in wheat crop?","Urea 210 kg, DAP 130 kg and MOP 67 kg per hac.","MADHYA PRADESH","WEST NIMAR(KHARGAON)","BARWAH                                            ","2014-11-18 12:00:44.643"
"RABI","AGRICULTURE","Cereals","Wheat","	Plant Protection	","Farmer wants to know about how to control weeds in wheat crops?","Recommended for Sulfosulfuron 75% + Metsulfuran Methyl 5% WG 16 gram per acer after 30 to 35 days of sowing.","MADHYA PRADESH","WEST NIMAR(KHARGAON)","MAHESHWAR                                         ","2014-11-18 12:10:32.757"
"RABI","AGRICULTURE","Cereals","Wheat","	Plant Protection	","Farmer wants to know about how to control weeds in wheat crops?","Recommended for Sulfosulfuron 75% + Metsulfuran Methyl 5% WG 16 gram per acer after 30 to 35 days of sowing.","MADHYA PRADESH","WEST NIMAR(KHARGAON)","MAHESHWAR                                         ","2014-11-18 12:10:56.867"
"RABI","AGRICULTURE","Pulses","Bengal Gram (Gram/Chick Pea/Kabuli/Chana)","	Plant Protection	","Wilt disease in gram ?","spray validamicin @ 20 gm/pump","MADHYA PRADESH","WEST NIMAR(KHARGAON)","KHARGONE                                          ","2014-11-18 12:38:38.793"
"RABI","HORTICULTURE","Vegetables","Chillies","	Plant Protection	","farmer want to know information about How to control aphid in chillie crop?","Spray of imidaclorprid 17.8%SL 5 to 6 ml per pump.","MADHYA PRADESH","WEST NIMAR(KHARGAON)","MAHESHWAR                                         ","2014-11-18 12:40:54.880"
"RABI","HORTICULTURE","Vegetables","Chillies","	Plant Protection	","control of Sucking pest  in chilli  ?","Spraying of   Dimethoate (Rogar) @ 30 ml/pump","MADHYA PRADESH","WEST NIMAR(KHARGAON)","MAHESHWAR                                         ","2014-11-18 12:47:40.470"
"RABI","AGRICULTURE","Cereals","Wheat","	Plant Protection	","Farmer wants to know about how to control weeds in wheat crops?","Recommended for Sulfosulfuron 75% + Metsulfuran Methyl 5% WG 16 gram per acer after 30 to 35 days of sowing.","MADHYA PRADESH","WEST NIMAR(KHARGAON)","MAHESHWAR                                         ","2014-11-18 13:01:28.423"
"RABI","AGRICULTURE","Others","Others","Government Schemes","Farmer wants to start mandi rate facility on mobile phone?","Your mandi rate facility registration has been successfully registered at kishan call center.","MADHYA PRADESH","WEST NIMAR(KHARGAON)","KASRAWAD                                          ","2014-11-18 13:10:03.073"
"RABI","AGRICULTURE","Others","Others","Government Schemes","Farmer wants to start mandi rate facility on mobile phone?","Your mandi rate facility registration has been successfully registered at kishan call center.","MADHYA PRADESH","WEST NIMAR(KHARGAON)","KASRAWAD                                          ","2014-11-18 13:10:23.167"
"RABI","AGRICULTURE","Cereals","Wheat","Nutrient Management","Fertilizer dose in wheat crop?","Urea 210 kg, DAP 130 kg and MOP 67 kg per hac.","MADHYA PRADESH","WEST NIMAR(KHARGAON)","BHIKANGAON                                        ","2014-11-18 13:28:59.150"
"RABI","HORTICULTURE","Vegetables","Capsicum","	Plant Protection	","what i do for good growth of capsium crop ?","spray n p k 0:52:34  50-100 gm prati pump","MADHYA PRADESH","WEST NIMAR(KHARGAON)","MAHESHWAR                                         ","2014-11-18 13:36:44.820"
"RABI","HORTICULTURE","Vegetables","Bhindi(Okra/Ladysfinger)","Fertilizer Use and Availability","Fertilizers spray on  crop ?","Urea dosage @ 100 gm./pump..","MADHYA PRADESH","WEST NIMAR(KHARGAON)","KHARGONE                                          ","2014-11-18 13:39:44.657"
"RABI","AGRICULTURE","Oilseeds","Mustard","Varieties","Varieties of mustard crop?","Recommended for Pusa bold, varuna, kranti, rohini, Jawahar sarso-2, Pusa jai kishan are mustard varities.","MADHYA PRADESH","WEST NIMAR(KHARGAON)","BARWAH                                            ","2014-11-18 13:54:06.767"
"RABI","AGRICULTURE","Oilseeds","Soybean (bhat)","Market Information","farmer want to know information about soyabean market information ?","Soyabean		Tonnes		Other	FAQ	2671	3431	3051","MADHYA PRADESH","WEST NIMAR(KHARGAON)","KHARGONE                                          ","2014-11-18 15:05:37.520"
"RABI","AGRICULTURE","Pulses","Bengal Gram (Gram/Chick Pea/Kabuli/Chana)","	Plant Protection	","Varieties of Bengal gram crop?","Chickpea (Desi) (13)	JG-11, JG-14, JG-16, JG-63, JG-74, JG-130, JG-315, JG-322, JG-12,
 JAKI-92-18, Vijay, Vishal,","MADHYA PRADESH","WEST NIMAR(KHARGAON)","MAHESHWAR                                         ","2014-11-18 15:52:01.440"
"RABI","AGRICULTURE","Cereals","Wheat","	Field Preparation	","farmer want to know information about varieties of Wheat crop?","Irrigated within time - Lok-1, MP 1142, HI 1077 (Mangala), DL803-3 (kanchan), GW 190, GW 273, GW 322, MP 1142, GW 366, HI 8381 (Malavshree), HI 8498 (Malav shakti).","MADHYA PRADESH","WEST NIMAR(KHARGAON)","ZIRANYA                                           ","2014-11-18 16:31:28.057"
"RABI","HORTICULTURE","Fruits","Musk Melon","Cultural Practices","Farmer want to know  information about  variety of musk melon ?","Varieties: Pusa Sharbati, Hara Madhu, Durgapura Madhu, Arka Rajhans and Arka Jeet.","MADHYA PRADESH","WEST NIMAR(KHARGAON)","MAHESHWAR                                         ","2014-11-18 16:43:16.103"
"RABI","HORTICULTURE","Vegetables","Potato","	Plant Protection	","Fertilizer dose in potato crop?","Recommended for Urea 176 kg, DAP 217 kg and MOP 167 kg per hac.","MADHYA PRADESH","WEST NIMAR(KHARGAON)","KHARGONE                                          ","2014-11-18 21:27:23.150"
"RABI","AGRICULTURE","Others","Others","Market Information","farmer  want to know information about mandi price  has activate ?","in  your mobile mandi price  has activated within some time  start  on your mobile.","MADHYA PRADESH","WEST NIMAR(KHARGAON)","ZIRANYA                                           ","2014-11-18 21:33:36.140"
"RABI","HORTICULTURE","Vegetables","Chillies","	Plant Protection	","farmer want to know information about How to control thrip in chilly crop   ?","Ans. – sprey of  fipronil 5 % sc 250ml. per acre.","MADHYA PRADESH","WEST NIMAR(KHARGAON)","BHIKANGAON                                        ","2014-11-19 07:19:28.360"
"RABI","HORTICULTURE","Vegetables","Tomato","	Plant Protection	","farmer want to know information about how to control white fly in tomato?","recommended for to control sucking pest in  crop spray imedachlorprid 5-7 ml at 15 liter of water.","MADHYA PRADESH","WEST NIMAR(KHARGAON)","KASRAWAD                                          ","2014-11-19 08:27:44.640"
"RABI","AGRICULTURE","Cereals","Wheat","	Plant Protection	","farmer want to know information about  Fertilizer dose in wheat crop ?","Urea 175 kg, DAP 109 kg and MOP 50 kg per hac","MADHYA PRADESH","WEST NIMAR(KHARGAON)","SEGAON                                            ","2014-11-19 10:11:32.863"
"RABI","HORTICULTURE","Vegetables","Chillies","	Plant Protection	","farmer want to know information about how to control sucking pest in  chillies crop?","recommended for to control sucking pest  Spray any one of the following insecticides in the initial stage of infestation 
•	dimethoate 30 EC 500 ml/ha 
•	methyl demeton 25 EC@ 500 ml/ha.","MADHYA PRADESH","WEST NIMAR(KHARGAON)","BARWAH                                            ","2014-11-19 10:30:43.260"
"RABI","AGRICULTURE","Cereals","Wheat","	Plant Protection	","Farmer want to know information about for better growth ?","Boron  40gm at 15 liter water per plant","MADHYA PRADESH","WEST NIMAR(KHARGAON)","GOGAWAN                                           ","2014-11-19 10:39:11.997"
"RABI","HORTICULTURE","Vegetables","Bitter Gourd","Vegetative Propagation and Tissue Culture","what is variety of bitter gourd crop ?","variety of bitter gourd crop is 
Nunhems India Ltd.	Aman, Chaman
VNR	Sagar
Bioseed	Chuchu,Pallavi,Preeti
Seminis	Abhishek
Mahyco	Ventura","MADHYA PRADESH","WEST NIMAR(KHARGAON)","KASRAWAD                                          ","2014-11-19 11:13:54.780"
"RABI","HORTICULTURE","Vegetables","Chillies","	Plant Protection	","How to control white fly in chilies crop?","Recommended for Spray Dimethoate 30%EC (Rogar) 40 ml per pump.","MADHYA PRADESH","WEST NIMAR(KHARGAON)","KASRAWAD                                          ","2014-11-19 11:54:28.103"
"RABI","AGRICULTURE","Others","Others","Market Information","farmer want to know information about registration of market information?","recommended for registration of market information you have been registered for market information from kisaan call center.","MADHYA PRADESH","WEST NIMAR(KHARGAON)","BHIKANGAON                                        ","2014-11-19 13:38:01.967"
"RABI","AGRICULTURE","Cereals","Wheat","	Plant Protection	","FARMER WANT TO HOW KNOW TO CONTROL FUNGAL INFECTION IN WHEAT CROP ?","Recommended for spray  Mencozeb + Carbindazim (Saaf or  sixer)@ 30 g /pump .","MADHYA PRADESH","WEST NIMAR(KHARGAON)","BARWAH                                            ","2014-11-19 14:48:35.843"
"RABI","AGRICULTURE","Cereals","Wheat","Nutrient Management","Which fertilizer and nutrient give for better growth in WHEAT crop?","Recommended for spray foliar application of IFFCO 19:19:19 water soluble fertilizer @ 100 gm/pump.","MADHYA PRADESH","WEST NIMAR(KHARGAON)","BARWAH                                            ","2014-11-19 14:50:30.913"
"RABI","AGRICULTURE","Cereals","Wheat","Varieties","Farmer want to Varieties of Wheat crop?","Irrigated within time – poshak, HI-8713,HI-1544,HI 8498 (Malav shakti) , HI 8381 (Malavshree),  HI 1077 (Mangala), DL803-3 (kanchan), HI -8713(kathiya gehu) GW 190, GW 273, GW 322, MP 1142, GW 366, Lok-1, MP 1142.","MADHYA PRADESH","WEST NIMAR(KHARGAON)","ZIRANYA                                           ","2014-11-19 15:09:35.037"
"RABI","AGRICULTURE","Pulses","Bengal Gram (Gram/Chick Pea/Kabuli/Chana)","	Plant Protection	","farmer want to know information about How to control of fungal attack in gram crop ?","spray mencozeb + carbendazim 45 gram and steptrocyclin 2 gram at 15 liter of water","MADHYA PRADESH","WEST NIMAR(KHARGAON)","KHARGONE                                          ","2014-11-19 16:01:00.980"
"RABI","AGRICULTURE","Others","Others","Weather","Farmer wants to know information about weather?","----------------------------------------------------------------------------------------------------
                              DAY-1               DAY-2               DAY-3               DAY-4               DAY-5
                              20/11               21/11               22/11               23/11               24/11
------------------- ------------------- ------------------- ------------------- ------------------- -------------------
Rainfall (mm)                   0                   0                   0                   0                   0","MADHYA PRADESH","WEST NIMAR(KHARGAON)","KASRAWAD                                          ","2014-11-19 16:22:12.973"
"RABI","AGRICULTURE","Others","Others","Market Information","Farmer wants to start mandi rate facility on mobile phone?","Mandi rate facility has been successfully activated on your mobile phone.","MADHYA PRADESH","WEST NIMAR(KHARGAON)","BHIKANGAON                                        ","2014-11-19 17:18:52.870"
"RABI","HORTICULTURE","Vegetables","Chillies","	Plant Protection	","Farmer want to know how to control sucking pest of crop ?","Recommended for spray Fipronil 5 % @ 30 ml per 15 litter water .","MADHYA PRADESH","WEST NIMAR(KHARGAON)","BARWAH                                            ","2014-11-19 17:21:39.500"
"RABI","AGRICULTURE","Others","Others","Government Schemes","farmer want to know information about registration of market information?","recommended for registration of market information you have been registered for market information from kisaan call center.","MADHYA PRADESH","WEST NIMAR(KHARGAON)","BARWAH                                            ","2014-11-19 19:50:44.560"
"RABI","HORTICULTURE","Vegetables","Brinjal","	Plant Protection	","how to control Shoot and fruit borer in brinjal  ?","spray Chlorpyrifos 20 % EC@ 1ml/litre of water	to control Shoot and fruit borer in brinjal  .","MADHYA PRADESH","WEST NIMAR(KHARGAON)","BARWAH                                            ","2014-11-19 21:36:48.387"
"RABI","HORTICULTURE","Vegetables","Brinjal","	Plant Protection	","how to control Shoot and fruit borer in brinjal  ?","spray Chlorpyrifos 20 % EC@ 1ml/litre of water	to control Shoot and fruit borer in brinjal  .","MADHYA PRADESH","WEST NIMAR(KHARGAON)","BARWAH                                            ","2014-11-19 21:36:48.963"
"RABI","AGRICULTURE","Others","Others","Market Information","I want number resister in mandi rate ?","your number has been UPDATE registered for mandi rate","MADHYA PRADESH","WEST NIMAR(KHARGAON)","MAHESHWAR                                         ","2014-11-20 07:48:43.997"
