"Season","Sector","Category","Crop","QueryType","QueryText","KCCAns","StateName","DistrictName","BlockName","CreatedOn"
"RABI","AGRICULTURE","Others","Others","Market Information","I want number resister in mandi rate ?","your number has been UPDATE registered for mandi rate .","MADHYA PRADESH","WEST NIMAR(KHARGAON)","BHAGVANPURA                                       ","2014-11-08 16:27:28.993"
"RABI","AGRICULTURE","Others","Others","	Plant Protection	","how to leaf curl control in chilli crop ?","fipronil 30 ml at 15 liter of water .","MADHYA PRADESH","WEST NIMAR(KHARGAON)","BARWAH                                            ","2014-11-08 17:23:08.420"
"RABI","HORTICULTURE","Vegetables","Chillies","	Plant Protection	","Q:-How Can We Control Thrips In Chillies ?","You Can Spray Rogor Or Clorpirifos @  30-35ml/Pump, Or Imedacloropid 5-7ml/Pump, Npk 19-19-19 Or 0.52.34 @ 100g/Pump To  Control Thrips In Chillies Crop.","MADHYA PRADESH","WEST NIMAR(KHARGAON)","KASRAWAD                                          ","2014-11-09 07:15:46.570"
"RABI","HORTICULTURE","Vegetables","Chillies","	Plant Protection	","Farmer want to know information about control of fungal attack in chilies ?","Metalaxil + Mencozeb 250-300gm/acre or 25-30gm/pump","MADHYA PRADESH","WEST NIMAR(KHARGAON)","BARWAH                                            ","2014-11-09 07:19:39.070"
"RABI","HORTICULTURE","Vegetables","Chillies","	Plant Protection	","Q:-How Can We Control Thrips In Chillies ?","You Can Spray Rogor Or Clorpirifos @  30-35ml/Pump, Or Imedacloropid 5-7ml/Pump, Npk 19-19-19 Or 0.52.34 @ 100g/Pump To  Control Thrips In Chillies Crop.","MADHYA PRADESH","WEST NIMAR(KHARGAON)","BARWAH                                            ","2014-11-09 07:27:49.497"
"RABI","AGRICULTURE","Cereals","Wheat","Fertilizer Use and Availability","On which amount of Ferizers use in Wheat ?","Fertilizers > FYM @ 15-18 tons/ha. ,  3 Bags SSP , 1 Bag DAP, Potash- 20-25 kg, /acre Bassel application and  Afetr 15-21 days broadcasting of 35-40 kg. Urea / acre and next after 45 days broadcasting of Urea 40 kg./acre..","MADHYA PRADESH","WEST NIMAR(KHARGAON)","KHARGONE                                          ","2014-11-09 07:30:39.623"
"RABI","HORTICULTURE","Vegetables","Chillies","	Plant Protection	","Farmer  want to know how to control sucking pest of crop ?","Recommended for spray Fipronil 5 % @ 30 ml per 15 litter water .)","MADHYA PRADESH","WEST NIMAR(KHARGAON)","BARWAH                                            ","2014-11-09 07:37:22.060"
"RABI","HORTICULTURE","Vegetables","Chillies","	Plant Protection	","FARMER WANT TO HOW KNOW TO CONTROL FUNGAL INFECTION IN CHILLI CROP ?","Recommended for spray Metalaxyl + Mencozeb @ 30 g/pump.","MADHYA PRADESH","WEST NIMAR(KHARGAON)","KHARGONE                                          ","2014-11-09 07:40:30.807"
"RABI","HORTICULTURE","Vegetables","Chillies","	Plant Protection	","How we control Chilli mosaic ?","Recommendations given for aphids may be adopted for controlling the vector. spray of Dimethoate (Roagr) @ 30 ML./pump.","MADHYA PRADESH","WEST NIMAR(KHARGAON)","KHARGONE                                          ","2014-11-09 07:52:13.210"
"RABI","HORTICULTURE","Vegetables","Potato","Cultural Practices","spacing of potato?","Plant the tubers at 20 cm apart.","MADHYA PRADESH","WEST NIMAR(KHARGAON)","KHARGONE                                          ","2014-11-09 07:57:12.180"
"RABI","AGRICULTURE","Others","Others","Weather","Farmer want to know information about  weather forecast ?","09/11               10/11               11/11               12/11               13/11
------------------- ------------------- ------------------- ------------------- ------------------- -------------------
Rainfall (mm)                   0                   0                   0                   0                   0","MADHYA PRADESH","WEST NIMAR(KHARGAON)","BARWAH                                            ","2014-11-09 08:15:06.643"
"RABI","AGRICULTURE","Cereals","Wheat","Nutrient Management","Fertilizer dose in wheat crop?","Urea 210 kg, DAP 130 kg and MOP 66 kg per hac.","MADHYA PRADESH","WEST NIMAR(KHARGAON)","BARWAH                                            ","2014-11-09 08:18:45.100"
"RABI","HORTICULTURE","Vegetables","Chillies","	Plant Protection	","Farmer want to know information about control of sucking pest ?","Thiomethoxam 7gm + Acetameprid 5gm/pump for better result to control of viral infection","MADHYA PRADESH","WEST NIMAR(KHARGAON)","KHARGONE                                          ","2014-11-09 08:46:12.497"
"RABI","AGRICULTURE","Others","Others","Weather","farmer want to weather information of district?","light rainfall chance in your district and weather will some cloudy at next 5 days","MADHYA PRADESH","WEST NIMAR(KHARGAON)","BARWAH                                            ","2014-11-09 09:08:34.840"
"RABI","AGRICULTURE","Others","Others","Government Schemes","sms ragistration ?","your number is ragistard in kcc","MADHYA PRADESH","WEST NIMAR(KHARGAON)","MAHESHWAR                                         ","2014-11-09 11:25:16.880"
"RABI","AGRICULTURE","Others","Others","Weather","weather information ?","some clouds in yor area","MADHYA PRADESH","WEST NIMAR(KHARGAON)","ZIRANYA                                           ","2014-11-09 12:20:02.737"
"RABI","ANIMAL HUSBANDRY","Animal","POULTRY  FARM ","Livestock Products Processing and Packaging","breeds of poultry?","Aseel (Fighting purpose), Chitlagong, Kadacknath (Resh is black in colour) Bursa","MADHYA PRADESH","WEST NIMAR(KHARGAON)","BARWAH                                            ","2014-11-09 13:35:01.170"
"RABI","AGRICULTURE","Others","Others","Weather","Farmer wants to know information about weather forecast?","Farmer wants to know information about weather forecast?","MADHYA PRADESH","WEST NIMAR(KHARGAON)","KHARGONE                                          ","2014-11-09 14:22:54.057"
"RABI","AGRICULTURE","Others","Others","Weather","Farmer wants to know information about weather forecast?","Farmer wants to know information about weather forecast?","MADHYA PRADESH","WEST NIMAR(KHARGAON)","BHIKANGAON                                        ","2014-11-09 14:28:27.637"
"RABI","AGRICULTURE","Cereals","Wheat","Nutrient Management","Fertilizer dose in wheat crop?","Urea 175 kg, DAP 109 kg and MOP 50 kg per hac.","MADHYA PRADESH","WEST NIMAR(KHARGAON)","BARWAH                                            ","2014-11-09 14:29:29.210"
"RABI","HORTICULTURE","Vegetables","Chillies","	Plant Protection	","how to control leaf curl of chilly crop ?","Recommended for spray Thiamethaxam 70 % WS @ 5 gram per pump .","MADHYA PRADESH","WEST NIMAR(KHARGAON)","BHIKANGAON                                        ","2014-11-09 14:29:31.670"
"RABI","AGRICULTURE","Fiber Crops","Cotton (Kapas)","	Plant Protection	","HOW TO CONTROL FLOWER DROP IN COTTON PLANT ?","RECOMMENDED FOR SPRAY TO 0:52:34 100 GRAM + 20 GRAM BORON PER PUMP","MADHYA PRADESH","WEST NIMAR(KHARGAON)","BARWAH                                            ","2014-11-09 14:35:48.663"
"RABI","AGRICULTURE","Cereals","Wheat","	Plant Protection	","HOW TO CONTROL WEEDS OF WHEAT CROP ?","SPRAY 2-4D 48% 50 ML PER PUMP .","MADHYA PRADESH","WEST NIMAR(KHARGAON)","ZIRANYA                                           ","2014-11-09 15:01:57.377"
"RABI","AGRICULTURE","Others","Others","Market Information","I want to resister my number for mandi rate ?","your number has been registered for mandi rate","MADHYA PRADESH","WEST NIMAR(KHARGAON)","BHIKANGAON                                        ","2014-11-09 15:32:05.023"
"RABI","HORTICULTURE","Vegetables","Chillies","	Plant Protection	","How to control thrips in chillies crop?","Lambda Cyhalothrin 5% EC 25 to 30 ml at per pump.","MADHYA PRADESH","WEST NIMAR(KHARGAON)","BARWAH                                            ","2014-11-09 15:42:05.183"
"KHARIF","HORTICULTURE","Vegetables","Chillies","	Plant Protection	","How to control white fly in chilli crop?","Recommended for Spray imidaclorprid 17.8%SL 5 to 6 ml per pump.","MADHYA PRADESH","WEST NIMAR(KHARGAON)","BHIKANGAON                                        ","2014-11-09 16:15:12.927"
"RABI","AGRICULTURE","Others","Others","Government Schemes","farmer want to know information about complant for electricity ?","recommended for to know information about complant for electricity please contact to cm help line 181","MADHYA PRADESH","WEST NIMAR(KHARGAON)","KHARGONE                                          ","2014-11-09 17:09:38.060"
"RABI","AGRICULTURE","Others","Others","	Plant Protection	","farmer want to leaf curl control in chilli crop ?","fipronil 30 ml or daimetheat 30 ec 35 - 40 ml at 15 liter of water .","MADHYA PRADESH","WEST NIMAR(KHARGAON)","MAHESHWAR                                         ","2014-11-09 19:49:52.347"
"RABI","AGRICULTURE","Others","Others","	Plant Protection	","How to control flower drop problem in chilli crop?","Spray Plano fix 4 to 5 Ml at 15 liter of water.","MADHYA PRADESH","WEST NIMAR(KHARGAON)","MAHESHWAR                                         ","2014-11-09 19:57:11.790"
"RABI","AGRICULTURE","Cereals","Wheat","Varieties","Want to know about Wheat varieties ?","Wheat varieties > Malav Shakti (HI 8498) , GW 322,GW-273, HD 2864, HI 1077, HI-1544, HI-1500, HI-1531, GW-366","MADHYA PRADESH","WEST NIMAR(KHARGAON)","BARWAH                                            ","2014-11-10 07:14:26.240"
"RABI","AGRICULTURE","Others","Others","Weather","Farmer  want to  weather forecasting  information of District khargaon","DAY-1               DAY-2               DAY-3               DAY-4               DAY-5
                              10/11               11/11               12/11               13/11               14/11
------------------- ------------------- ------------------- ------------------- ------------------- -------------------
Rainfall (mm)                   0                   0                   0                   0                   0","MADHYA PRADESH","WEST NIMAR(KHARGAON)","BARWAH                                            ","2014-11-10 08:34:05.230"
"RABI","AGRICULTURE","Cereals","Wheat","Fertilizer Use and Availability","what is fertilizer dose of wheat crop ?","Urea260 ,Super Phosphate 375, Potash 50 kilogram per hectore FOR wheat CROP .","MADHYA PRADESH","WEST NIMAR(KHARGAON)","BHAGVANPURA                                       ","2014-11-10 09:12:36.447"
"RABI","HORTICULTURE","Vegetables","Beet Root (Garden Beet/Stock Beet)","Seeds and Planting Material","farmer want to spacing of beet root ?","r-r x p-p 30x10 cm","MADHYA PRADESH","WEST NIMAR(KHARGAON)","KHARGONE                                          ","2014-11-10 09:34:30.173"
"RABI","AGRICULTURE","Others","Others","Government Schemes","Farmer wants to start mandi rate facility on mobile phone?","Your mandi rate facility registration has been successfully registered at kishan call center.","MADHYA PRADESH","WEST NIMAR(KHARGAON)","BHAGVANPURA                                       ","2014-11-10 10:07:56.343"
"RABI","AGRICULTURE","Others","Others","Government Schemes","Farmer wants to start mandi rate facility on mobile phone?","Your mandi rate facility registration has been successfully registered at kishan call center.","MADHYA PRADESH","WEST NIMAR(KHARGAON)","BHAGVANPURA                                       ","2014-11-10 10:07:57.793"
"RABI","AGRICULTURE","Cereals","Wheat","Varieties","Varieties of Wheat crop?","Irrigated within time - Lok-1, MP 1142, HI 1077 (Mangala), DL803-3 (kanchan), GW 190, GW 273, GW 322, MP 1142, GW 366, HI 8381 (Malavshree), HI 8498 (Malav shakti).","MADHYA PRADESH","WEST NIMAR(KHARGAON)","BHIKANGAON                                        ","2014-11-10 10:09:40.067"
"RABI","HORTICULTURE","Vegetables","Carrot","Seeds and Planting Material","variety of carrot crop.","nentis, pusa meghali, pusa rudhir, pusa ansita, etc.","MADHYA PRADESH","WEST NIMAR(KHARGAON)","BHIKANGAON                                        ","2014-11-10 12:10:20.970"
"RABI","AGRICULTURE","Cereals","Wheat","Seeds","varieties of wheat?","GW-322, GW-273, GW-366, WH-147, JW-1106(D), JW-3288, JW-1215(D), HI 8498, HI-1544(Purna) ,   HI-1418Naveen Chandausi)
HI 8663 (Poshan)","MADHYA PRADESH","WEST NIMAR(KHARGAON)","KHARGONE                                          ","2014-11-10 12:35:07.047"
"KHARIF","HORTICULTURE","Vegetables","Chillies","	Plant Protection	","farmer want to know information about How to control white fly in chilli crop?","Spray of  Dimethoate (Rogar) 30 ml per  16 litre of water  pump.","MADHYA PRADESH","WEST NIMAR(KHARGAON)","BHIKANGAON                                        ","2014-11-10 12:39:01.700"
"RABI","HORTICULTURE","Vegetables","Chillies","	Plant Protection	","How to control white fly in chillies crop?","Spray Dimethoate 30%EC (Rogar) 40 ml per pump.
Spray Daiphenthuran (Pegasas) 10 to 15 gram at per pump.","MADHYA PRADESH","WEST NIMAR(KHARGAON)","KHARGONE                                          ","2014-11-10 12:51:02.000"
"RABI","AGRICULTURE","Others","Others","Government Schemes","Agriculture government schemes information?","Recommended for Please contact your RAEO","MADHYA PRADESH","WEST NIMAR(KHARGAON)","BHIKANGAON                                        ","2014-11-10 15:37:37.620"
"RABI","AGRICULTURE","Cereals","Wheat","Seeds","?	Farmer want to know information Varieties of Wheat crop?","Irrigated within time - Lok-1, MP 1142, HI 1077 (Mangala), DL803-3 (kanchan), GW 190, GW 273, GW 322, MP 1142, GW 366, HI 8381 (Malavshree), HI 8498 (Malav shakti).","MADHYA PRADESH","WEST NIMAR(KHARGAON)","BARWAH                                            ","2014-11-10 16:00:02.413"
"RABI","HORTICULTURE","Vegetables","Chillies","	Plant Protection	","How to control white fly in chilli crop?","Spray Daiphenthuran (Pegasas) 10 to 15 gram at per pump.","MADHYA PRADESH","WEST NIMAR(KHARGAON)","KHARGONE                                          ","2014-11-10 16:50:37.270"
"RABI","AGRICULTURE","Cereals","Wheat","Varieties","farmer want to know information about varieties of Wheat crop?","Unirrigated – sujata, MP 3020,HW 2004 (amar), JWS 17, HI 1500, HI 1531, HI 4672 (Malavratna), HI 8627, HI 7483 (Meghdut)","MADHYA PRADESH","WEST NIMAR(KHARGAON)","SEGAON                                            ","2014-11-10 17:29:00.983"
"RABI","AGRICULTURE","Others","Others","Government Schemes","Farmer want to know information about mandi rate ?","in your mobile mandi rate has started .","MADHYA PRADESH","WEST NIMAR(KHARGAON)","BARWAH                                            ","2014-11-10 18:17:34.057"
"RABI","AGRICULTURE","Cereals","Wheat","Weather","weather information","??? ????
???? ??: +31°
????????: 1009.8 ???????????? 
?????: +20°
???: 53.7%
????????????: 4 ????????
???? ?? 10.11. 05:30 pm
?? ???? ??? Akola
????? ????????, Akola >","MADHYA PRADESH","WEST NIMAR(KHARGAON)","","2014-11-10 18:26:00.317"
"RABI","AGRICULTURE","Others","Others","Government Schemes","farmer want to know information about govt. schemes?","recommended for to know about govt. schemes please contect rural agriculture extension officer ..","MADHYA PRADESH","WEST NIMAR(KHARGAON)","GOGAWAN                                           ","2014-11-10 19:03:26.830"
"RABI","ANIMAL HUSBANDRY","Animal","Bovine(Cow,Buffalo)","Animal Breeding","What nutrition gives to our cattle?","Please contact 18001801199 numbers.","MADHYA PRADESH","WEST NIMAR(KHARGAON)","SEGAON                                            ","2014-11-10 19:35:23.440"
"RABI","AGRICULTURE","Cereals","Wheat","	Plant Protection	","farmer want to know information about varieties of Wheat crop?","Irrigated within time - Lok-1, MP 1142, HI 1077 (Mangala), DL803-3 (kanchan), GW 190, GW 273, GW 322, MP 1142, GW 366, HI 8381 (Malavshree), HI 8498 (Malav shakti).","MADHYA PRADESH","WEST NIMAR(KHARGAON)","MAHESHWAR                                         ","2014-11-10 21:21:39.617"
"RABI","AGRICULTURE","Cereals","Wheat","	Plant Protection	","farmer want to know information about  Fertilizer dose in wheat crop ?","Urea 210 kg, DAP 130 kg and MOP 67 kg per hac.","MADHYA PRADESH","WEST NIMAR(KHARGAON)","MAHESHWAR                                         ","2014-11-10 21:27:20.190"
"RABI","AGRICULTURE","Others","Others","Weather","Farmer  want to  weather forecasting  information of District khargone","Cloudy weather in next 5 days","MADHYA PRADESH","WEST NIMAR(KHARGAON)","ZIRANYA                                           ","2014-11-11 06:58:42.620"
"RABI","AGRICULTURE","Cereals","Wheat","	Field Preparation	","farmer want to know information about varieties of Wheat crop?","Irrigated within time - Lok-1, MP 1142, HI 1077 (Mangala), DL803-3 (kanchan), GW 190, GW 273, GW 322, MP 1142, GW 366, HI 8381 (Malavshree), HI 8498 (Malav shakti).","MADHYA PRADESH","WEST NIMAR(KHARGAON)","ZIRANYA                                           ","2014-11-11 07:04:04.423"
"RABI","HORTICULTURE","Condiments and Spices","Garlic","	Plant Protection	","weed management in garlic?","oxyflorofen (Gol)@100 ml /acre+ Quizalofop ethyl ( Terga super) @ 300 ml /acre","MADHYA PRADESH","WEST NIMAR(KHARGAON)","BARWAH                                            ","2014-11-11 07:26:16.853"
"RABI","AGRICULTURE","Pulses","Bengal Gram (Gram/Chick Pea/Kabuli/Chana)","	Plant Protection	","plant protection in chickpea?","Quinalphos 25 EC 30 g/pump + Neem oil 45ml/pump","MADHYA PRADESH","WEST NIMAR(KHARGAON)","BARWAH                                            ","2014-11-11 07:30:55.930"
"RABI","AGRICULTURE","Cereals","Wheat","	Plant Protection	","how to control termite of wheat crop ?","Chlorpyriphos 20%ec 1000 ml per acre apply mix with sand .","MADHYA PRADESH","WEST NIMAR(KHARGAON)","KASRAWAD                                          ","2014-11-11 07:52:32.570"
"RABI","HORTICULTURE","Vegetables","Chillies","	Plant Protection	","Q:-How Can We Control Thrips In Chillies ?","You Can Spray Rogor Or Clorpirifos @  30-35ml/Pump, Or pegasas 10-12 gram/Pump, Npk 19-19-19 Or 0.52.34 @ 100g/Pump To  Control Thrips In Chillies Crop.","MADHYA PRADESH","WEST NIMAR(KHARGAON)","KASRAWAD                                          ","2014-11-11 11:09:12.400"
"RABI","AGRICULTURE","Cereals","Wheat","	Water Management	","Water management in Wheat ?","In wheat 5-6 irrigation (12-15 days interval) require for good production.
1 st irrigation 15-20 days crown root stage.
2 nd irrigation 40-45 days pre flowering.
3 rd irrigation 60-65 days milking stage.","MADHYA PRADESH","WEST NIMAR(KHARGAON)","KHARGONE                                          ","2014-11-11 11:56:36.603"
"RABI","AGRICULTURE","Cereals","Wheat","Fertilizer Use and Availability","what is the fertilizer dose of wheat ?","Basal dose of fertilizer is 40kg DAP, 20kg Urea , 25kg MOP/acer. Apply remaining half dose of N at crown root initiation stage (15- 20 DAS) by top dressing of Urea @ 35kg/acer.","MADHYA PRADESH","WEST NIMAR(KHARGAON)","MAHESHWAR                                         ","2014-11-11 13:49:58.380"
"RABI","AGRICULTURE","Others","Others","Weather","Farmer want to know about weather forecasting for khargone district of Madhya Pradesh?","rainfall within 5 days in your district","MADHYA PRADESH","WEST NIMAR(KHARGAON)","BHIKANGAON                                        ","2014-11-11 13:50:51.050"
"KHARIF","AGRICULTURE","Cereals","Paddy (Dhan)","Weather","weather information ?","DAY-1               DAY-2               DAY-3               DAY-4               DAY-5
                              12/11               13/11               14/11               15/11               16/11
------------------- ------------------- ------------------- ------------------- ------------------- -------------------
Rainfall (mm)                   0                   0                   0                   3                   4","MADHYA PRADESH","WEST NIMAR(KHARGAON)","BHIKANGAON                                        ","2014-11-11 13:59:56.483"
"RABI","HORTICULTURE","Vegetables","Chillies","Market Information","farmer want to Damnod mandi rate of chilli crop?","Madhya Pradesh  
Dhamnod   31.25     Other   2000   8800   4900","MADHYA PRADESH","WEST NIMAR(KHARGAON)","KASRAWAD                                          ","2014-11-11 15:15:10.750"
"RABI","AGRICULTURE","Fiber Crops","Cotton (Kapas)","Market Information","farmer went to mandi rate for cotton ?","cotton mandi rate minimum 3885 Rs. maximum 4212 Rs .","MADHYA PRADESH","WEST NIMAR(KHARGAON)","BHIKANGAON                                        ","2014-11-11 15:18:54.583"
"RABI","HORTICULTURE","Vegetables","Capsicum","	Plant Protection	","how to control white fly in chilli?","how to control trips  in garlic?","MADHYA PRADESH","WEST NIMAR(KHARGAON)","BARWAH                                            ","2014-11-11 16:05:22.227"
"RABI","HORTICULTURE","Vegetables","Chillies","	Plant Protection	","How to control  in CHILLIES crop?.","Lambda Cyhalothrin 5% EC 16 to 20 ml per pump spray","MADHYA PRADESH","WEST NIMAR(KHARGAON)","KASRAWAD                                          ","2014-11-11 16:41:28.147"
"RABI","HORTICULTURE","Vegetables","Chillies","	Plant Protection	","How to control thrips in CHILLIES crop?.","Lambda Cyhalothrin 5% EC 16 to 20 ml per pump spray","MADHYA PRADESH","WEST NIMAR(KHARGAON)","KASRAWAD                                          ","2014-11-11 16:43:20.237"
"RABI","AGRICULTURE","Others","Others","Weather","Farmer want to know information about  weather forecast  ?","YOUR DISTRIC THIS DATE RAINFALL 11 TO 13 AND 15TO 17","MADHYA PRADESH","WEST NIMAR(KHARGAON)","KASRAWAD                                          ","2014-11-11 16:54:15.173"
"RABI","AGRICULTURE","Cereals","Wheat","	Plant Protection	","farmer want to know information about how to control broad & narrow leaf weeds in wheat crop?","spray salfosulfuron 75% WG  @ 13.5 gram/acre.","MADHYA PRADESH","WEST NIMAR(KHARGAON)","ZIRANYA                                           ","2014-11-11 18:23:10.720"
"RABI","HORTICULTURE","Vegetables","Cluster Bean","Market Information","Farmer want  to know information about  market price of  ckuster bean ?","Beans
Neemuch	15	Tonnes	Other	6200	7000	6600	Rs/Quintal","MADHYA PRADESH","WEST NIMAR(KHARGAON)","KHARGONE                                          ","2014-11-11 19:11:04.570"
"RABI","AGRICULTURE","Cereals","Wheat","Varieties","farmer want to know information about varieties of irrigated wheat?","M.P. 1142, H.I. 1077, G.W. 273, G.W. 322, G. W. 190
Raj 1555, H.D. 4530, H.I. 8498, H.I 8381, J.W. 1106, Sudha .","MADHYA PRADESH","WEST NIMAR(KHARGAON)","BHIKANGAON                                        ","2014-11-11 19:30:43.937"
"RABI","AGRICULTURE","Others","Others","Weather","Farmer wants to know information about  weather  forecast ?","DAY-1               DAY-2               DAY-3               DAY-4               DAY-5
                              12/11               13/11               14/11               15/11               16/11
------------------- ------------------- ------------------- ------------------- ------------------- -------------------
Rainfall (mm)                   0                   0                   0                   0                   0","MADHYA PRADESH","WEST NIMAR(KHARGAON)","BARWAH                                            ","2014-11-11 19:45:48.650"
"RABI","AGRICULTURE","Pulses","Bengal Gram (Gram/Chick Pea/Kabuli/Chana)","	Plant Protection	","How to control caterpillars in gram crop?","Recommended for Spray of Monocrotophos 36 s. L. 800 ml. / hac.","MADHYA PRADESH","WEST NIMAR(KHARGAON)","SEGAON                                            ","2014-11-12 08:47:19.487"
"RABI","HORTICULTURE","Vegetables","Chillies","	Plant Protection	","What Can I Do To Control In Flower Drop In Chillies ?","You Can Spray Planofix 5ml/Pump To Control Flower Drop In Chillies","MADHYA PRADESH","WEST NIMAR(KHARGAON)","KHARGONE                                          ","2014-11-12 09:54:14.603"
"RABI","ANIMAL HUSBANDRY","Animal","Bovine(Cow,Buffalo)","Animal Breeding","What nutrition gives to our cattle?","Please contact 18001801199 numbers.","MADHYA PRADESH","WEST NIMAR(KHARGAON)","KHARGONE                                          ","2014-11-12 11:11:34.567"
"RABI","AGRICULTURE","Others","Others","Market Information","Farmer wants to start mandi rate facility on mobile phone?","Mandi rate facility has been successfully activated on your mobile phone.","MADHYA PRADESH","WEST NIMAR(KHARGAON)","KHARGONE                                          ","2014-11-12 13:13:52.110"
"RABI","AGRICULTURE","Pulses","Bengal Gram (Gram/Chick Pea/Kabuli/Chana)","	Plant Protection	","FARMER WANT TO HOW KNOW TO CONTROL FUNGAL INFECTION IN CHILLI CROP ?","Recommended for spray  Tricoderma  viride 2.5 kg/ha mix in 50 kg FYM/acre , sprinkered with water and cover with polythein and apply after 2 days when proper moisture in field","MADHYA PRADESH","WEST NIMAR(KHARGAON)","BARWAH                                            ","2014-11-12 15:05:14.107"
"RABI","AGRICULTURE","Others","Others","Market Information","farmer want to know information about registration of market information?","recommended for registration of market information you have been registered for market information from kisaan call center","MADHYA PRADESH","WEST NIMAR(KHARGAON)","KHARGONE                                          ","2014-11-12 15:06:30.523"
"RABI","AGRICULTURE","Others","Others","Market Information","farmer  want to know information about mandi price  has activate ?","in  your mobile mandi price  has activated within some time  start  on your mobile.","MADHYA PRADESH","WEST NIMAR(KHARGAON)","MAHESHWAR                                         ","2014-11-12 16:11:41.297"
"RABI","AGRICULTURE","Cereals","Wheat","	Plant Protection	","How to control weeds in WHEAT crop?","Sulfosulfuron 75% WG
13.5 gm/acre","MADHYA PRADESH","WEST NIMAR(KHARGAON)","KASRAWAD                                          ","2014-11-12 19:47:43.407"
