"Season","Sector","Category","Crop","QueryType","QueryText","KCCAns","StateName","DistrictName","BlockName","CreatedOn"
"RABI","AGRICULTURE","Others","Others","Market Information","Farmer  want number activate in sms facility ?","your number is resistard in sms facility of mandi rate .","MADHYA PRADESH","WEST NIMAR(KHARGAON)","GOGAWAN                                           ","2014-11-22 18:57:57.577"
"RABI","HORTICULTURE","Vegetables","Brinjal","	Plant Protection	","To know about the control of fruit borer in brinjal ?","spray any one of the following insecticide Indoxacarb 14.5 % SC  6.5 ml/10 lit., Novaluron 10 % EC 7.5 ml/10 lit. Spinosad 45 % SC 3.2 ml/10 lit., Thiodicarb 75 % WP 2.","MADHYA PRADESH","WEST NIMAR(KHARGAON)","KHARGONE                                          ","2014-11-22 20:48:52.533"
"RABI","HORTICULTURE","Vegetables","Chillies","	Plant Protection	","fertilizers dose of chillies crop ?","fertilizers dose of chillies crop -npk, 12-32-16,100kg/acre + 80kg/acre urea","MADHYA PRADESH","WEST NIMAR(KHARGAON)","KASRAWAD                                          ","2014-11-22 21:26:34.473"
"RABI","AGRICULTURE","Cereals","Wheat","Weather","farmer want to know information about seed treatment of wheat?","recommended for   seed treatment of wheat treat the seed with vitavex 3gm/kg of seed","MADHYA PRADESH","WEST NIMAR(KHARGAON)","KASRAWAD                                          ","2014-11-23 08:42:17.527"
"RABI","AGRICULTURE","Cereals","Wheat","	Plant Protection	","Which fertilizer and nutrient give for better growth in wheat crop?","Recommended for spray foliar application of IFFCO 19:19:19 water soluble fertilizer @ 100 gm/pump.","MADHYA PRADESH","WEST NIMAR(KHARGAON)","GOGAWAN                                           ","2014-11-23 09:08:30.733"
"RABI","AGRICULTURE","Cereals","Wheat","Seeds","Farmer want to know about Varieties of Wheat crop?","Recommended for Irrigated within time - Lok-1, MP 1142, HI 1077 (Mangala), DL803-3 (kanchan), GW 190, GW 273, GW 322, MP 1142, GW 366, HI 8381 (Malavshree), HI 8498 (Malav shakti).","MADHYA PRADESH","WEST NIMAR(KHARGAON)","BHIKANGAON                                        ","2014-11-23 09:19:16.310"
"RABI","HORTICULTURE","Vegetables","Onion","	Plant Protection	","farmer want to know information about How to control of weed attack in onion  crop?","recommended for to control of weed attack in onion  crop oxyflorfen @80gm/acer.","MADHYA PRADESH","WEST NIMAR(KHARGAON)","KHARGONE                                          ","2014-11-23 10:07:03.077"
"RABI","HORTICULTURE","Vegetables","Chillies","	Plant Protection	","how to control leaf curl of chilly crop ?","Recommended for spray Thiamethaxam 70 % WS @ 5 gram per pump .","MADHYA PRADESH","WEST NIMAR(KHARGAON)","KASRAWAD                                          ","2014-11-23 10:33:42.870"
"RABI","HORTICULTURE","Vegetables","Chillies","	Plant Protection	","Farmer want to know information about      
sucking pest in chillies ?","Spray imidaclorprid 17.8%SL 5 to 6 ml per pump.","MADHYA PRADESH","WEST NIMAR(KHARGAON)","KHARGONE                                          ","2014-11-23 11:01:24.970"
"RABI","HORTICULTURE","Vegetables","Chillies","	Plant Protection	","Farmer want to know information about sucking pest in chilies ?","Spray imidaclorprid 17.8%SL 5 to 6 ml per pump.","MADHYA PRADESH","WEST NIMAR(KHARGAON)","BHIKANGAON                                        ","2014-11-23 11:05:58.190"
"RABI","HORTICULTURE","Vegetables","Chillies","	Plant Protection	","farmer want to know information about how to control sucking pest in chilli crop?","recommended for to control sucking pest  Spray any one of the following insecticides in the initial stage of infestation 
•	dimethoate 30 EC 500 ml/ha 
•	methyl demeton 25 EC@ 500 ml/ha.","MADHYA PRADESH","WEST NIMAR(KHARGAON)","BHIKANGAON                                        ","2014-11-23 11:12:43.960"
"RABI","AGRICULTURE","Cereals","Wheat","	Plant Protection	","farmer want to know information about seed treatment of wheat?","recommended for   seed treatment of wheat treat the seed with vitavex 3gm/kg of seed","MADHYA PRADESH","WEST NIMAR(KHARGAON)","BHIKANGAON                                        ","2014-11-23 11:15:58.513"
"RABI","AGRICULTURE","Others","Others","Government Schemes","FARMER WANT TO KNOW ABOUT govt. schemes of agriculture ?","Please contact your R.A.E.O officer or agriculture officer of block office or farmer welfare and agriculture development office of your district.","MADHYA PRADESH","WEST NIMAR(KHARGAON)","MAHESHWAR                                         ","2014-11-23 12:08:30.880"
"RABI","AGRICULTURE","Pulses","Bengal Gram (Gram/Chick Pea/Kabuli/Chana)","	Field Preparation	","I want number resister in mandi rate ?","your number number resister in mandi rate","MADHYA PRADESH","WEST NIMAR(KHARGAON)","BARWAH                                            ","2014-11-23 12:40:31.480"
"RABI","AGRICULTURE","Cereals","Wheat","Nutrient Management","Farmer want to know information about for better growth ?","Zinc Sulphate-8-10/acre","MADHYA PRADESH","WEST NIMAR(KHARGAON)","KHARGONE                                          ","2014-11-23 13:14:34.663"
"RABI","AGRICULTURE","Cereals","Wheat","	Plant Protection	","Farmer want to know information about control of soil born pest ?","Cartap Hyochlodrride 4 G @ 8-10kg/acre","MADHYA PRADESH","WEST NIMAR(KHARGAON)","KHARGONE                                          ","2014-11-23 13:31:23.880"
"RABI","AGRICULTURE","Others","Others","Market Information","Farmer want to know information about  number resister in mandi rate ?","your number has been registered for mandi rate and agriculture crop S.M.S. FACILITIES","MADHYA PRADESH","WEST NIMAR(KHARGAON)","GOGAWAN                                           ","2014-11-23 15:46:39.873"
"RABI","AGRICULTURE","Cereals","Wheat","Varieties","Farmer want to know information about   Varieties of Wheat crop?","Irrigated within time - Lok-1, MP 1142, HI 1077 (Mangala), DL803-3 (kanchan), GW 190, GW 273, GW 322, MP 1142, GW 366, HI 8381 (Malavshree), HI 8498 (Malav shakti).","MADHYA PRADESH","WEST NIMAR(KHARGAON)","BARWAH                                            ","2014-11-23 15:59:06.723"
"RABI","AGRICULTURE","Pulses","Bengal Gram (Gram/Chick Pea/Kabuli/Chana)","	Plant Protection	","Q. how to control of  wilt in gram crop ?","Ans= spray of veladimycin 15-20 ml per pump .","MADHYA PRADESH","WEST NIMAR(KHARGAON)","MAHESHWAR                                         ","2014-11-23 17:27:30.030"
"RABI","HORTICULTURE","Vegetables","Potato","	Plant Protection	","Yellow Mosaic in potato how we control it ?","Spray of Dimethoate or Metasistok @ 30 ML./pump.","MADHYA PRADESH","WEST NIMAR(KHARGAON)","BARWAH                                            ","2014-11-23 17:32:58.050"
"RABI","AGRICULTURE","Others","Others","Market Information","Farmer wants to start mandi rate facility on mobile phone?","Mandi rate facility has been successfully activated on your mobile phone.","MADHYA PRADESH","WEST NIMAR(KHARGAON)","GOGAWAN                                           ","2014-11-23 18:38:25.843"
"RABI","HORTICULTURE","Vegetables","Pea (Vegetable)","	Plant Protection	","FARMER WANT TO HOW KNOW TO CONTROL FUNGAL INFECTION IN PEA CROP ?","Recommended for spray Metalaxyl + Mencozeb @ 30 g/pump.","MADHYA PRADESH","WEST NIMAR(KHARGAON)","BARWAH                                            ","2014-11-23 19:39:03.460"
"RABI","AGRICULTURE","Cereals","Wheat","Fertilizer Use and Availability","Which fertilizer and nutrient give for better growth in wheat crop?","Recommended for spray foliar application of IFFCO 19:19:19 water soluble fertilizer @ 100 gm/pump.","MADHYA PRADESH","WEST NIMAR(KHARGAON)","BARWAH                                            ","2014-11-24 08:29:50.467"
"RABI","AGRICULTURE","Cereals","Wheat","	Plant Protection	","how to control of weeds in wheat crop?","spray of sulfosulfuron 13.5 gram/acre.","MADHYA PRADESH","WEST NIMAR(KHARGAON)","KHARGONE                                          ","2014-11-24 10:16:38.210"
"RABI","HORTICULTURE","Vegetables","Watermelon","Cultural Practices","what is the sowing time of water melon ?","ow the seeds on one side of the channel with a spacing of 0.9 m between hills. Thin the seedlings 2/hill at 15 days after sowing. Sowing during January – February enables harvest during summer months and fetches higher price.","MADHYA PRADESH","WEST NIMAR(KHARGAON)","KHARGONE                                          ","2014-11-24 10:34:44.183"
"RABI","AGRICULTURE","Pulses","Bengal Gram (Gram/Chick Pea/Kabuli/Chana)","Fertilizer Use and Availability","What is the recommended dose of fertilizer of chickpea?","a) Apply fertilizers basally before sowing.
Rainfed : 12.5 kg N(30kg Urea) + 25 kg P2O5(150kg SSP)  + 12.5 kg K2O (MOP 20kg) +10 kg S*/ha.
Irrigated : 25 kg N + 50 kg P2O5 + 25 kg K2O + 20 kg S*/ha
*Note : Applied in the form of gypsum, if Single Super Phosphate is not applied as a source of phosphorus.
b) Soil application of 25 kg ZnSo4/ha under irrigated condition.","MADHYA PRADESH","WEST NIMAR(KHARGAON)","KHARGONE                                          ","2014-11-24 10:35:46.133"
"RABI","AGRICULTURE","Cereals","Wheat","Varieties","farmer wants to information of Varieties of Wheat crop?","Irrigated within time - Lok-1, MP 1142, HI 1077 (Mangala), DL803-3 (kanchan), GW 190, GW 273, GW 322, MP 1142, GW 366, HI 8381 (Malavshree), HI 8498 (Malav shakti).","MADHYA PRADESH","WEST NIMAR(KHARGAON)","KASRAWAD                                          ","2014-11-24 11:12:46.983"
"RABI","HORTICULTURE","Vegetables","Chillies","	Plant Protection	","HOW TO control leaf curl of chilly crop ?","Recommended for spray Thiamethaxam 70 % WS @ 5 gram per pump .","MADHYA PRADESH","WEST NIMAR(KHARGAON)","KHARGONE                                          ","2014-11-24 11:27:48.210"
"RABI","AGRICULTURE","Cereals","Wheat","Seeds","Farmer want to know about Varieties of Wheat crop?","Recommended for Irrigated within time - Lok-1, MP 1142, HI 1077 (Mangala), DL803-3 (kanchan), GW 190, GW 273, GW 322, MP 1142, GW 366, HI 8381 (Malavshree), HI 8498 (Malav shakti).","MADHYA PRADESH","WEST NIMAR(KHARGAON)","BHIKANGAON                                        ","2014-11-24 11:43:41.433"
"RABI","HORTICULTURE","Vegetables","Chillies","	Plant Protection	","HOW TO CONTROL LEAF CURL OF CILLY CROP ?","Recommended for spray Thiamethaxam 70 % WS @ 5 gram per pump .","MADHYA PRADESH","WEST NIMAR(KHARGAON)","KHARGONE                                          ","2014-11-24 11:50:43.600"
"RABI","AGRICULTURE","Others","Others","Market Information","mandi rate of cotton ?","minimum  3880 ,maximum modal Rs / quantal","MADHYA PRADESH","WEST NIMAR(KHARGAON)","KHARGONE                                          ","2014-11-24 12:17:01.423"
"RABI","HORTICULTURE","Fruits","Papaya","	Plant Protection	","how to control mealy bug ?","Foliar application of Daichlorovas or Acciphate 2gm/lit of water.","MADHYA PRADESH","WEST NIMAR(KHARGAON)","BARWAH                                            ","2014-11-24 13:04:18.390"
"RABI","HORTICULTURE","Fruits","Papaya","	Plant Protection	","how to control mealy bug","Foliar application of Daichlorovas or Acciphate 2gm/lit of water.","MADHYA PRADESH","WEST NIMAR(KHARGAON)","BARWAH                                            ","2014-11-24 13:28:28.863"
"RABI","AGRICULTURE","Pulses","Bengal Gram (Gram/Chick Pea/Kabuli/Chana)","	Field Preparation	","How to control of fungal attack in gram  crop?","- validamycine 30 mili litre /16 litre of water spray","MADHYA PRADESH","WEST NIMAR(KHARGAON)","BARWAH                                            ","2014-11-24 13:35:32.200"
"RABI","AGRICULTURE","Cereals","Wheat","Weed Management","how to control weeds of wheat crop ?","spray Sulfosulfuron 75% WG 13.3 gram per acre .","MADHYA PRADESH","WEST NIMAR(KHARGAON)","KHARGONE                                          ","2014-11-24 14:18:17.520"
"RABI","HORTICULTURE","Vegetables","Chillies","	Plant Protection	","farmer want to know information about How to control of fungal attack in chilli crop?","recommended for to control of fungal attack in chilli crop use thiophinate mithyl 25 gram and streptocyclin 2 gram at 15 liter of water","MADHYA PRADESH","WEST NIMAR(KHARGAON)","BARWAH                                            ","2014-11-24 14:53:47.727"
"RABI","AGRICULTURE","Cereals","Wheat","	Plant Protection	","Fertilizer dose in wheat crop?","Urea 175 kg, DAP 109 kg and MOP 50 kg per hac.","MADHYA PRADESH","WEST NIMAR(KHARGAON)","KHARGONE                                          ","2014-11-24 15:00:20.743"
"RABI","AGRICULTURE","Others","Others","Weather","Farmer want to know information about  weather forecast  ?","no rainfall chances next 5 days in your district.","MADHYA PRADESH","WEST NIMAR(KHARGAON)","BARWAH                                            ","2014-11-24 15:00:26.007"
"RABI","HORTICULTURE","Vegetables","Chillies","	Plant Protection	","How to control  spider in chillies plant?","Propargite 57% EC (omite) 60 ml at per pump.","MADHYA PRADESH","WEST NIMAR(KHARGAON)","KASRAWAD                                          ","2014-11-24 15:14:12.717"
"RABI","AGRICULTURE","Cereals","Wheat","Market Information","farmer wants to information of mandi rate of wheat of bhikangaon mandi?","(Date-24/11/2014) mandi rate of wheat in bhikangaon mani- minimum price-1470 rs./quintal, maximum price- 1500 rs./quintal.","MADHYA PRADESH","WEST NIMAR(KHARGAON)","MAHESHWAR                                         ","2014-11-24 15:24:07.863"
"RABI","AGRICULTURE","Others","Others","Market Information","Farmer want to know information about  number resister in mandi rate and agriculture crops S.M.S. facilitiese ?","your number has been update registered for mandi rate and agriculture crops S.M.S. facilitiese.","MADHYA PRADESH","WEST NIMAR(KHARGAON)","KASRAWAD                                          ","2014-11-24 15:29:19.517"
"RABI","AGRICULTURE","Cereals","Wheat","	Plant Protection	","Farmer want to know information about  fungal attack in wheat?","Spray Tricyclazol, hexacorazol, propiconazol 20-25 ml per pump and steptrocyclin 2 to 3 gram per pump.","MADHYA PRADESH","WEST NIMAR(KHARGAON)","KHARGONE                                          ","2014-11-24 15:43:27.023"
"RABI","AGRICULTURE","Others","Others","Weather","Tell me weather information .","Chance of no rain next five days.","MADHYA PRADESH","WEST NIMAR(KHARGAON)","KASRAWAD                                          ","2014-11-24 15:55:52.177"
"RABI","AGRICULTURE","Others","Others","Market Information","Farmer want to know information about  number resister in mandi rate and agriculture crops S.M.S. facilitiese ?","your number has been update registered for mandi rate and agriculture crops S.M.S. facilitiese.","MADHYA PRADESH","WEST NIMAR(KHARGAON)","MAHESHWAR                                         ","2014-11-24 16:07:40.773"
"RABI","HORTICULTURE","Vegetables","Chillies","	Plant Protection	","How to control white fly in chillies crop?","Spray imidaclorprid 17.8%SL 5 to 6 ml per pump.and Plano fix 4 to 5 Ml at 15 liter of water","MADHYA PRADESH","WEST NIMAR(KHARGAON)","BARWAH                                            ","2014-11-24 16:17:09.900"
"RABI","AGRICULTURE","Cereals","Wheat","	Water Management	","farmer want to know information about WATER MANAGEMENT in wheat?","The crop requires 4 - 6 irrigations depending on the soil type and rainfall. Wheat crop requires minimum of 5 irrigations at the following critical stages.
I – Immediately after sowing
II – Crown root intiation : 15-20 DAS 
III- Active tillering stage : 35-40 DAS
IV- Flowering stage : 50-55 DAS
V- Grain filling stage : 70-75 DAS
Crown root initiation and flowering are the most critical stages. Water stagnation should be voided at the time of germination.","MADHYA PRADESH","WEST NIMAR(KHARGAON)","BARWAH                                            ","2014-11-24 16:23:08.083"
"RABI","AGRICULTURE","Others","Others","Fertilizer Use and Availability","Fertilizer dose in wheat crop?","Urea 175 kg, DAP 109 kg and MOP 50 kg per hac.","MADHYA PRADESH","WEST NIMAR(KHARGAON)","KASRAWAD                                          ","2014-11-24 17:02:28.280"
"RABI","AGRICULTURE","Others","Others","Market Information","Farmer wants to start mandi rate facility on mobile phone?","Mandi rate facility has been successfully activated on your mobile phone.","MADHYA PRADESH","WEST NIMAR(KHARGAON)","KASRAWAD                                          ","2014-11-24 17:06:07.330"
"RABI","AGRICULTURE","Others","Others","Weather","Tell me weather information .","Chance of no rain next five days.","MADHYA PRADESH","WEST NIMAR(KHARGAON)","BARWAH                                            ","2014-11-24 18:08:03.977"
"RABI","AGRICULTURE","Cereals","Wheat","	Plant Protection	","farmer want to know information about varieties of Wheat crop?","Irrigated within time - Lok-1, MP 1142, HI 1077 (Mangala), DL803-3 (kanchan), GW 190, GW 273, GW 322, MP 1142, GW 366, HI 8381 (Malavshree), HI 8498 (Malav shakti).","MADHYA PRADESH","WEST NIMAR(KHARGAON)","BHAGVANPURA                                       ","2014-11-24 18:44:33.450"
"RABI","AGRICULTURE","Others","Others","Market Information","Farmer wants to start mandi rate facility on mobile phone?","Mandi rate facility has been successfully activated on your mobile phone.","MADHYA PRADESH","WEST NIMAR(KHARGAON)","BARWAH                                            ","2014-11-24 18:50:59.197"
"RABI","AGRICULTURE","Others","Others","Market Information","Farmer wants to know about mandi rate of soyabean at Indore district of Madhya Pradesh?","Soyabean - 2800, 3230 ,3100 -Rs/Quintal Dear in your's Indore mandi the rate of soyabean crop is Rs. minimum/quintal Rs. maximum/quintal Rs. average/quintal.","MADHYA PRADESH","WEST NIMAR(KHARGAON)","BARWAH                                            ","2014-11-24 19:10:30.600"
"RABI","AGRICULTURE","Others","Others","Market Information","Farmer wants to know about mandi rate of soyabean at Indore district of Madhya Pradesh?","Soyabean - 2800, 3230 ,3100 -Rs/Quintal Dear in your's Indore mandi the rate of soyabean crop is Rs. minimum/quintal Rs. maximum/quintal Rs. average/quintal.","MADHYA PRADESH","WEST NIMAR(KHARGAON)","BARWAH                                            ","2014-11-24 19:10:31.257"
"RABI","AGRICULTURE","Others","Others","Market Information","Farmer want to know information to activate sms advisory scheme on mobile ?","To activate sms advisory scheme on your mobile number","MADHYA PRADESH","WEST NIMAR(KHARGAON)","KHARGONE                                          ","2014-11-24 20:50:46.713"
"RABI","HORTICULTURE","Vegetables","Chillies","	Plant Protection	","how to control of chillies thrips ?","rogor 35ml/pump + 50ml/pump neem oil spray","MADHYA PRADESH","WEST NIMAR(KHARGAON)","KHARGONE                                          ","2014-11-24 21:21:11.657"
"RABI","AGRICULTURE","Fiber Crops","Cotton (Kapas)","	Plant Protection	","Farmer want to how to control caterpillar of crop ?","Recommended for spray Queenolfos 25 EC 1000 Ml/ ha. .","MADHYA PRADESH","WEST NIMAR(KHARGAON)","KHARGONE                                          ","2014-11-25 07:15:51.400"
"RABI","AGRICULTURE","Pulses","Bengal Gram (Gram/Chick Pea/Kabuli/Chana)","	Plant Protection	","How to control of fungal attack in gram crop?","Recommended for thofinet mithail 30 gram per pump.","MADHYA PRADESH","WEST NIMAR(KHARGAON)","MAHESHWAR                                         ","2014-11-25 07:30:40.090"
"RABI","AGRICULTURE","Pulses","Bengal Gram (Gram/Chick Pea/Kabuli/Chana)","	Plant Protection	","How to control of fungal attack in gram crop?","Recommended for thofinet mithail 30 gram per pump.","MADHYA PRADESH","WEST NIMAR(KHARGAON)","MAHESHWAR                                         ","2014-11-25 07:32:55.160"
"RABI","AGRICULTURE","Sugar and Starch Crops","Sugarcane (Noble Cane)","Fertilizer Use and Availability","what is the fertilizer dose of sugarcane ?","100 kg NPK 12 : 32 : 16 & 50 kg urea at every 30 Days after plantin till than 120 days crop.","MADHYA PRADESH","WEST NIMAR(KHARGAON)","KASRAWAD                                          ","2014-11-25 07:38:52.000"
"RABI","AGRICULTURE","Pulses","Bengal Gram (Gram/Chick Pea/Kabuli/Chana)","	Plant Protection	","weed management in chickpea?","hand weeding is done in chickpea","MADHYA PRADESH","WEST NIMAR(KHARGAON)","MAHESHWAR                                         ","2014-11-25 08:00:08.527"
"RABI","HORTICULTURE","Vegetables","Chillies","	Plant Protection	","How to control white fly in chilli crop?","Recommended for Spray Dimethoate 30%EC (Rogar) 40 ml per pump.","MADHYA PRADESH","WEST NIMAR(KHARGAON)","KHARGONE                                          ","2014-11-25 08:18:54.083"
"RABI","AGRICULTURE","Others","Others","Market Information","Farmer want to know information about to activate sms advisory scheme ?","To activate sms advisory scheme on your mobile number","MADHYA PRADESH","WEST NIMAR(KHARGAON)","KHARGONE                                          ","2014-11-25 08:22:11.903"
"RABI","HORTICULTURE","Vegetables","Chillies","	Plant Protection	","How to control white fly in chilli crop?","Recommended for Spray Dimethoate 30%EC (Rogar) 40 ml per pump.","MADHYA PRADESH","WEST NIMAR(KHARGAON)","KHARGONE                                          ","2014-11-25 08:22:50.917"
"RABI","HORTICULTURE","Vegetables","Chillies","	Plant Protection	","how to control white fly of chilly crop ?","Recommended for spray Thiamethaxam 70 % WS @ 5 gram per pump .","MADHYA PRADESH","WEST NIMAR(KHARGAON)","KASRAWAD                                          ","2014-11-25 08:31:57.880"
"RABI","HORTICULTURE","Vegetables","Chillies","	Plant Protection	","How to control leaf curl of chilli ?","Collect and destroy infected virus plants as soon as they are noticed. If it is not possible spray the crop with systemic insecticides. Like Monocrotophos 1.5 ml or Dimethoate 2ml of Acephate 1g per litre of water.","MADHYA PRADESH","WEST NIMAR(KHARGAON)","BARWAH                                            ","2014-11-25 09:10:19.817"
"RABI","AGRICULTURE","Pulses","Bengal Gram (Gram/Chick Pea/Kabuli/Chana)","	Plant Protection	","How we control Wilt disease in gram ?","spray validamicin @ 20 gm/pump","MADHYA PRADESH","WEST NIMAR(KHARGAON)","BARWAH                                            ","2014-11-25 10:48:36.710"
"RABI","AGRICULTURE","Others","Others","Market Information","Farmer  want number resister in mandi rate ?","your number register in mandi rate .","MADHYA PRADESH","WEST NIMAR(KHARGAON)","KASRAWAD                                          ","2014-11-25 11:11:51.187"
"RABI","AGRICULTURE","Cereals","Wheat","	Plant Protection	","what is fertilizer dose of wheat crop ?","Urea260 ,Super Phosphate 375, Potash 50 kilogram per hectore FOR wheat CROP .","MADHYA PRADESH","WEST NIMAR(KHARGAON)","KASRAWAD                                          ","2014-11-25 11:46:48.477"
"RABI","AGRICULTURE","Fiber Crops","Cotton (Kapas)","Market Information","Farmer wants to know about mandi rate of cotton at khargone district of Madhya","Dear in your's khargone mandi the rate of cotton crop is Rs.3780 minimum/quintal Rs.4055 maximum/quintal Rs. 4000average/quintal.","MADHYA PRADESH","WEST NIMAR(KHARGAON)","BHIKANGAON                                        ","2014-11-25 11:49:25.610"
"RABI","AGRICULTURE","Fiber Crops","Cotton (Kapas)","Government Schemes","Want to know about govt. scheme ?","please contact RAEO/ADO for more information ..","MADHYA PRADESH","WEST NIMAR(KHARGAON)","GOGAWAN                                           ","2014-11-25 12:24:58.160"
"RABI","AGRICULTURE","Others","Others","Government Schemes","Agriculture government schemes information?","Please contact your RAEO","MADHYA PRADESH","WEST NIMAR(KHARGAON)","BARWAH                                            ","2014-11-25 12:25:33.730"
"RABI","HORTICULTURE","Vegetables","Chillies","	Plant Protection	","How to control white fly in chilli crop?","Recommended for Spray Dimethoate 30%EC (Rogar) 40 ml per pump.","MADHYA PRADESH","WEST NIMAR(KHARGAON)","BARWAH                                            ","2014-11-25 12:41:24.290"
"RABI","AGRICULTURE","Pulses","Bengal Gram (Gram/Chick Pea/Kabuli/Chana)","	Plant Protection	","Farmer want to know information about control of pest at gram ?","Profenofos 40% + Cypermrthrin 4%(30-35ml/pump)300-350ml/acre","MADHYA PRADESH","WEST NIMAR(KHARGAON)","KASRAWAD                                          ","2014-11-25 12:49:46.747"
"RABI","HORTICULTURE","Condiments and Spices","Fenugreek","Seeds and Planting Material","TIME OF SOWING FENUGREEK ?","Season: June - July and October - November","MADHYA PRADESH","WEST NIMAR(KHARGAON)","BARWAH                                            ","2014-11-25 13:02:39.620"
"RABI","HORTICULTURE","Vegetables","Chillies","	Plant Protection	","farmer want to know information about How to control of fungal attack in chilly crop ?","Use copper oxy chloride  50% w  45 gram and steptrocyclin  90% w/w 2 gram at 15 liter of water","MADHYA PRADESH","WEST NIMAR(KHARGAON)","BHIKANGAON                                        ","2014-11-25 13:09:27.587"
"RABI","AGRICULTURE","Others","Others","	Plant Protection	","weedicide","Preferably 1 or 2 hand hoeing at 1 and 2 months after sowing or pre emergence (1-2 DAS) pendimethaline @ 1 kg a.i/ha.","MADHYA PRADESH","WEST NIMAR(KHARGAON)","KHARGONE                                          ","2014-11-25 13:25:38.750"
"RABI","AGRICULTURE","Cereals","Wheat","Market Information","farmer want to know information about Which fertilizer and nutrient give for better growth in wheat  crop?","Spray N: P: K 19:19:19 100 grams /15 liter of water.","MADHYA PRADESH","WEST NIMAR(KHARGAON)","KASRAWAD                                          ","2014-11-25 14:09:29.620"
